text_id:ID,original_text,:LABEL,embedding:STRING
eca182df58480ee45be545ef72c0bde4da059be11ebd4af8f29ca3f6c0ee722c,"barely perceptible, but one that Alex noted with an inward nod. They had all been brought here by different paths and for different reasons. Yet, beneath the veneer of duty, the enticement of the vast unknown pulled them inexorably together, coalescing their distinct desires into a shared pulse of anticipation.

Marshaled back to the moment by the blink of lights and whir of machinery, they refocused their efforts, each movement sharpened by the knowledge that beyond understanding the unearthly artifacts, they might be piecing together the future of their species.

Amidst the sterility of the briefing room, the liminal space between the facts laid out and the hidden truths, sat Sam Rivera, his demeanor an artful balance of focus and a casual disguise of his razor-sharp talent with technology. Across from him, Alex Mercer lingered in thought, the mental cogs turning as each file on Dulce stirred more than curiosity—it beckoned to a past both honored and burdensome.

'You've been quiet, Sam,' Alex noted, catching the younger man's contemplative gaze. 'Your take on these signal inconsistencies?'

There was a respect in Alex's tone, though a respectful distance remained—a gulf of experience and a hint of protective mentorship that stood between them. Sam nodded, recognizing the space afforded to him, and he couldn't help but feel the weight of expectation pressing upon his shoulders. It wasn't just the mission that was immense, it was the trust being placed in him.

'The patterns are... off,' Sam admitted, hesitant but driven. 'If I'm right, what we're looking at isn't random—it's a structured anomaly. We need to be ready for anything.'

Alex's eyes brightened with a subtle approval that crossed the distance like a silent nod. 'Good. Keen eyes will keep us ahead—or at least not blindsided,' he said, affirming the belief that inscribed Sam's role as more than the tech personnel—he was to be a guiding intellect in the heart of uncertainty.

Their exchange was cut short by Taylor Cruz's abrupt arrival, his gait brimming with a robust confidence that veiled the sharp undercurrents of his striving nature. 'Time to gear up. Dulce waits for no one,' Taylor announced, his voice carrying an iron resolve that knew the costs of hesitation—though whether the cost was calculated in human or career terms was an ambiguity he wore like a badge of honor.

As Sam and Alex nodded in unison, the icy chasm of hierarchy and cryptic protocols seemed momentarily to bridge over with an understanding—this mission was convergence, a nexus point that would challenge each of their motives and strength.

They filed out of the briefing room, their footsteps synchronized, a rhythm that spoke volumes of the unknown cadence they would soon march to within the base's veins. For Alex Mercer, the link with Sam Rivera, though distant, was now poised with a mutuality ready t",Text,"[-0.05449938774108887, -0.01087724044919014, 0.024507641792297363, -0.03541465848684311, 0.03776457905769348, 0.007424388080835342, 0.026891106739640236, -0.016235286369919777, -0.004721023142337799, 0.08377853035926819, 0.022558577358722687, -0.05342172086238861, 0.05022050440311432, -0.02956569194793701, 0.03703748807311058, -0.040559448301792145, -0.11363464593887329, -0.024853097274899483, -0.017013870179653168, -0.04094035178422928, 0.04146669805049896, -0.07155440002679825, 0.05448407307267189, -0.06538668274879456, -0.03755565732717514, 0.0371243879199028, -0.001719459774903953, 0.06198183447122574, -0.08921675384044647, -0.05579814314842224, 0.11279486864805222, -0.01493974681943655, 0.08694983273744583, 0.04364250227808952, 0.03697163984179497, -0.036206748336553574, -0.05077718570828438, -0.00459115207195282, -0.03958706930279732, -0.0210373867303133, -0.018572257831692696, -0.07252949476242065, 0.029987594112753868, 0.053726937621831894, 0.05415385589003563, 0.014727024361491203, 0.03960701450705528, 0.011524231173098087, 0.05360909178853035, -0.01964142732322216, 0.039546649903059006, 0.0011460892856121063, -0.015803715214133263, 0.02806720696389675, 0.010625692084431648, 0.005027495790272951, -0.07879873365163803, 0.028310013934969902, 0.007152254227548838, 0.061519406735897064, 0.000301854161079973, 0.016907259821891785, 0.036224160343408585, -0.0268549844622612, -0.018907425925135612, 1.394926403008867e-05, -0.0035182926803827286, -0.17395733296871185, -0.028927303850650787, -0.05219312012195587, -0.04787703976035118, 0.03382449224591255, 0.005974526051431894, -0.019829601049423218, 0.04598231986165047, 0.05249674618244171, 0.006306146737188101, -0.06430328637361526, -0.02371903695166111, -0.012183834798634052, -0.1335930973291397, -0.06183044612407684, -0.02971689961850643, 0.04429366812109947, 0.04513154923915863, 0.024093179032206535, -0.01048181764781475, 0.026459475979208946, 0.010556378401815891, -0.0212343018501997, -0.0214947909116745, -0.025313368067145348, -0.043101172894239426, -0.022181237116456032, -0.14764602482318878, 0.014287572354078293, 0.016946831718087196, -0.07862792909145355, -0.01940062828361988, 0.14720316231250763, 0.025276487693190575, 0.058943990617990494, -0.08215402811765671, 0.02530009113252163, -0.00205304310657084, -0.06218011677265167, -0.0029937743674963713, -0.0026763707865029573, 0.0033873403444886208, -0.058092065155506134, -0.004500238690525293, -0.06003673002123833, 0.004436205141246319, 0.019507262855768204, 0.07074344903230667, -0.05290645733475685, -0.054997753351926804, 0.009719043970108032, -0.08003703504800797, -0.02409134991466999, 0.00036093351081945, -0.04339532554149628, -0.021225694566965103, -0.004005327355116606, 0.013996771536767483, -0.15204495191574097, -0.0019101847428828478, 0.022136833518743515, -0.00830734521150589, 0.017085842788219452, 0.05474163964390755, -0.033365458250045776, -0.006744176149368286, 0.06160954385995865, -0.049740348011255264, 0.04088661074638367, 0.02483437955379486, 0.10406903177499771, -0.05289874225854874, -0.007866600528359413, 0.038025740534067154, 0.129744753241539, 0.038001421838998795, -0.0546705536544323, -0.01159324124455452, -0.0013957787305116653, 0.00970442034304142, -0.03024483099579811, 0.03513001650571823, 0.06798851490020752, 0.028676548972725868, -0.09370561689138412, 0.009808013215661049, 0.062454767525196075, -0.01467462070286274, 0.051019687205553055, 0.07508176565170288, 0.023773780092597008, 0.002843021648004651, -0.02471879869699478, -0.03205922991037369, 0.014014007523655891, 0.03971998393535614, -0.023805581033229828, 0.059432320296764374, 0.01824505627155304, -0.09966184198856354, 0.005621378310024738, -0.0022918288595974445, -0.027622230350971222, -0.036978770047426224, -0.018294520676136017, 0.009756738319993019, -0.0010244603035971522, -0.004545613657683134, 0.012755307368934155, 0.10474441200494766, 0.06579853594303131, -0.012691804207861423, -0.017069635912775993, 0.006442601792514324, -0.0814659595489502, -0.028915252536535263, -0.005616098176687956, 0.031546179205179214, 0.0735757127404213, -0.019921667873859406, -0.03558783605694771, 0.08084318041801453, 0.042004890739917755, 0.06947282701730728, -0.00020514092466328293, -0.010326584801077843, 0.04749634116888046, -0.01909819431602955, -0.04841940477490425, -0.028019392862915993, 0.021351316943764687, -0.025762351229786873, 0.03144041821360588, 0.01675681211054325, 0.05973297357559204, -0.007621088996529579, 0.04893475025892258, -0.05760035291314125, 0.04049907997250557, -0.013053277507424355, 0.06363952904939651, -0.022310394793748856, 0.03261836990714073, 0.008752870373427868, -0.01529778353869915, -0.018046164885163307, -0.016698425635695457, -0.024073028936982155, -0.009393841028213501, 0.1225496456027031, -0.0376015231013298, -0.02836604416370392, -0.021854721009731293, 0.053218692541122437, -0.058245427906513214, -0.03495969995856285, 9.921484561627044e-33, -0.024133188650012016, -0.008372049778699875, -0.02766982652246952, -0.05641969293355942, -0.03237421065568924, -0.06561344861984253, 0.06616703420877457, 0.12320122122764587, 0.033537860959768295, 0.04588650166988373, 0.02571875788271427, -0.009621254168450832, 0.055482879281044006, -0.1284557431936264, -0.02622520923614502, 0.039408206939697266, -0.07902364432811737, 0.05020201578736305, 0.01160391140729189, 0.04112448915839195, -0.04163995757699013, 0.10013139992952347, 0.03254759684205055, 0.08632007241249084, -0.0537082701921463, 0.033331070095300674, 0.06470848619937897, -0.0362628735601902, -0.07157856225967407, -0.017107224091887474, -0.00741291930899024, 0.0026916153728961945, -0.06386487931013107, 0.1276315599679947, -0.01622515730559826, -0.0800577700138092, 0.040557924658060074, 0.004376709461212158, -0.01394761074334383, -0.018779044970870018, 0.0025301205459982157, 0.03411238268017769, -0.053407393395900726, 0.027785686776041985, -0.011306819505989552, 0.039723291993141174, 0.05353371053934097, 0.026400715112686157, -8.226362842833623e-05, 0.06368095427751541, -0.01392938382923603, -0.06795764714479446, 0.0376637764275074, -0.04678471013903618, 0.10961932688951492, 0.0759856104850769, 0.009601052850484848, 0.07178482413291931, 0.06964749842882156, -0.034954167902469635, -0.06495092809200287, -0.052216533571481705, 0.053182993084192276, 0.057539694011211395, 0.022307729348540306, -0.04153759777545929, -0.040026549249887466, 0.03010675311088562, -0.10876169800758362, 0.013460151851177216, -0.00031666469294577837, 0.0061289179138839245, -0.051018208265304565, 0.060358550399541855, -0.037613969296216965, -0.005437686573714018, 0.07414545118808746, 0.03541896864771843, -0.04131009429693222, 0.061671070754528046, -0.11199475824832916, 0.01964334025979042, -0.007136922795325518, -0.00023588626936543733, 0.027113303542137146, -0.00036667013773694634, 0.06467165052890778, 0.008542568422853947, -0.016144737601280212, -0.019905339926481247, 0.03170620650053024, 0.07103607058525085, -0.054049309343099594, 0.008318760432302952, -0.03799620643258095, 7.350045853481165e-32, 0.018899520859122276, -0.008184351027011871, -0.060442227870225906, -0.022798851132392883, 0.12688902020454407, 0.02535039745271206, -0.04178864136338234, -0.08490749448537827, -0.058216068893671036, -0.13530567288398743, 0.1115918904542923, -0.007937956601381302, -0.19862119853496552, 0.02073133923113346, 0.01804790087044239, -0.027769049629569054, -0.04905528202652931, 0.01607195846736431, 0.0015429656486958265, -0.02832181006669998, 0.0509038120508194, -0.017518064007163048, -0.034467361867427826, -0.042156558483839035, 0.028318600729107857, 0.07149070501327515, 0.07365003973245621, 0.08364265412092209, 0.0059095402248203754, -0.03443819656968117, -0.0020949337631464005, -0.03045477718114853, -0.04150346294045448, -0.08091146498918533, -0.09403993934392929, 0.04691213369369507, 0.0986887514591217, 0.02059725858271122, -0.005118785426020622, -0.004522205330431461, 0.025079108774662018, -0.013689675368368626, -0.025840505957603455, 0.028416136279702187, -0.04270688444375992, -0.030066613107919693, -0.028458185493946075, -0.054007772356271744, 0.0071138646453619, -0.03765729442238808, -0.0946960300207138, -0.06682400405406952, 0.04594099149107933, -0.057720184326171875, -0.010851718485355377, -0.0384429506957531, -0.050806932151317596, 0.009561518207192421, -0.01945549063384533, 0.029037440195679665, 0.10353495180606842, 0.023582248017191887, 0.023910818621516228, 0.008499355986714363]"
9f47d2a83c42583bc8a2dde60a75cf112e4a3c8f73d73cbf725504cf314f55ca,"o be tested; for Taylor Cruz, the initiative pulsed like a heartbeat, anticipation thinly veiled behind a mask of duty.

In the midst of the descent, they were each alone yet irrevocably joined, stepping closer towards the volatile embrace of Operation: Dulce.",Text,"[-0.008461219258606434, 0.007828067988157272, 0.022545520216226578, -0.011401966214179993, 0.03837126865983009, 0.0415031723678112, 0.004194185137748718, -0.002088963519781828, -0.026730766519904137, 0.09824204444885254, -0.007950160652399063, -0.05314403399825096, 0.08920582383871078, 0.011364692822098732, 0.02279750071465969, -0.051884960383176804, -0.0750647708773613, -0.04760514199733734, -0.04647564888000488, -0.01815919764339924, 0.016165854409337044, -0.06655870378017426, 0.016872940585017204, -0.0425102636218071, -0.009266124106943607, 0.004817938897758722, -0.032075732946395874, 0.04793614149093628, -0.06670565158128738, -0.03996916115283966, 0.09190387278795242, 0.04240264743566513, 0.08478281646966934, 0.01288016140460968, 0.0498039536178112, -0.0646972730755806, -0.043016932904720306, -0.03799934312701225, -0.04800525680184364, -0.0361378975212574, -0.04982447251677513, -0.04103846102952957, 0.056503426283597946, 0.06464459747076035, 0.04336396977305412, 0.004099739249795675, 0.051659561693668365, 0.07987417280673981, 0.03623512014746666, -0.028109757229685783, -0.0017139182891696692, -0.014557335525751114, -0.027669604867696762, 0.02758808434009552, 0.01636010780930519, -0.03564731031656265, -0.0651012510061264, 0.042867302894592285, -0.0012566234217956662, 0.060050781816244125, 0.002141058910638094, -0.05774799734354019, -0.006037105806171894, -0.04878001660108566, -0.03189632296562195, 0.008576060645282269, -0.012263915501534939, -0.1634962409734726, -0.06206245347857475, -0.030361583456397057, -0.06011267751455307, 0.04317176342010498, 0.0548233799636364, 0.02302424982190132, 0.08814660459756851, 0.08188700675964355, -0.012516649439930916, -0.020617928355932236, -0.040042635053396225, -0.008649485185742378, -0.07469753921031952, 0.02384888380765915, 0.010016011074185371, 0.008709998801350594, 0.03974437713623047, 0.06196112558245659, -0.026957720518112183, 0.05222218483686447, 0.03244301304221153, -0.0522916354238987, 0.01355886273086071, 0.008555740118026733, -0.09399331361055374, -0.04239928722381592, -0.21218076348304749, 0.02543853595852852, -0.016799837350845337, -0.06017989665269852, -0.04254141077399254, 0.1706794649362564, 0.0432497002184391, 0.019649028778076172, -0.06603346019983292, 0.004014418460428715, -0.007724754046648741, -0.01655864156782627, 0.04248011112213135, 0.02076195739209652, 0.006470088846981525, -0.07240723818540573, -0.02635077014565468, -0.021323760971426964, 0.03394157811999321, 0.021143801510334015, 0.05380118638277054, -0.016266828402876854, -0.08472661674022675, -0.025903960689902306, -0.11990313231945038, -0.00785901304334402, -0.017164982855319977, -0.058096036314964294, -0.033390142023563385, -0.009247629903256893, -0.026384366676211357, -0.14636752009391785, 0.006243469659239054, 0.052515991032123566, -0.016192365437746048, 0.03243383765220642, 0.08953128755092621, 0.015117191709578037, 0.009373548440635204, 0.05007951706647873, -0.014895099215209484, 0.01928134448826313, 0.009816651232540607, 0.023964544758200645, -0.01686667464673519, -0.030153587460517883, 0.0037482252810150385, 0.12705783545970917, 0.033797748386859894, -0.015492675825953484, 0.028742769733071327, 0.010827211663126945, 0.022751767188310623, -0.0014423794345930219, 0.05856006592512131, 0.06882835924625397, 0.041160278022289276, -0.06710298359394073, 0.03821420297026634, 0.03207213804125786, -0.011568253859877586, 0.09547612071037292, 0.08480661362409592, 0.04908817633986473, -0.07621308416128159, -0.02970942109823227, -0.08522658795118332, 0.033353108912706375, 0.07798950374126434, -0.002515732543542981, 0.07925176620483398, 0.03615610674023628, -0.032890040427446365, -0.025693008676171303, -0.013333895243704319, -0.03704511746764183, -0.0662502720952034, 0.01093185506761074, 0.008878552354872227, -0.00795157253742218, 0.0009245165856555104, -0.03441973030567169, 0.06182510778307915, 0.02139248140156269, -0.008578073233366013, -0.0062112510204315186, 0.018655722960829735, -0.030440649017691612, -0.04337606579065323, -0.04425883665680885, 0.013447785750031471, 0.01953442580997944, -0.009652681648731232, -0.01695406436920166, 0.07924605160951614, -0.003957046661525965, 0.0914074033498764, -0.0010990368900820613, -0.03470177575945854, 0.006313091143965721, -0.006303342524915934, -0.017291415482759476, 0.014414542354643345, 0.030871380120515823, -0.009984171018004417, -0.024601100012660027, 0.005385964177548885, 0.06842004507780075, -0.0023431151639670134, -0.004040893632918596, -0.02347373031079769, 0.022987712174654007, -0.006778079085052013, 0.004608423449099064, 0.028774088248610497, 0.013816272839903831, -0.027999771758913994, 0.017815396189689636, -0.02547714300453663, 0.020629312843084335, -0.04594908654689789, -0.003942959941923618, 0.08101188391447067, -0.03262868523597717, -0.05956301838159561, -0.03357025235891342, 0.07216235250234604, -0.10377451032400131, -0.03812218829989433, 9.916944949380962e-33, -0.062009502202272415, -0.009926396422088146, -0.041712719947099686, -0.018137354403734207, -0.06973280757665634, -0.03235619515180588, 0.0684293881058693, 0.13144715130329132, 0.03225891292095184, -0.0012650967109948397, 0.03680610656738281, 0.036205556243658066, 0.04226791858673096, -0.09226428717374802, -0.06174483522772789, 0.03591248020529747, -0.06138065084815025, 0.055630773305892944, 0.02217784710228443, 0.03976482152938843, -0.015311647206544876, 0.07617015391588211, -0.029765622690320015, 0.13097579777240753, -0.05425911024212837, 0.009031428955495358, 0.019631342962384224, -0.05354396998882294, -0.07598229497671127, 0.04240644350647926, 0.0030031066853553057, 0.002941613318398595, -0.09622843563556671, 0.086745984852314, -0.0277315191924572, -0.09166940301656723, 0.03902359679341316, 0.014962834306061268, 0.0028737180400639772, -0.055488523095846176, 0.0321013443171978, 0.019130120053887367, -0.05631399154663086, 0.026498323306441307, -0.06411112844944, 0.04004480317234993, 0.0400020107626915, 0.020046431571245193, 0.006311132572591305, 0.03325318917632103, 0.03141175955533981, -0.06541524827480316, 0.012915346771478653, -0.04242134094238281, 0.04851638153195381, 0.07838309556245804, 0.014662770554423332, -0.01374899409711361, 0.07770677655935287, -0.04002126306295395, -0.09542884677648544, -0.05703805387020111, 0.010272474028170109, 0.04570893943309784, 0.02293321304023266, -0.044543441385030746, -0.0830998495221138, 0.08248301595449448, -0.03191070631146431, 0.01431993581354618, 0.013350925408303738, 0.08187032490968704, -0.07169821113348007, 0.0707143247127533, -0.03391961008310318, -0.03228972107172012, 0.06345081329345703, 0.044916849583387375, -0.03593438118696213, 0.05881759524345398, -0.07280135899782181, 0.0015349281020462513, 0.0017497304361313581, -0.010838907212018967, 0.019848627969622612, -0.01493834052234888, 0.0889720469713211, -0.008840104565024376, -0.05551719292998314, 0.0009987781522795558, 0.02332957834005356, 0.07615244388580322, -0.02011243999004364, 0.01248293649405241, -6.275530904531479e-05, 5.39013060417013e-32, 0.05301925167441368, -0.018975015729665756, -0.08001888543367386, -0.028758840635418892, 0.09125007688999176, 0.010204976424574852, -0.05838872492313385, -0.1210879310965538, -0.015679428353905678, -0.07118625193834305, 0.0873827189207077, -0.008599119260907173, -0.11102540791034698, 0.04310278221964836, 0.015476853586733341, -0.05639998987317085, -0.00625550327822566, 0.015826739370822906, -0.008649677038192749, 0.007280604913830757, 0.05579640716314316, 0.006256915628910065, -0.01951681636273861, -0.036629658192396164, 0.027731016278266907, 0.06055621802806854, 0.08726174384355545, 0.10382582247257233, 0.004055695608258247, -0.018735196441411972, -0.017427688464522362, -0.042470842599868774, -0.035100579261779785, -0.11782970279455185, -0.053987227380275726, 0.09590492397546768, 0.13587644696235657, -0.022835785523056984, 0.024908730760216713, -0.009274723008275032, 0.07697675377130508, -0.024978527799248695, -0.03460397943854332, -0.004259482957422733, -0.018025074154138565, -0.06070603430271149, 0.01987876184284687, -0.025694290176033974, 0.040001824498176575, -0.09754282981157303, -0.09217670559883118, -0.019892975687980652, -0.025338247418403625, -0.07201962918043137, 0.010436217300593853, 0.004162756260484457, -0.020243026316165924, 0.01767778769135475, 0.006841074209660292, 0.013657196424901485, 0.11012595891952515, 0.0194560419768095, 0.020007561892271042, 0.001752095646224916]"
