text_id:ID,original_text,:LABEL,embedding:STRING
d87c09a958658adb37a50ee6b087161db224f3af4c071ada5b027f6b1a983d5a,"rehension. 'This feels like more than a rescue or reconnaissance mission, doesn't it?'

Alex turned, his features a mask of uneasy resolve.'It's like we're being pulled into someone else’s game. Not just observers or participants, but... pawns.'

Jordan gave a short nod, their analytical mind colliding with the uncertain dynamics of this operation. 'I've felt that way since the briefing. Like there's a layer we’re not seeing. And yet, we have no choice but to play along.' Their eyes locked with Alex's, silently exchanging a vow to remain vigilant.

'You two need to cut the philosophical chatter. We have positions to secure,' Taylor Cruz interjected sharply, stepping into their exchange. The authority in Taylor's voice brooked no argument; it was their way of pulling everyone back to the now.

Alex's response was measured, more assertive than moments ago. 'Acknowledged, Agent Cruz,' he replied, his voice steadier, mirroring the transformation brewing within. He gripped his rifle with a newfound firmness. 'Let's proceed.'

As they congregated at the elevator, a tension palpable, Sam Rivera piped in with a tone of balanced levity, 'Hope everyone’s brought their good luck charms. Something tells me we’re going to need all the help we can get.'

Their laughter served as a brief respite from the gravity of their mission, a shared moment that reinforced their common humanity amidst the unknowable. Then, as one, they stepped into the elevator. The doors closed with a silent hiss, and they descended into the darkness together, aware that when they returned, if they returned, none of them would be the same.

The sense of foreboding hung heavier than the darkness that the artificial lights of the elevator shaft failed to fully penetrate. The team was descending into the earth, carrying with them not only the weight of their equipment but also the silent pressure of the invisible war they were about to fight—a war that seemed to edge away from physicality and into the unnervingly psychological.

As they descended, Dr. Jordan Hayes couldn't help but muse over the layers of data that could wait below, now almost longing for the comfort of empirical evidence. _To think that this reluctance to accept other possibilities may have been my biggest blind spot,_ Jordan contemplated, feeling the hard shell of skepticism begin to crack.

Alex caught Jordan's reflective gaze and leaned in, his voice barely a murmur over the hum of the elevator. 'Once we're down there, keep that analytical edge sharp. You see through the mazes of the unexplained better than anyone.'The compliment was unexpected and weighed differently than praise from others. This was an acknowledgment from someone who stood on the front lines of the unknown with eyes wide open. 'Thank you, Alex,' Jordan said, the words carrying a trace of newfound assertiveness. 'You can count on me.'

The",Text,"[-0.05763282999396324, -0.02296852134168148, 0.030154507607221603, -0.058434728533029556, 0.015528226271271706, 0.05623668432235718, -0.00412012217566371, -0.02938251569867134, -0.0491662472486496, 0.07119125872850418, 0.03364745154976845, -0.038895219564437866, 0.03181977570056915, 8.088911999948323e-05, -0.008731411769986153, -0.036910783499479294, -0.059631459414958954, -0.045258961617946625, -0.025616344064474106, -0.015512393787503242, 0.05531582608819008, -0.10068289190530777, 0.05221345275640488, -0.057746171951293945, 0.02571730688214302, 0.0023952240590006113, 0.015437254682183266, 0.04796181991696358, -0.045286089181900024, -0.02381550893187523, 0.061046160757541656, -0.018631402403116226, 0.05462519824504852, 0.015301533974707127, 0.08811669051647186, -0.07168907672166824, -0.04364648461341858, -0.003200606210157275, -0.04864467307925224, -0.05165276303887367, -0.045172177255153656, -0.08637842535972595, 0.06983856111764908, 0.07728813588619232, 0.05304207280278206, 0.020342009142041206, 0.05013107880949974, 0.03298263996839523, 0.059396665543317795, 0.006197566166520119, 0.03106277994811535, 0.04111295938491821, -0.04540330171585083, 0.005316694267094135, 0.012666107155382633, -0.02569512650370598, -0.012094818986952305, 0.0449008047580719, 0.05867436155676842, 0.022590074688196182, 0.013203294016420841, -0.014293183572590351, -0.03899502754211426, -0.0411851592361927, -0.00593294482678175, -0.002201739465817809, -0.003919712733477354, -0.16608001291751862, -0.07591887563467026, -0.0255080945789814, -0.06483044475317001, 0.029525617137551308, 0.0405900701880455, -0.02601139061152935, 0.0789429098367691, 0.052640657871961594, 0.0020847434643656015, -0.0643945261836052, 0.026853712275624275, -0.002750614657998085, -0.08501718193292618, 0.025071166455745697, 0.019374269992113113, 0.02334655448794365, 0.03955927491188049, 0.057571910321712494, -0.04425284266471863, 0.06872504204511642, 0.04389438405632973, -0.030853532254695892, 0.05434560403227806, -0.016953041777014732, -0.10858644545078278, -0.015892524272203445, -0.17852270603179932, 0.017954805865883827, 0.016754623502492905, -0.10481757670640945, -0.004743514116853476, 0.15964996814727783, 0.06274682283401489, 0.04240616783499718, -0.03095529042184353, 0.02471780963242054, 0.006149685475975275, -0.0633242130279541, -0.015683162957429886, 0.00147627096157521, 0.020612116903066635, -0.08467260748147964, 0.0036833423655480146, -0.054383665323257446, 0.013219276443123817, 0.018603267148137093, 0.03461573272943497, -0.02984251081943512, -0.05742330849170685, -0.012612583115696907, -0.13221190869808197, -0.005985694006085396, -0.022139281034469604, -0.08913486450910568, -0.0410882867872715, 0.02646024338901043, -0.022237546741962433, -0.11806081980466843, -0.03169151768088341, 0.049451589584350586, -0.0158738624304533, -0.00965734850615263, 0.06891270726919174, -0.03424554318189621, 0.032852016389369965, 0.042685434222221375, -0.05693432688713074, -0.013010887429118156, -0.009473288431763649, 0.04610266536474228, -0.007734447252005339, -0.04423518478870392, -0.0347999632358551, 0.1369362324476242, 0.015916142612695694, -0.030747590586543083, 0.012004420161247253, 0.0039387294091284275, -0.00798235647380352, 0.0009839992271736264, 0.09103880077600479, 0.06916787475347519, 0.038836609572172165, -0.0651705414056778, 0.03111770935356617, 0.08673965930938721, -0.011390561237931252, 0.10036073625087738, 0.09185779839754105, 0.029322730377316475, -0.010533141903579235, -0.0032985773868858814, -0.03284782916307449, 0.02397891692817211, 0.08563726395368576, 0.0028546927496790886, 0.056939832866191864, 0.04550282657146454, -0.04066581651568413, -0.003683709306642413, 0.044514574110507965, -0.060356318950653076, -0.08622466772794724, -0.05470285192131996, 0.012890681624412537, -0.009091038256883621, 0.0069928597658872604, -0.05119737982749939, 0.11567588895559311, 0.08805346488952637, -0.005490798037499189, 0.01700819842517376, 0.0018210508860647678, -0.03069476969540119, -0.060659199953079224, -0.035456568002700806, 0.01582525297999382, 0.03757743909955025, -0.024501824751496315, 0.034215573221445084, 0.05282088741660118, 0.050122637301683426, 0.042360614985227585, -0.00581044377759099, 0.004326932597905397, -0.009090234525501728, -0.025091391056776047, -0.05363854393362999, -0.012055233120918274, -0.03093228116631508, -0.03719504922628403, 0.015825806185603142, 0.014915303327143192, 0.07479763776063919, -0.018380751833319664, -0.031410183757543564, -0.030061356723308563, 0.010773027315735817, 0.004009169526398182, 0.018198080360889435, -0.037807852029800415, 0.011097383685410023, -0.01266583614051342, 0.003883130382746458, -0.05157751590013504, -0.023717666044831276, 0.0021707091946154833, -0.038977473974227905, 0.08279410749673843, -0.017979679629206657, -0.04965198412537575, -0.04940493032336235, 0.05121400207281113, -0.08401115983724594, -0.04696226865053177, 9.462985194140718e-33, -0.09303215891122818, -0.009768828749656677, -0.018639037385582924, -0.023933937773108482, -0.06148527190089226, -0.05792086943984032, 0.056842874735593796, 0.11991878598928452, 0.028770942240953445, -0.005545108113437891, 0.030720071867108345, 0.0454757921397686, 0.05782276764512062, -0.09776792675256729, 0.007008712738752365, 0.07351985573768616, -0.07288436591625214, 0.029149020090699196, 0.029259582981467247, -0.0017485490534454584, -0.03946705535054207, 0.05244889855384827, -0.011075885966420174, 0.07731539011001587, -0.013599670492112637, 0.017513127997517586, 0.011224020272493362, -0.020654315128922462, -0.027304448187351227, 0.04778451472520828, 0.016709046438336372, -0.05648326128721237, -0.0476066954433918, 0.11823656409978867, -0.03962676599621773, -0.04700003191828728, 0.03813708573579788, 0.03717292845249176, -0.021770110353827477, -0.030711863189935684, 0.007212862838059664, 0.04626820608973503, -0.04875548183917999, 0.03668510541319847, -0.01070384867489338, -0.025958560407161713, 0.07465096563100815, 0.052734795957803726, -0.05658607557415962, 0.03168154135346413, 0.002688489155843854, -0.011822693049907684, 0.03013181872665882, -0.04668465256690979, 0.08325449377298355, 0.06714388728141785, 0.05432968586683273, 0.006440287921577692, 0.0758591890335083, -0.04180919751524925, -0.04370006546378136, -0.07841970771551132, -0.00044547251309268177, 0.027397502213716507, 0.006301408167928457, -0.0402681790292263, -0.0466383695602417, 0.03303771838545799, -0.05169415473937988, 0.017593031749129295, -0.011330418288707733, 0.04872213676571846, -0.03464864194393158, 0.04631543904542923, -0.0411500409245491, -0.02032756246626377, 0.07559061795473099, 0.03899846225976944, -0.004239710513502359, 0.03651519492268562, -0.13109555840492249, -0.024801872670650482, 0.03542477265000343, 0.0012190621346235275, 0.07111875712871552, -0.007395029533654451, 0.13554172217845917, 0.007123197428882122, -0.028359869495034218, 0.01483053807169199, 0.0008387694251723588, 0.09271236509084702, -0.04931561276316643, 0.03154837340116501, 0.0151138287037611, 4.605300633647297e-32, 0.05831582844257355, 0.00613007228821516, -0.08811918646097183, -0.024987714365124702, 0.10558269172906876, 0.004152429755777121, -0.0602303147315979, -0.08358565717935562, -0.049880411475896835, -0.1096687912940979, 0.1254640370607376, -0.016761016100645065, -0.12688657641410828, 0.02953055128455162, 0.02452853135764599, -0.018913136795163155, -0.03549603000283241, -0.0023293790873140097, -0.010784593410789967, -0.03370034694671631, 0.052036747336387634, 0.0008619424770586193, -0.01305956207215786, -0.027010101824998856, 0.06028982251882553, 0.08476606011390686, 0.05057677999138832, 0.08867936581373215, -0.0086397435516119, 0.0022301762364804745, 0.036930810660123825, -0.01890345849096775, -0.028110641986131668, -0.1148250550031662, -0.05275892838835716, 0.05101708322763443, 0.05392385274171829, 0.003061124123632908, 0.05138442665338516, -0.017240915447473526, 0.08187344670295715, -0.027332136407494545, -0.02160802111029625, -0.016429372131824493, -0.01808229088783264, -0.04374735429883003, 0.050359394401311874, -0.02818855084478855, 0.017153413966298103, -0.07436226308345795, -0.07985039055347443, -0.05627511814236641, 0.022372430190443993, -0.07427690178155899, 0.0373738631606102, -0.019100643694400787, -0.03348979726433754, -0.005951837636530399, -0.03297147527337074, 0.05757560953497887, 0.06967391073703766, 0.006419994868338108, -0.024808095768094063, 0.07598532736301422]"
80cd649d5ce0b34c3564bc4de0c42b6fdbc265c4c0fcbbd568ac90f1be5970bb," exchange was cut short by a shudder that ran through the elevator, subtle, but enough to make them instinctively hold their breaths. It wasn't the mechanical stutter of old gears but a vibration that seemed to emanate from the very walls of the shaft—a whisper of something that defied natural explanation.

Cruz was the first to react, all business despite the shadow that crossed their expression. 'Systems check. Now,' they barked out, masking the moment of disquiet with swift command.

Every agent checked their gear, sending confirmation signals through their comms, creating a chorus of electronic beeps that promised readiness. But there was an unspoken question among them: was their technology, their weaponry, their protocols sufficient for what awaited them or merely a fragile comfort?

Against the gravity of the silence that was once again closing in, Sam's voice crackled through, only half-jest. 'I'd laugh if we run into Martians playing poker down there—just to lighten the mood, you know?'

Despite—or perhaps because of—the oddity of the moment, this elicited a round of chuckles, an audible release of tension that ran counterpoint to the undercurrent of anxiety coursing through the team.

As the elevator came to a halting, eerie calm at the sub-level, the group stepped off, finding themselves at the threshold of Dulce's mysterious halls. They stood in a tight pack, sharing a cautious glance before fanning out into the unknown, each one acutely aware that the truth was inevitably intertwined with danger.

Into the depths of Dulce, the team advanced, their silence now a shared testament to the camaraderie born of facing the abyss together—and the steel resolve to uncover whatever horrors lay hidden in its shadows.

The weight of the thick metal door closing behind them reverberated through the concrete hallway, marking the final threshold between the familiar world above and the strangeness that lay beneath. Dulce base, a name that had been whispered in the wind-blown deserts above and in the shadowed corners of conspiracy forums, now a tangible cold reality that they could touch — and that touched them back with a chill.

Like lambs led to an altar of alien deities, so did Agents Alex Mercer, Jordan Hayes, Taylor Cruz, and Sam Rivera proceed, their movements measured, their senses heightened. The air was still, almost respectful of the gravity of their presence. Their torch beams sliced through the darkness, uncovering steel doors with warnings that spoke of top secrets and mortal dangers.

Taylor Cruz, stepping firmly into the role of de facto leader, set a brisk pace. 'Eyes sharp, people. Comms check, every thirty seconds,' Taylor ordered, their voice echoing slightly before being swallowed by the surrounding silence.

Sam, fiddling with a handheld device aimed at detecting electronic anomalies, offered a murmured 'Copy that,",Text,"[-0.0072288657538592815, -0.004970697686076164, 0.06213786080479622, -0.03039146400988102, 0.03655529022216797, 0.07160742580890656, 0.00839879922568798, -0.0067358738742768764, -0.023761657997965813, 0.06326766312122345, -0.003973529674112797, -0.06389284133911133, 0.07597735524177551, 0.011866324581205845, 0.0414082370698452, -0.036413177847862244, -0.06617385149002075, -0.036821912974119186, -0.01709570363163948, 0.007914225570857525, 0.022709505632519722, -0.04547401890158653, 0.010504811070859432, -0.06020102649927139, 0.0011993962107226253, 0.004669337999075651, -0.05388347804546356, 0.034548696130514145, -0.03989635407924652, -0.05754581093788147, 0.14644639194011688, 0.0678449496626854, 0.09850169718265533, 0.021981850266456604, 0.013497810810804367, -0.04386066272854805, -0.09655280411243439, -0.0022096605971455574, -0.059424418956041336, -0.023135056719183922, -0.021621916443109512, -0.031337544322013855, 0.018440578132867813, 0.09680607169866562, 0.02400311268866062, -0.007698338478803635, 0.06197728216648102, 0.035574380308389664, 0.031234506517648697, -0.05732350051403046, 0.02037879079580307, 0.004538609180599451, 0.020138749852776527, 0.016332995146512985, 0.031371574848890305, -0.0027413307689130306, -0.07798654586076736, 0.02544546127319336, 0.0009649260900914669, 0.08645489811897278, 0.00406634109094739, -0.030939020216464996, 0.007769979536533356, -0.011909392662346363, -0.01407344825565815, -0.009333803318440914, 0.004718424752354622, -0.11795409023761749, -0.00850482564419508, -0.08848855644464493, -0.023147467523813248, -0.002763788914307952, 0.05057196691632271, 0.0039365896955132484, 0.08154001832008362, 0.030766651034355164, -0.01799168810248375, -0.007058263756334782, -0.020505644381046295, 0.0024813422933220863, -0.06851639598608017, -0.06429854035377502, -0.03463653102517128, 0.01952303759753704, 0.03358631953597069, 0.017675504088401794, -0.023111490532755852, 0.11387135833501816, 0.01958678849041462, -0.05354303494095802, 0.020573437213897705, -0.03547379747033119, -0.03912407159805298, -0.03111581690609455, -0.1648862510919571, 0.04114530608057976, -0.013628256507217884, -0.08390502631664276, -0.020803865045309067, 0.14289548993110657, -0.02206673100590706, -0.011996248736977577, -0.02672264166176319, 0.01703033410012722, 0.012285777367651463, -0.02525218389928341, 0.0064671398140490055, -0.001693167956545949, -0.0015544974012300372, -0.04147524759173393, -0.018213173374533653, -0.016198210418224335, 0.03821570798754692, 0.05288128927350044, 0.06616619229316711, -0.04792851209640503, -0.06041686236858368, 0.012066054157912731, -0.08994055539369583, -0.00870930589735508, 0.006628330331295729, -0.008253990672528744, -0.030543701723217964, -0.015428224578499794, 0.0396619476377964, -0.16155757009983063, 0.059883471578359604, 0.02956979162991047, -0.0058901640586555, -0.02459643967449665, 0.06905718147754669, -0.017303122207522392, 0.05863223597407341, 0.04239244386553764, -0.027356809005141258, -0.006742371711879969, 0.023316849023103714, 0.04885193705558777, -0.050315484404563904, -0.024812227115035057, -0.010377194732427597, 0.12425175309181213, 0.0353999100625515, -0.04483044520020485, -0.035775076597929, -0.03118152916431427, 0.033271532505750656, -0.00827073398977518, 0.09168209135532379, 0.0450594387948513, 0.0026244879700243473, -0.051097746938467026, -0.0031364040914922953, -0.0039195651188492775, -0.024054836481809616, 0.08745775371789932, 0.07650837302207947, 0.04366186633706093, -0.001200684579089284, -0.05998915806412697, -0.02318386361002922, -0.010163447819650173, 0.039126697927713394, 0.000979111180640757, 0.05335744470357895, 0.0018035676330327988, 0.014054102823138237, -0.06838880479335785, 0.02875463292002678, -0.04370490461587906, -0.06755875796079636, -0.006638632621616125, 0.04192860797047615, 0.003250323934480548, 0.020559754222631454, -0.056737590581178665, 0.076031394302845, 0.14193592965602875, -0.028554631397128105, -0.012128336355090141, 0.011042306199669838, -0.03316733241081238, -0.04871119186282158, -0.05973348394036293, 0.02340111695230007, 0.023553267121315002, -0.027616173028945923, 0.008706055581569672, 0.05171054229140282, 0.03819138929247856, 0.05459247902035713, 0.013561961241066456, -0.0273891594260931, 0.03007134422659874, -0.02307627536356449, -0.013287641108036041, -0.007422829512506723, 0.030090758576989174, -0.0051864515990018845, -0.03501439094543457, 0.02292642928659916, 0.05092145502567291, -0.02300434373319149, 0.007398806978017092, -0.02407071180641651, 0.02453041635453701, 0.03299163281917572, 0.04111820086836815, -0.00527498172596097, 0.04152786359190941, 0.0037318426184356213, 0.012909652665257454, -0.04943317919969559, 0.025646507740020752, -0.031661879271268845, 0.024713395163416862, 0.1013822853565216, -0.02344951219856739, -0.03369659557938576, -0.04488212615251541, 0.046238016337156296, -0.1037696972489357, -0.018484974279999733, 1.0973517475466436e-32, -0.05036326125264168, -0.005254935473203659, -0.03515269234776497, -0.006374905351549387, -0.11611931025981903, -0.0865989401936531, 0.018658313900232315, 0.14041668176651, 0.04003317281603813, -0.018972456455230713, 0.027730464935302734, 0.05316363647580147, 0.03283655643463135, -0.03430579975247383, -0.03226378560066223, 0.08480037748813629, -0.09518172591924667, 0.012988346628844738, 0.03489033132791519, 0.03032735176384449, -0.03437047079205513, 0.07450306415557861, -0.005650219973176718, 0.09262111037969589, -0.039201103150844574, -0.033769551664590836, 0.0347759909927845, -0.03128610923886299, -0.05439364165067673, 0.00883515179157257, -0.0066366493701934814, -0.024625267833471298, -0.08202630281448364, 0.12645773589611053, -0.08054423332214355, -0.10393476486206055, 0.05093309283256531, -0.02011716738343239, 0.013379408046603203, -0.08202724158763885, -0.022032735869288445, 0.016600226983428, -0.09701640903949738, 0.06068076938390732, 0.00980923231691122, 0.03712398558855057, 0.054540570825338364, 0.06445084512233734, 0.028902381658554077, 0.05468958616256714, 0.004927505739033222, -0.03129111975431442, 0.03528652712702751, -0.03401344269514084, 0.07197639346122742, 0.03506379947066307, -0.018531695008277893, 0.005566357634961605, 0.12080792337656021, -0.03913888707756996, -0.021409282460808754, -0.09295058995485306, 0.06781869381666183, 0.03289162740111351, 0.02557266876101494, -0.02246980555355549, -0.05753520876169205, 0.09208317846059799, -0.04195966199040413, -0.012955651618540287, 0.015357686206698418, 0.05555211007595062, -0.027532923966646194, 0.04600510373711586, -0.04237401857972145, 0.013435682281851768, 0.09617986530065536, 0.014619626104831696, -0.09656254202127457, 0.07136737555265427, -0.09844271838665009, 0.034647732973098755, 0.03164449706673622, -0.032591562718153, 0.013506847433745861, -0.050899725407361984, 0.06776208430528641, 0.0116627411916852, -0.046646326780319214, 0.026061099022626877, 0.02933718077838421, 0.0268577728420496, -0.022855009883642197, 0.030489487573504448, -0.032159943133592606, 4.996435799434256e-32, 0.03446526825428009, -0.00016677756502758712, -0.06447125226259232, -0.012936986051499844, 0.09042435884475708, 0.011563184671103954, -0.02997584082186222, -0.09553216397762299, 0.001085215131752193, -0.07174580544233322, 0.1017046794295311, -0.034433186054229736, -0.17219045758247375, 0.07478810101747513, 0.04444193094968796, -0.05146847292780876, -0.021537458524107933, -0.014687499031424522, -0.04115096852183342, -0.018212532624602318, 0.05967335402965546, -0.020928025245666504, 0.004922191612422466, -0.023854386061429977, 0.05863471329212189, 0.051167234778404236, 0.06908412277698517, 0.08861757069826126, -0.019543617963790894, -0.03781639039516449, 0.002104572718963027, -0.04906672611832619, -0.0663454458117485, -0.15001080930233002, -0.04013173654675484, 0.03186820447444916, 0.1204134002327919, 0.026511717587709427, 0.030750852078199387, -0.014113148674368858, 0.0328027680516243, 0.012195899151265621, 0.0046341209672391415, 0.001544811180792749, -0.03325353562831879, -0.05679694563150406, 0.0003701704554259777, -0.03101455420255661, 0.029867826029658318, -0.03747715428471565, -0.11459965258836746, -0.03020777739584446, -0.05907999351620674, -0.02690088003873825, 0.02331029437482357, -0.048346880823373795, -0.07600639015436172, -0.009210233576595783, -0.026767190545797348, 0.03259389474987984, 0.0750243291258812, 0.01301997434347868, -0.042715806514024734, 0.01914459466934204]"
