text_id:ID,original_text,:LABEL,embedding:STRING
8e8be50965a6f517c4b0027a9b09be8882062ef9b91f1311bd283ebabd9bf1b4,"' their usual buoyancy dimmed by the oppressive atmosphere.

It was Jordan Hayes who paused at an innocuous looking panel, nondescript amongst the gauntlet of secured doorways. 'Mercer, Rivera, come see this,' Jordan’s voice was marked with a rare hint of urgency.

Alex joined Jordan's side, examining the panel which, at a mere glance, seemed just another part of the base's infrastructure. Yet, to the trained eye, it appeared out of place—a facade

Jordan explained their reasoning as Sam approached, instinctively understanding the significance of what lay beneath, 'This panel is a recent addition — covering something they didn't want found.'

Before Alex could respond, the soft whir of an approaching drone cut through their muffled exchange. Taylor had looped back upon hearing the commotion. 'Explanations later. We can't afford to attract...' Cruz’s voice trailed off as the small airborne device came into view, its sensors locked onto the group.

Sam was the first to react, their tech-savvy mind already steps ahead. 'I've got this,' they declared, fingers flying over the controls of their own gadgetry to ward off the impending threat.

The drone lingered, its scan seeming more curious than hostile. But within moments, courtesy of Sam's interference, the little sentinel drifted away, retreating into the shadows as if accepting a silent truce. The crew exhaled, a moment of collective relief palpable in the air.

Cruz squared their shoulders, clearly ruffled but not conceding any ground. 'Move out,' they directed, a hint more forceful than before. 'And Rivera, keep that trick handy.'

The team pressed onward, the quiet now filled with the soft beeps of regular comms checks, their pace undeterred by the confrontation. Yet, every agent held a renewed sense of wariness, their trust in one another deepening with the knowledge that the base—its technology, its secrets—was alive in a way they hadn't fully anticipated.

As they converged upon a central hub, the imposing doors to the mainframe room stood ajar — an invitation or a trap, neither option comforting. Without a word, they fortified their resolve and stepped through the threshold, where the dim glow of operational LED lights and the distant hum of machinery hinted at Dulce’s still-beating heart.

Solemnly, yet unmistakably together, they moved deeper into the heart of the enigma, ready to unmask the lifeforce of Dulce base or confront whatever existential threat lay in wait. It was in that unwavering march towards the unknown that their destinies were forever cemented to the legacy of Operation: Dulce.

",Text,"[-0.017135873436927795, 0.024806709960103035, 0.0393100343644619, -0.02648637443780899, 0.014407282695174217, 0.04727625101804733, 0.0004219256807118654, -0.0031031540129333735, -0.03523092716932297, 0.08276242762804031, 0.024695193395018578, -0.05428166687488556, 0.05337001755833626, 0.03285318613052368, 0.04966936260461807, -0.07914569228887558, -0.06751682609319687, -0.044969987124204636, -0.06427600979804993, -0.026513848453760147, 0.08007663488388062, -0.07722585648298264, 0.03466319665312767, -0.082505963742733, 0.004803125746548176, -0.04414163529872894, -0.02375565655529499, 0.007260841317474842, -0.04657949507236481, -0.046312879770994186, 0.07820191979408264, -0.013110265135765076, 0.055116865783929825, 0.015339945442974567, 0.0556933730840683, -0.05369269475340843, -0.06789211928844452, -0.03534306213259697, -0.03499167412519455, -0.022199932485818863, -0.027038587257266045, -0.040752626955509186, 0.07645231485366821, 0.058129049837589264, 0.05124596506357193, 0.002992480294778943, 0.09242352098226547, 0.04250684380531311, 0.015918374061584473, -0.0325499102473259, 0.01794491522014141, 0.0027803750708699226, -0.005917173810303211, 0.021144885569810867, 0.047753430902957916, -0.01149815134704113, -0.07414744794368744, 0.08233819156885147, -0.004739236552268267, 0.03522365540266037, -0.0044245645403862, -0.0599186047911644, -0.010866797529160976, 0.0023297788575291634, -0.009927886538207531, 0.018505236133933067, -0.01599528081715107, -0.13024277985095978, -0.03290771320462227, -0.047076765447854996, -0.008250952698290348, 0.03765919804573059, 0.038785990327596664, 0.01775469444692135, 0.08444423973560333, 0.046445176005363464, 0.004372261930257082, -0.04069462791085243, 0.01598835177719593, -0.013536452315747738, -0.10662484169006348, -0.08597371727228165, -0.01701030135154724, -0.023650679737329483, 0.025993553921580315, 0.06932578980922699, -0.0346364863216877, 0.07547085732221603, 0.044388510286808014, -0.05147189646959305, 0.048699889332056046, 0.012258163653314114, -0.06323610991239548, -0.0022936647292226553, -0.12316324561834335, 0.010597619228065014, -0.010892907157540321, -0.08923207968473434, -0.01482861302793026, 0.13364511728286743, 0.01808251067996025, 0.0066504646092653275, -0.03351300209760666, 0.04574458673596382, 0.039254482835531235, -0.09503380954265594, 0.016060199588537216, 0.004202008247375488, 0.016832929104566574, -0.06659938395023346, -0.027189914137125015, -0.06542888283729553, 0.03885636478662491, 0.0514906607568264, 0.08766889572143555, -0.03357753902673721, -0.06697829067707062, 0.003686328651383519, -0.1066676676273346, -0.02500235289335251, -0.033544737845659256, -0.02503345161676407, -0.028019964694976807, 0.004633443895727396, -0.012866904027760029, -0.12907570600509644, -0.00697345519438386, 0.03667641058564186, -0.013283679261803627, 0.0032754014246165752, 0.0805182084441185, -0.045539915561676025, 0.021171383559703827, 0.042489439249038696, -0.09176177531480789, -0.032742228358983994, 0.032975342124700546, 0.049706749618053436, 0.014417172409594059, -0.024696405977010727, -0.02419215999543667, 0.141360342502594, 0.026318462565541267, -0.0043680849485099316, 0.004903925582766533, 0.00678377877920866, 0.013511311262845993, -0.014987091533839703, 0.0598137229681015, 0.038387760519981384, 0.00017262794426642358, -0.03431801497936249, 0.007224234752357006, 0.03415321558713913, 0.014202577993273735, 0.08493167906999588, 0.0678795650601387, 0.02422986552119255, -0.06220722571015358, -0.042550746351480484, -0.07123516499996185, 0.02089748904109001, 0.06072187423706055, -0.046398475766181946, 0.07733599096536636, 0.021093063056468964, -0.0951002687215805, -0.0004660889972001314, 0.04067109897732735, -0.024957306683063507, -0.04009691998362541, -0.010054660961031914, 0.03988593444228172, -0.029309270903468132, 0.032793283462524414, -0.026878049597144127, 0.10246837884187698, 0.05391005426645279, 0.0032151760533452034, 0.0409785620868206, 0.007733670063316822, -0.037890445441007614, -0.020770544186234474, 0.0298067145049572, 0.01609695889055729, 0.05401725694537163, -0.02020164206624031, 0.004397974815219641, 0.06860470026731491, 0.042585037648677826, 0.06117650493979454, -0.01606508530676365, -0.041976798325777054, 0.03892563283443451, -0.01098413486033678, -0.009392903186380863, 0.0072065554559230804, -0.04831722006201744, -0.014969062060117722, -0.015679122880101204, -0.01232491061091423, 0.04284355789422989, -0.0018132501281797886, -0.05428224802017212, -0.022671299055218697, 0.028459304943680763, 0.0064217220060527325, 0.05559958517551422, -0.012583661824464798, 0.036328427493572235, 0.0032766496296972036, -0.024252280592918396, -0.021686632186174393, -0.04834926500916481, -0.01392376609146595, 0.0030088103376328945, 0.09376140683889389, -0.04532734677195549, -0.029637658968567848, -0.02249404974281788, 0.05529940500855446, -0.08707378804683685, -0.022976500913500786, 8.383078370507453e-33, -0.07177110016345978, -0.008389456197619438, -0.027517037466168404, -0.004834984429180622, -0.08436621725559235, -0.10397300124168396, 0.05165443569421768, 0.10785408318042755, 0.05600673332810402, 0.007529544644057751, 0.048029471188783646, 0.03708790987730026, 0.029739882797002792, -0.09469205141067505, -0.015185474418103695, 0.04952636733651161, -0.09448560327291489, 0.08613859862089157, 0.05144837871193886, 0.019547969102859497, -0.030285406857728958, 0.10702145844697952, 0.026083197444677353, 0.10944034904241562, -0.04136035591363907, -0.02809540368616581, 0.043276868760585785, -0.04176449403166771, -0.08379239588975906, 0.012296724133193493, 0.02936653420329094, -0.015595304779708385, -0.04021225497126579, 0.07283588498830795, -0.02718321792781353, -0.05949206277728081, 0.07477322965860367, 0.010462857782840729, 0.03133131563663483, -0.06278451532125473, 0.02965402603149414, 0.012921578250825405, -0.05699925869703293, 0.061649423092603683, -0.05282115936279297, 0.0643007829785347, 0.023729629814624786, 0.03108435682952404, -0.00439773965626955, 0.05550801381468773, 0.04809999093413353, -0.028135493397712708, -0.009335382841527462, -0.07672356814146042, 0.012311557307839394, 0.0356154702603817, 0.034275274723768234, 0.039519790560007095, 0.10890945792198181, -0.03420506790280342, -0.08289523422718048, -0.06171511858701706, 0.028780652210116386, 0.03771557658910751, 0.004154132679104805, -0.0287132877856493, -0.07909772545099258, 0.09270089119672775, -0.0613514706492424, 0.020991530269384384, -0.003803609637543559, 0.05048805847764015, -0.09420787543058395, 0.056298404932022095, -0.034280430525541306, 0.060214247554540634, 0.07283525913953781, 0.0211559496819973, -0.05189453065395355, 0.06756386905908585, -0.15788453817367554, -0.0288164634257555, 0.03950958698987961, -0.007692362647503614, -0.006821636576205492, -0.05002736672759056, 0.0847887471318245, 0.0014424091205000877, -0.04481935128569603, -0.0002178754803026095, 0.021896660327911377, 0.11395564675331116, -0.05707431957125664, -0.00788196362555027, -0.009794716723263264, 5.554009210354142e-32, 0.02123047597706318, 0.01903725415468216, -0.07276547700166702, -0.015843575820326805, 0.08705722540616989, -0.029699556529521942, -0.05246469005942345, -0.07075995951890945, -0.04010181128978729, -0.1045825183391571, 0.08141130954027176, 0.004690401256084442, -0.13081073760986328, 0.020357705652713776, -0.03832792118191719, -0.03274056315422058, -0.021830998361110687, -0.003621612675487995, -0.022933002561330795, -0.023028796538710594, 0.08292502164840698, -0.0036723483353853226, -0.007724148221313953, -0.03466543182730675, 0.05388427898287773, 0.05898464843630791, -0.0012464324245229363, 0.09413349628448486, 0.04167388379573822, 0.006649901624768972, -0.0013002140913158655, -0.04458833858370781, -0.058534666895866394, -0.10388265550136566, -0.09366536885499954, 0.0819689929485321, 0.08812902867794037, 0.0287841334939003, 0.0073320865631103516, 0.04870712384581566, 0.052601467818021774, -0.06496617197990417, 0.02259923703968525, 0.0386848971247673, -0.04026065394282341, -0.01621626690030098, 0.03323911502957344, -0.000755711633246392, 0.027881795540452003, -0.11127354949712753, -0.08149192482233047, -0.022315483540296555, -0.0019471903797239065, -0.05764469504356384, 0.0428713858127594, -0.01953047141432762, -0.055975303053855896, -0.030719920992851257, -0.020938988775014877, 0.020865855738520622, 0.05496235564351082, 0.008877821266651154, -0.014696476981043816, 0.02618020959198475]"
a3610ffa4a0b39dcea03fd37ff217b324e1f64e8a19c47f25fd3386611bc0c16,"## Chapter 3

The thrumming of monitors cast a stark contrast to the rigid silence enveloping the group. Agent Alex Mercer, unfailingly determined on paper, seemed dwarfed by the enormity of the sterile briefing room where Paranormal Military Squad's elite convened. With dulled eyes, he scanned the projectors outlining their impending odyssey into Operation: Dulce.

The cooling vents hummed in a monotonous drone, but it was the crackle of the comms system coming to life that cut through the lab’s tension. Dr. Jordan Hayes hovered over a table arrayed with alien technology, their fingers delicately probing the enigmatic circuitry retrieved from the crash site. Agent Alex Mercer watched, admiration blooming in silent solidarity for Jordan's deft touch and unspoken drive.

Jordan, always composed, only allowed the faintest furrow of concentration to mar their brow. 'What we understand about physics...' they muttered, trailing off as they realigned a translucent component. The device emitted a low pulse, causing Jordan to still. 'Could be fundamentally changed by this.'

A calculated risk—that's what this was. And for a person of science, a gamble was worth the potential paradigm shift.

'I’ve been thinking,' Alex started, his eyes still fixed on the immediately tangible mystery before them. 'About what’s at stake here. Not the mission parameters, but what this means for us—humanity.'

Jordan glanced up, meeting his eyes just long enough to convey the shared enormity of their situation; the career-defining glory and existential dread entwined. 'The quest for understanding always comes at a price. We're standing on the precipice of knowledge that could either elevate us or condemn us.'

The charged air between them spiked as Taylor Cruz’s brusque tones sliced through their reverie. 'Hayes, Mercer, this isn't philosophy hour. Focus on the task. We need actionable intel, not daydreams.'

With a sound of restrained acknowledgment, Jordan returned their gaze to the device, while Alex clenched his jaw, the buzz of frustration dull against the backdrop of Taylor's authoritarian certainty. It was this competitive undercurrent that kept him alert, the sense that his and Jordan's shared commitment to discovery was an unspoken rebellion against Cruz's narrowing vision of control and order.

Then Taylor did something unexpected. They paused beside Jordan and, for a moment, observed the device with something akin to reverence. 'If this tech can be understood...' Taylor said, their voice quieter, 'It could change the game for us. For all of us.'

The underlying dismissal earlier seemed to falter, replaced by a glimpse of reluctant respect for the gravity of what lay in their hands. Jordan looked up, and for a fleeting heartbeat, their eyes locked with Taylor's, a wordless clash of wills softening into an uneasy truce.

It was a small transformation, ",Text,"[-0.033741552382707596, 0.018473949283361435, 0.06178727373480797, -0.02673954702913761, 0.0043104104697704315, 0.031183622777462006, 0.011307215318083763, 0.0018569418461993337, -0.022814199328422546, 0.07718881964683533, 0.008640222251415253, -0.06516911834478378, 0.05627986416220665, -0.018079202622175217, 0.013315501622855663, -0.04030529409646988, -0.12903711199760437, -0.025123493745923042, -0.02665768936276436, 0.02118266560137272, 0.022730065509676933, -0.07058670371770859, 0.033892981708049774, -0.045865003019571304, -0.0188121497631073, -0.032489072531461716, -0.056511323899030685, -0.02468402124941349, -0.05915990099310875, -0.04934687912464142, 0.07477864623069763, 0.03667707368731499, 0.13099464774131775, -0.035250917077064514, 0.044243618845939636, -0.03357619047164917, -0.05080275982618332, 0.005552125629037619, 0.011475819163024426, -0.03423526883125305, -0.028823139145970345, 0.011378546245396137, -0.01618475839495659, 0.021488137543201447, 0.07589776813983917, -0.002456494141370058, 0.026094643399119377, 0.0007810727693140507, 0.05076247826218605, -0.02851354330778122, 0.05920831859111786, -0.006147398613393307, 0.008198492228984833, 0.05533880740404129, -0.0458635613322258, 0.011666866950690746, -0.057853538542985916, 0.0255813617259264, -0.008843248710036278, 0.04683367535471916, 0.028448041528463364, 0.0062799532897770405, -0.00014368306437972933, -0.018281448632478714, -0.036950625479221344, -0.04603508487343788, -0.0169181190431118, -0.18016356229782104, -0.051368597894907, -0.05621224269270897, -0.06826894730329514, -0.005073437001556158, 0.039149269461631775, -0.02322511374950409, 0.06330432742834091, 0.03694285452365875, -0.011701183393597603, -0.0443156473338604, -0.041364122182130814, 0.013794886879622936, -0.1000070869922638, -0.03854747489094734, -0.01932227425277233, 0.08091942220926285, 0.053440578281879425, 0.042975302785634995, 0.012092323042452335, 0.046482548117637634, 0.03475429490208626, -0.03362855687737465, -0.020898548886179924, -0.032487060874700546, -0.046801406890153885, -0.008069501258432865, -0.1416362226009369, 0.0011117118410766125, 0.03469539433717728, -0.06421438604593277, -0.0220571830868721, 0.13517510890960693, 0.038086872547864914, 0.057224053889513016, -0.03515738993883133, 0.02194891683757305, -0.017208129167556763, -0.030384674668312073, 0.018000688403844833, 0.029460672289133072, 0.08152813464403152, -0.017610175535082817, -0.021154476329684258, 0.01699206791818142, 0.047382745891809464, 0.020073315128684044, 0.09673400223255157, -0.040500108152627945, -0.04828238487243652, -0.03943964093923569, -0.09696852415800095, -0.02694503217935562, 0.030625896528363228, -0.04728793352842331, -0.041480548679828644, -0.037900712341070175, 0.01383112370967865, -0.120491161942482, 0.01679084450006485, 0.047866590321063995, -0.021901840344071388, 0.010630777105689049, 0.08565755188465118, 0.0030575424898415804, 0.006581401918083429, 0.06386227160692215, -0.05014350265264511, -0.013979013077914715, 0.035357486456632614, 0.058385878801345825, -0.05053558573126793, -0.04117296636104584, -0.04829474911093712, 0.13380862772464752, 0.013495787978172302, -0.008113778196275234, 0.0006570705445483327, -0.006686362903565168, -0.01277043018490076, -0.06295127421617508, 0.039601102471351624, 0.0636155903339386, 0.07642122358083725, -0.07777663320302963, 0.04407969117164612, 0.010261250659823418, -0.06250562518835068, 0.06829918920993805, 0.05650961771607399, 0.09146948903799057, -0.04717521369457245, -0.03201068565249443, -0.023513993248343468, -0.004731220658868551, 0.061881452798843384, -0.045043282210826874, 0.08383436501026154, -0.01345528569072485, -0.051750246435403824, -0.0022755952086299658, 0.009542757645249367, 0.021260477602481842, -0.06266145408153534, -0.014915569685399532, 0.007952812127768993, -0.03669723868370056, -0.02369057945907116, 0.001770615577697754, 0.12847229838371277, 0.05673813447356224, -0.012262213975191116, 0.029302502050995827, -0.029247120022773743, -0.04197244718670845, -0.019977426156401634, -0.02832343801856041, 0.031747836619615555, 0.04803023114800453, -0.049156252294778824, -0.0574067085981369, 0.056263815611600876, -0.010099108330905437, 0.03669911250472069, -0.011297669261693954, -0.01000601053237915, -0.01738659478724003, 0.030520472675561905, 0.02644597925245762, -0.046943191438913345, 0.031012238934636116, 0.006081628613173962, 0.012600674293935299, 0.01777818240225315, 0.061401449143886566, -0.019546952098608017, -0.02144559472799301, -0.03491755202412605, 0.04843197390437126, 0.019742511212825775, 0.010346814058721066, -0.010611695237457752, 0.04310204088687897, 0.00772882578894496, 0.027541717514395714, -0.014642573893070221, -0.013237250968813896, -0.02126067690551281, -0.025798730552196503, 0.10563959926366806, -0.08644063770771027, -0.016832634806632996, -0.001973650651052594, 0.01645706780254841, -0.07831631600856781, 0.02072257548570633, 1.1802283604466366e-32, -0.020853249356150627, -0.029576947912573814, -0.04566339775919914, -0.04994291067123413, -0.05095290765166283, -0.07214215397834778, 0.05811713635921478, 0.09469790011644363, 0.025236710906028748, 0.004020367749035358, 0.0769004225730896, 0.062238551676273346, 0.01239782851189375, -0.03894783556461334, -0.022340603172779083, 0.044554226100444794, -0.041823118925094604, 0.060440488159656525, 0.003268428146839142, 0.01819203421473503, -0.03446776047348976, 0.10478667169809341, 0.00145176169462502, 0.03517088666558266, 0.0024553174152970314, 0.017026586458086967, 0.06274332106113434, -0.03754742443561554, -0.10325891524553299, 0.011205194517970085, -0.0011333049042150378, 0.027774425223469734, -0.018470298498868942, 0.11839190125465393, -0.04320792853832245, -0.09738335758447647, 0.05219722166657448, -0.015495944768190384, 0.010324674658477306, -0.04202759265899658, 0.04612568020820618, 0.027745455503463745, -0.1063871756196022, 0.06230483949184418, -0.030680177733302116, 0.06152316555380821, 0.06163345277309418, 0.011731584556400776, 0.04044313728809357, 0.053418438881635666, -0.02503819204866886, -0.057573772966861725, 0.02413770742714405, -0.0992303118109703, 0.08056922256946564, 0.08478999137878418, 0.04583418369293213, 0.04010816290974617, 0.038599833846092224, 0.012666312046349049, -0.057702187448740005, -0.04637115076184273, 0.03417421132326126, 0.06691762059926987, 0.0030451861675828695, -0.04126349836587906, -0.02214011363685131, 0.010622800327837467, -0.06299153715372086, -0.009176086634397507, -0.057375721633434296, 0.03515832498669624, -0.05089844390749931, 0.05082780495285988, -0.04109416902065277, 0.0010509818093851209, 0.06179934740066528, 0.05236285179853439, -0.06679851561784744, 0.0810428261756897, -0.15345077216625214, 0.034591611474752426, 0.032283853739500046, 0.02484169416129589, 0.025121087208390236, -0.02993909642100334, 0.05031457543373108, 0.02226868085563183, -0.030354898422956467, 0.004181367810815573, 0.0030415246728807688, 0.13680289685726166, -0.06238482519984245, 0.0586794838309288, -0.029279714450240135, 5.276918743242436e-32, 0.054777707904577255, -0.025143258273601532, -0.0631956085562706, -0.025311462581157684, 0.06121471896767616, 0.03681974858045578, -0.029652658849954605, -0.07837473601102829, 0.007965081371366978, -0.10021942853927612, 0.085265152156353, -0.061436597257852554, -0.12553153932094574, -3.270179149694741e-05, -0.011353259906172752, -0.08973481506109238, -0.03443169593811035, 0.018770109862089157, -0.021573631092905998, -0.010438548400998116, 0.07308939099311829, -0.005325357895344496, -0.05348393693566322, -0.01127547211945057, 0.0679643377661705, 0.0853896290063858, 0.0592593178153038, 0.08173023909330368, 0.0012261683586984873, 0.02924993820488453, 0.015748869627714157, -0.05776676535606384, -0.056987449526786804, -0.10076141357421875, -0.09949400275945663, -0.0002735675952862948, 0.09281186759471893, -0.07850009202957153, -0.022189343348145485, -0.002429479965940118, 0.06394097208976746, -0.011624575592577457, -0.0331483893096447, 0.036034516990184784, 0.019193677231669426, -0.05818582698702812, -0.0362742617726326, -0.10654375702142715, 0.017811741679906845, -0.002669815206900239, -0.07757840305566788, -0.05877839773893356, 0.03148951753973961, -0.04346948117017746, 0.055861085653305054, 0.005964844953268766, -0.06381718814373016, 0.050741732120513916, -0.0014485346619039774, 0.03156568109989166, 0.07467025518417358, 0.07720908522605896, -0.02454785630106926, 0.04828647896647453]"
