text_id:ID,original_text,:LABEL,embedding:STRING
d7d045db7baae0f6d60ed56b0123cd3a2cd67cddede6f27401d552bd73efa969,"# Operation: Dulce

## Chapter 1

The thrumming of monitors cast a stark contrast to the rigid silence enveloping the group. Agent Alex Mercer, unfailingly determined on paper, seemed dwarfed by the enormity of the sterile briefing room where Paranormal Military Squad's elite convened. With dulled eyes, he scanned the projectors outlining their impending odyssey into Operation: Dulce., The thrumming of monitors cast a stark contrast to the rigid silence enveloping the group. Agent Alex Mercer, unfailingly determined on paper, seemed dwarfed by the enormity of the sterile briefing room where Paranormal Military Squad's elite convened. With dulled eyes, he scanned the projectors outlining their impending odyssey into Operation: Dulce.

“I assume, Agent Mercer, you’re not having second thoughts?” It was Taylor Cruz’s voice, laced with an edge that demanded attention.

Alex flickered a strained smile, still thumbing his folder's corner. 'Of course not, Agent Cruz. Just trying to soak in all the details.' The compliance in his tone was unsettling, even to himself.

Jordan Hayes, perched on the opposite side of the table, narrowed their eyes but offered a supportive nod. 'Details are imperative. We’ll need your clear-headedness down there, Mercer.'

A comfortable silence, the kind that threaded between veterans of shared secrets, lingered briefly before Sam Rivera, never one to submit to quiet, added, 'I’ve combed through the last transmission logs. If anyone can make sense of the anomalies, it’s going to be the two of you.'

Taylor snorted dismissively. 'Focus, people. We have protocols for a reason. Speculation is counter-productive.' The words 'counter-productive' seemed to hang in the air, a tacit reprimand directed at Alex.

Feeling the weight of his compliance conflicting with his natural inclination to leave no stone unturned, Alex straightened in his seat. 'I agree, Agent Cruz. Protocol is paramount,' he said, meeting Taylor's steely gaze. It was an affirmation, but beneath it lay layers of unspoken complexities that would undoubtedly unwind with time.

Alex's submission, though seemingly complete, didn't escape Jordan, who tilted their head ever so slightly, their eyes revealing a spark of understanding. They knew well enough the struggle of aligning personal convictions with overarching missions. As everyone began to collect their binders and prepare for departure, a quiet resolve took form within Alex, galvanized by the groundwork laid by their interactions. He may have spoken in compliance, but his determination had merely taken a subtler form — one that wouldn't surrender so easily to the forthcoming shadows.",Text,"[-0.05215993896126747, -0.0033303317613899708, 0.01819220557808876, -0.03307470679283142, 0.025896059349179268, 0.03949723765254021, 0.03177483752369881, -0.04570086672902107, -0.03616689145565033, 0.047816380858421326, 0.015923552215099335, -0.04390570521354675, 0.03565489128232002, -0.023670248687267303, -0.0320301316678524, -0.07228905707597733, -0.029702872037887573, -0.06183016300201416, -0.055398572236299515, -0.014324597083032131, 0.01401485688984394, -0.0738164409995079, 0.046346258372068405, -0.03714282810688019, 0.014681302942335606, 0.019006973132491112, 0.013973617926239967, 0.025694089010357857, -0.05514014884829521, -0.008604125119745731, 0.05766727775335312, 0.045921359211206436, 0.06902757287025452, 0.05016966909170151, 0.12899459898471832, -0.05459321662783623, -0.0433838926255703, 0.010855970904231071, -0.07946183532476425, -0.061321791261434555, -0.0392676405608654, -0.08167485147714615, 0.043427973985672, 0.09285416454076767, 0.02946849912405014, -0.006410697475075722, -0.006387095432728529, 0.04785892739892006, 0.03099827654659748, -0.013022342696785927, 0.020369434729218483, 0.0274934321641922, -0.024221429601311684, 0.01540385838598013, -0.0078000291250646114, -0.04391071945428848, -0.0022019343450665474, 0.0126314926892519, 0.018225880339741707, 0.03905322402715683, 0.023702189326286316, -0.02857036516070366, -0.009249606169760227, -0.05895279720425606, 0.009666074067354202, 0.011192848905920982, -0.028703154996037483, -0.12131024152040482, -0.0534777007997036, -0.025359801948070526, -0.028147246688604355, 0.04032234847545624, 0.014563784003257751, 0.00665157800540328, 0.09014473110437393, 0.06857743859291077, -0.01651560515165329, -0.078961580991745, -0.01601255126297474, 0.004052412696182728, -0.10217081755399704, 0.0329742506146431, 0.036610718816518784, 0.03447927534580231, -0.024548841640353203, 0.026381216943264008, -0.0376678891479969, 0.05461239442229271, 0.05605993792414665, -0.03984273970127106, 0.013725298456847668, -0.03370579704642296, -0.06331001222133636, -0.09394475817680359, -0.24218019843101501, -0.00484220776706934, 0.026833193376660347, -0.08394087851047516, -0.0023981223348528147, 0.12963813543319702, 0.061370477080345154, 0.051702238619327545, -0.07564873993396759, 0.012674786150455475, -0.0022089898120611906, -0.04495970904827118, -0.030275406315922737, -0.011057408526539803, 0.03139953687787056, -0.08211576193571091, -0.00431507732719183, -0.02639004774391651, 0.01640281453728676, 0.002298059407621622, -0.011828634887933731, -0.05503289774060249, -0.052410755306482315, -0.030285177752375603, -0.10663410276174545, -0.035958413034677505, 0.027235060930252075, -0.07417131215333939, -0.06208014860749245, 0.020691171288490295, 0.004836513660848141, -0.11950856447219849, -0.007983281277120113, 0.0911041647195816, -0.023745454847812653, 0.00788882840424776, 0.07252071052789688, -0.0230475552380085, 0.06583946943283081, 0.018700338900089264, -0.02625729888677597, 0.00040490974788554013, -0.03691409155726433, 0.04286320134997368, -0.003570243250578642, -0.011684528551995754, -0.05019333213567734, 0.12748369574546814, 0.02671360969543457, -0.03649863228201866, 0.008557661436498165, -0.021691422909498215, -0.03350085765123367, -0.014083408750593662, 0.05110329017043114, 0.1035943329334259, 0.02584153786301613, -0.04678725451231003, 0.012661010958254337, 0.06022623926401138, -0.05383028835058212, 0.0960012897849083, 0.13056015968322754, 0.03132479637861252, -0.02951495349407196, -0.03519202396273613, -0.04875103011727333, 0.05161593109369278, 0.06992048770189285, 0.06878609210252762, 0.04087848588824272, 0.03871548920869827, -0.036768775433301926, -0.04265045374631882, 0.028236795216798782, -0.10688505321741104, -0.08388999104499817, -0.03322660177946091, 0.03243113309144974, -0.011223174631595612, -0.004463275894522667, -0.04287036880850792, 0.08317352831363678, 0.048325031995773315, 0.002499902853742242, 0.030606722459197044, 0.01584705151617527, -0.04129927605390549, -0.0338297002017498, -0.048724111169576645, 0.032589659094810486, 0.05245127156376839, -0.06526099890470505, 0.0020755156874656677, 0.07745057344436646, 0.0036499975249171257, 0.025864729657769203, 0.03409099206328392, 0.0007676982786506414, -0.025584541261196136, -0.01052174810320139, -0.03188758343458176, -0.036121923476457596, 0.04300729185342789, -0.03827802091836929, -0.0057599167339503765, 0.040888894349336624, 0.06903805583715439, -0.015380242839455605, -0.03365394473075867, 0.006924231071025133, -0.03123762272298336, -0.029311886057257652, 0.010013953782618046, 0.014185783453285694, 0.019182858988642693, -0.039293404668569565, 0.06843869388103485, -0.039955634623765945, 0.040544215589761734, -0.00012907077325507998, -0.06246458366513252, 0.07895486801862717, -0.013330426998436451, 0.018074924126267433, -0.077457956969738, 0.046798139810562134, -0.07357322424650192, 0.014639494940638542, -2.8763160250011014e-33, -0.06699782609939575, -0.016921482980251312, -0.0275722723454237, 0.01387064903974533, -0.06688739359378815, -0.04493452608585358, 0.013489112257957458, 0.12018046528100967, 0.030717164278030396, -0.00463978061452508, 0.0396885946393013, 0.06764338165521622, 0.0032275570556521416, -0.11517658084630966, -0.006338797509670258, 0.05342896655201912, -0.05508522689342499, -0.018906982615590096, -0.019525330513715744, 0.06787373125553131, -0.04810187593102455, 0.08062145859003067, -0.039279237389564514, 0.08658028393983841, -0.03440249711275101, -0.004294791258871555, -0.009651651605963707, -0.031602565199136734, -0.020690826699137688, 0.02564939297735691, 0.009717387147247791, -0.03389989212155342, -0.03056752309203148, 0.08426692336797714, -0.06424643844366074, -0.09472659230232239, 0.043807253241539, 0.02368168532848358, -0.06258981674909592, -0.02654198184609413, -0.005106245633214712, 0.05951305851340294, -0.08909203112125397, 0.0395844541490078, -0.0005520859267562628, -0.03708231821656227, 0.04962887987494469, 0.0760287269949913, 0.015243197791278362, 0.015424257144331932, -0.033058229833841324, -0.029785186052322388, 0.05916573479771614, -0.0033236404415220022, 0.08306338638067245, 0.0426345020532608, 0.01077697891741991, -0.021769851446151733, 0.09383145719766617, -0.09711334854364395, -0.046984970569610596, -0.059432923793792725, 0.01658371090888977, 0.009631011635065079, 0.007579258643090725, -0.02282903343439102, -0.04110938310623169, 0.03908179700374603, -0.055925942957401276, 0.02424599416553974, 0.014133833348751068, 0.02868020348250866, -0.07632949203252792, 0.03542553633451462, -0.03610868379473686, -0.040481314063072205, 0.0673241838812828, 0.054728176444768906, -0.06716379523277283, 0.08364807069301605, -0.0655113086104393, -0.007087584584951401, -0.009336522780358791, -0.000810730445664376, 0.03451312333345413, -0.0296776220202446, 0.13290253281593323, -0.013535127975046635, 0.016085796058177948, -0.02219797484576702, -0.01547994650900364, 0.07024963945150375, 0.04069503769278526, 0.06278848648071289, -0.00863373652100563, 6.090638838425428e-32, 0.059616971760988235, -0.03902747482061386, -0.06277010589838028, -0.04564464092254639, 0.10969948023557663, 0.01648315042257309, -0.06015167012810707, -0.0516442209482193, -0.05411212146282196, -0.10902686417102814, 0.10203731805086136, 0.006822723429650068, -0.10326952487230301, 0.0429808534681797, 0.05387027934193611, -0.034216925501823425, -0.03269478678703308, -0.01804293878376484, 0.0023183568846434355, -0.046694837510585785, 0.07820228487253189, -0.005946237128227949, -0.03401048853993416, -0.04479079321026802, 0.021615812554955482, 0.07063141465187073, 0.10983595997095108, 0.03495416417717934, -0.00715467007830739, 0.0002412260218989104, 0.036447204649448395, -0.027789384126663208, -0.008062433451414108, -0.09777329862117767, -0.02082200162112713, 0.05150279775261879, 0.10168424993753433, -0.034243274480104446, 0.00964756403118372, -0.02960309572517872, 0.07182342559099197, 0.03227616474032402, 0.005233761388808489, 0.01467656809836626, -0.0061248671263456345, -0.04067277908325195, 0.03125238046050072, -0.015510912984609604, 0.014440075494349003, -0.0877811387181282, -0.08040718734264374, -0.07033521682024002, 0.009772074408829212, -0.0502919964492321, 0.0014744661748409271, -0.021352268755435944, -0.05673939734697342, 0.024489447474479675, -0.03267517685890198, 0.020272064954042435, 0.05533979833126068, 0.024515682831406593, 0.0010047104442492127, 0.05633440613746643]"
6e88a05b4573047ccfc9aec41deef0175163020e9ada18f572c138b5c01d35cb,"## Chapter 2

Sam Rivera sat alone in a cramped office, the hum of a dozen servers murmuring a digital lullaby in the background. Surrounded by the glow of multiple screens, their eyes danced across lines of code and intercepted comm signals from Dulce — a kaleidoscope of data that their curious and isolated mind hungered to decrypt.

To an outsider, it might have looked like obsession, this fervent quest for answers. But to Sam, it was a dance — a give and take with the mysteries of the universe. Their fingers paused over the keyboard as they leaned back in the chair, whispering to thin air, 'What secrets are you hiding from us?'

The stillness of the room broke with the unexpected arrival of Alex Mercer, whose encroaching shadow loomed over Sam's workspace. The cybersecurity expert craned their neck upwards, met by the ever-so-slight furrow in Alex's brow. 'Got a minute, Rivera?'

'Always,' Sam said, a smile surfacing as they swiveled to face their mentor more directly. _He has that look — like something's not sitting right with him,_ they noted inwardly.

Alex hesitated, weighing his words carefully. 'Our tech is top-tier, but the silence from Dulce... It's not just technology that will see us through, it's intuition and... trust.'
 His gaze pierced through the digital haze, trying to instill something more profound than advice.

Sam regarded Alex for a moment, the sincerity in his voice resonating with their own unspoken desire to prove their worth. 'Intuition,' they mirrored thoughtfully. 'I guess sometimes the numbers don't have all the answers.'

Their shared silence held a newfound understanding, a recognition that between the ones and zeros, it was their combined human insights that might prevail against the impossible. As Alex turned to leave, Sam's eyes drifted back to the screens, now seeing them not as barriers to isolate behind, but as windows into the vast and enigmatic challenge that awaited their team.

Outside the office, the persistent buzz of activity in the facility belied the unease that gripped its inhabitants. A restlessness that nibbled on the edges of reality, as though forewarning of the threshold they were soon to cross — from the known into the realm of cosmic secrets and silent threats.

Shadows played against the walls of the cramped underground meeting room, where Alex Mercer stood gazing at the concealed elevator that would deliver them into the bowels of Dulce base. The air was thick, every breath laced with the weight of impending confrontation, the kind one feels when stepping into a legend. Though armed with an array of advanced weaponry and gear, there was an unshakeable sense that they were delving into a conflict where the physical might be of little consequence.

'I know what you're thinking,' Jordan Hayes remarked, approaching Mercer. Their voice was low, a blend of confidence and hidden app",Text,"[-0.027297940105199814, 0.019354455173015594, 0.023873021826148033, -0.011576255783438683, 0.017246395349502563, 0.054890550673007965, 0.02022303082048893, -0.011219573207199574, -0.003766915760934353, 0.11748667806386948, -0.009369563311338425, -0.07163619995117188, 0.03579961508512497, 0.021018924191594124, 0.05162970349192619, -0.06717512011528015, -0.07189124822616577, -0.08179289847612381, -0.0403006337583065, -0.027515875175595284, 0.0207686610519886, -0.04810674488544464, 0.026294508948922157, -0.07640327513217926, 0.0014758295146748424, -0.006011016201227903, 0.005457466933876276, 0.037781763821840286, -0.07110770046710968, -0.04502938687801361, 0.1143767312169075, 0.03969039395451546, 0.10538674145936966, 0.019969984889030457, 0.04558699205517769, 0.0002530725614633411, -0.022745423018932343, -0.017714744433760643, -0.056374482810497284, 0.0032913682516664267, -0.013126309029757977, -0.039381034672260284, 0.0480901338160038, 0.0381595678627491, 0.06784211844205856, 0.008509702049195766, 0.02835984155535698, 0.02987356297671795, 0.014480935409665108, -0.010000896640121937, 0.01322245318442583, 0.005107898730784655, -0.02850504405796528, 0.017380164936184883, -0.0012056512059643865, -0.025536177679896355, -0.040954120457172394, 0.04397888481616974, 0.03288896009325981, 0.0834018886089325, -0.008942286483943462, -0.019271524623036385, -0.0007509340066462755, -0.008029494434595108, -0.004121539648622274, 0.014891434460878372, 0.013437679968774319, -0.13012102246284485, -0.04019797220826149, -0.021584460511803627, -0.06308258324861526, 0.04154928773641586, 0.05482981353998184, 0.03595102205872536, 0.061169300228357315, 0.06056874990463257, -0.0335189551115036, -0.022701973095536232, -0.030413193628191948, 0.044815368950366974, -0.13317616283893585, -0.03585537150502205, -0.011536342091858387, 0.029559317976236343, 0.04608728364109993, 0.05874892696738243, -0.02829589881002903, 0.058870188891887665, 0.045307811349630356, -0.03949844092130661, 0.007268013432621956, -0.018405726179480553, -0.0758422464132309, -0.06720609962940216, -0.1407260000705719, -0.010224740952253342, 0.024543488398194313, -0.07861535251140594, -0.010482704266905785, 0.15591315925121307, 0.06400597840547562, 0.01634790003299713, -0.03358018770813942, 0.029870454221963882, -0.017879819497466087, -0.015929343178868294, 0.02820536121726036, -0.006245293654501438, 0.026103852316737175, -0.055913642048835754, -0.005529026035219431, -0.061574969440698624, 0.021761437878012657, 0.02271282486617565, 0.07543005794286728, -0.0688481554389, -0.08394134044647217, -0.012391016818583012, -0.09436449408531189, -0.0033411525655537844, 0.003906885627657175, -0.052586305886507034, -0.0854247659444809, -0.005012146197259426, -0.021234648302197456, -0.1544126719236374, 0.008249486796557903, 0.0474976971745491, -0.04048754274845123, 0.03782837465405464, 0.06912821531295776, -0.005826518405228853, 0.032449137419462204, 0.0767759457230568, -0.02898542396724224, 0.020192407071590424, 0.0268841665238142, 0.038817886263132095, -0.04079703614115715, -0.034087106585502625, -0.01066258642822504, 0.11980856955051422, 0.03629650920629501, -0.04824075847864151, -0.00686510419473052, 0.045730359852313995, 0.001093883765861392, -0.0116133326664567, 0.07451185584068298, 0.016573678702116013, 0.0402357317507267, -0.04004346951842308, 0.011175811290740967, 0.05825969576835632, -0.03914281353354454, 0.098177969455719, 0.06640654057264328, 0.07725006341934204, -0.04691491276025772, -0.036866795271635056, -0.0579729899764061, -0.005070095416158438, 0.05335089564323425, -0.004690123721957207, 0.10484869033098221, 0.03235788643360138, -0.05702066794037819, -0.021795516833662987, 0.0024268352426588535, -0.02591109089553356, -0.05797690898180008, -0.013647306710481644, 0.03733408451080322, -0.03762076422572136, 0.03175140172243118, 0.0004090495640411973, 0.0783170685172081, 0.05610322952270508, -0.020615098997950554, 0.01384557131677866, -0.015176832675933838, 0.005483694840222597, -0.036739833652973175, -0.0386984758079052, 0.03408077359199524, 0.051095761358737946, -0.04570692405104637, 0.0005305176600813866, 0.06955203413963318, 0.035309966653585434, 0.03753941133618355, -0.03232681378722191, -0.03648992255330086, 0.030716978013515472, -0.03345926105976105, 0.0026107211597263813, -0.01476316712796688, 0.0030398957896977663, -0.026664724573493004, -0.022597502917051315, -0.009687893092632294, 0.03416405990719795, 0.02855646051466465, -0.046540435403585434, -0.005401599686592817, 0.008819539099931717, 0.021872395649552345, 0.0635240375995636, -0.025302929803729057, 0.031237265095114708, 0.002021951135247946, -0.01058264821767807, -0.013849406503140926, -0.008158532902598381, -0.04101406782865524, -0.045751187950372696, 0.10838571935892105, -0.04532681778073311, -0.06577561050653458, -0.046442266553640366, 0.06417247653007507, -0.09511075913906097, -0.049100667238235474, 1.5927353359626892e-32, -0.06054716184735298, -0.047850869596004486, -0.009991563856601715, 0.00912272185087204, -0.07458731532096863, -0.09290900081396103, 0.03987782076001167, 0.09005094319581985, 0.03400646150112152, -0.02511768974363804, 0.0683826431632042, 0.04866839200258255, 0.057238463312387466, -0.0668300911784172, -0.01576807349920273, 0.0628209337592125, -0.08309723436832428, 0.05175190791487694, 0.027364524081349373, 0.03389757126569748, -0.017338378354907036, 0.06217751279473305, -0.00542754540219903, 0.07133089751005173, -0.03282651677727699, 0.015509319491684437, 0.016544053331017494, -0.046384092420339584, -0.05890629440546036, 0.014441579580307007, -0.007405492011457682, 0.005992873106151819, -0.035437360405921936, 0.12142059206962585, -0.0648626908659935, -0.09126544743776321, 0.06773267686367035, -0.0014764697989448905, -0.013486269861459732, -0.05380288511514664, 0.0053528230637311935, 0.04460417106747627, -0.07781925052404404, 0.05021819844841957, -0.05416540801525116, -0.010962286964058876, 0.037580180913209915, 0.03753621503710747, 0.027528343722224236, 0.020449180155992508, 0.017873253673315048, -0.061646729707717896, 0.0056448932737112045, -0.004954359494149685, 0.0701250210404396, 0.06687967479228973, 0.04596300795674324, 0.039829932153224945, 0.10147406905889511, -0.036881234496831894, -0.06598054617643356, -0.08988849818706512, 0.038144759833812714, 0.03180377185344696, 0.017083417624235153, -0.03923804312944412, -0.06459305435419083, 0.06215672194957733, -0.09274567663669586, 0.033096931874752045, 0.024934416636824608, 0.09906923025846481, -0.06684315949678421, 0.022074049338698387, -0.011314254254102707, 0.003632704261690378, 0.0807257890701294, 0.04215088486671448, -0.0493047833442688, 0.04217933118343353, -0.10724178701639175, 0.04884876310825348, 0.03304693102836609, 0.005384658928960562, -0.00832290668040514, -0.03728562220931053, 0.11208601295948029, -0.003758457023650408, -0.025575032457709312, -0.028151914477348328, -0.01703082211315632, 0.11051598191261292, -0.04410528019070625, -0.021552449092268944, 0.015234005637466908, 4.0785025464527014e-32, 0.046607814729213715, -0.03281767666339874, -0.09294965118169785, -0.01936964876949787, 0.10909266024827957, 0.025073496624827385, -0.03154509514570236, -0.09585915505886078, -0.02751845493912697, -0.08944141864776611, 0.09371979534626007, -0.042322661727666855, -0.13615721464157104, 0.015609193593263626, -0.026509610936045647, -0.02482331357896328, -0.004838499706238508, 0.05035814270377159, 0.0057348208501935005, 0.015192124992609024, 0.07700591534376144, -0.025857500731945038, -0.022398417815566063, -0.03285537660121918, 0.07723665237426758, 0.04909195005893707, 0.04584135487675667, 0.12051765620708466, 0.02880208194255829, 0.0039857239462435246, 0.024911770597100258, -0.026783784851431847, -0.08225498348474503, -0.08457294851541519, -0.08821295201778412, 0.07201013714075089, 0.0931752473115921, 0.01101333275437355, 0.04325228929519653, 0.008313976228237152, 0.031159257516264915, -0.03110036626458168, -0.03557675704360008, 0.016462579369544983, 0.00490231579169631, -0.06300269067287445, -0.05798158049583435, -0.0006664989050477743, 0.031320348381996155, -0.062213361263275146, -0.06227630376815796, 0.014465933665633202, -0.004516536369919777, -0.09810099750757217, 0.010145717300474644, -0.05898834764957428, -0.05884602293372154, -0.01747535727918148, -0.026910381391644478, 0.05322479084134102, 0.06581275910139084, 0.04243910312652588, -0.006302057299762964, 0.025707952678203583]"
