name:ID,type,concepts,synsets,:LABEL
Operation: Dulce,entity,[],[],Node
Taylor Cruz felt the initiative like a heartbeat.,event,[],[],Node
the initiative pulsed like a heartbeat,event,[],[],Node
anticipation thinly veiled behind a mask of duty,event,[],[],Node
They were each alone yet irrevocably joined.,event,[],[],Node
stepping closer towards the volatile embrace of Operation: Dulce,event,[],[],Node
in the midst of the descent,event,[],[],Node
"the initiative pulsed like a heartbeat, anticipation thinly veiled behind a mask of duty",event,[],[],Node
"they were each alone yet irrevocably joined, stepping closer towards the volatile embrace of Operation: Dulce",event,[],[],Node
