name:ID,type,concepts,synsets,:LABEL
Alex Mercer,entity,[],[],Node
dwarfed,entity,[],[],Node
projectors,entity,[],[],Node
Taylor Cruz,entity,[],[],Node
a smile,entity,[],[],Node
Jordan Hayes,entity,[],[],Node
a supportive nod,entity,[],[],Node
Sam Rivera,entity,[],[],Node
a comment,entity,[],[],Node
dismissively,entity,[],[],Node
in his seat,entity,[],[],Node
the struggle,entity,[],[],Node
a quiet resolve,entity,[],[],Node
The thrumming of monitors cast a stark contrast to the rigid silence enveloping the group.,event,[],[],Node
"Agent Alex Mercer, unfailingly determined on paper, seemed dwarfed by the enormity of the sterile briefing room where Paranormal Military Squad's elite convened.",event,[],[],Node
"With dulled eyes, he scanned the projectors outlining their impending odyssey into Operation: Dulce.",event,[],[],Node
"It was Taylor Cruz’s voice, laced with an edge that demanded attention.",event,[],[],Node
"Alex flickered a strained smile, still thumbing his folder's corner.",event,[],[],Node
"'Of course not, Agent Cruz. Just trying to soak in all the details.'",event,[],[],Node
"Jordan Hayes, perched on the opposite side of the table, narrowed their eyes but offered a supportive nod.",event,[],[],Node
"'Details are imperative. We’ll need your clear-headedness down there, Mercer.'",event,[],[],Node
"A comfortable silence, the kind that threaded between veterans of shared secrets, lingered briefly",event,[],[],Node
"Sam Rivera, never one to submit to quiet, added, 'I’ve combed through the last transmission logs. If anyone can make sense of the anomalies, it’s going to be the two of you.'",event,[],[],Node
Taylor snorted dismissively.,event,[],[],Node
"The words 'counter-productive' seemed to hang in the air, a tacit reprimand directed at Alex.",event,[],[],Node
"Feeling the weight of his compliance conflicting with his natural inclination to leave no stone unturned, Alex straightened in his seat.",event,[],[],Node
"'I agree, Agent Cruz. Protocol is paramount,' he said, meeting Taylor's steely gaze.",event,[],[],Node
"Alex's submission, though seemingly complete, didn't escape Jordan, who tilted their head ever so slightly, their eyes revealing a spark of understanding.",event,[],[],Node
They knew well enough the struggle of aligning personal convictions with overarching missions.,event,[],[],Node
"As everyone began to collect their binders and prepare for departure, a quiet resolve took form within Alex, galvanized by the groundwork laid by their interactions.",event,[],[],Node
"He may have spoken in compliance, but his determination had merely taken a subtler form — one that wouldn't surrender so easily to the forthcoming shadows.",event,[],[],Node
Agent Alex Mercer scanned the projectors outlining their impending odyssey into Operation: Dulce.,event,[],[],Node
Agent Alex Mercer,entity,[],[],Node
Taylor Cruz asked Agent Mercer if he was having second thoughts.,event,[],[],Node
Alex replied that he was not having second thoughts.,event,[],[],Node
Jordan Hayes offered a supportive nod.,event,[],[],Node
Sam Rivera added that Alex and Jordan could make sense of the anomalies.,event,[],[],Node
Taylor Cruz told the group to focus and follow protocols.,event,[],[],Node
Alex agreed to follow protocols.,event,[],[],Node
Jordan Hayes showed understanding of Alex's struggle.,event,[],[],Node
The group began to collect their binders and prepare for departure.,event,[],[],Node
office,entity,[],[],Node
screens,entity,[],[],Node
comm signals,entity,[],[],Node
decrypt,entity,[],[],Node
keyboard,entity,[],[],Node
thin air,entity,[],[],Node
neck,entity,[],[],Node
brow,entity,[],[],Node
words,entity,[],[],Node
digital haze,entity,[],[],Node
thought,entity,[],[],Node
leave,entity,[],[],Node
elevator,entity,[],[],Node
Mercer,entity,[],[],Node
"Sam Rivera sat alone in a cramped office, the hum of a dozen servers murmuring a digital lullaby in the background.",event,[],[],Node
"Surrounded by the glow of multiple screens, their eyes danced across lines of code and intercepted comm signals from Dulce — a kaleidoscope of data that their curious and isolated mind hungered to decrypt.",event,[],[],Node
"To an outsider, it might have looked like obsession, this fervent quest for answers.",event,[],[],Node
"But to Sam, it was a dance — a give and take with the mysteries of the universe.",event,[],[],Node
"Their fingers paused over the keyboard as they leaned back in the chair, whispering to thin air, 'What secrets are you hiding from us?'",event,[],[],Node
"The stillness of the room broke with the unexpected arrival of Alex Mercer, whose encroaching shadow loomed over Sam's workspace.",event,[],[],Node
"He has that look — like something's not sitting right with him, they noted inwardly.",event,[],[],Node
"Alex hesitated, weighing his words carefully.",event,[],[],Node
"Our tech is top-tier, but the silence from Dulce... It's not just technology that will see us through, it's intuition and... trust.",event,[],[],Node
"His gaze pierced through the digital haze, trying to instill something more profound than advice.",event,[],[],Node
"Sam regarded Alex for a moment, the sincerity in his voice resonating with their own unspoken desire to prove their worth.",event,[],[],Node
"Intuition,' they mirrored thoughtfully. 'I guess sometimes the numbers don't have all the answers.'",event,[],[],Node
"As Alex turned to leave, Sam's eyes drifted back to the screens, now seeing them not as barriers to isolate behind, but as windows into the vast and enigmatic challenge that awaited their team.",event,[],[],Node
"Outside the office, the persistent buzz of activity in the facility belied the unease that gripped its inhabitants.",event,[],[],Node
"A restlessness that nibbled on the edges of reality, as though forewarning of the threshold they were soon to cross — from the known into the realm of cosmic secrets and silent threats.",event,[],[],Node
Alex Mercer stood gazing at the concealed elevator that would deliver them into the bowels of Dulce base.,event,[],[],Node
"The air was thick, every breath laced with the weight of impending confrontation, the kind one feels when stepping into a legend.",event,[],[],Node
"Though armed with an array of advanced weaponry and gear, there was an unshakeable sense that they were delving into a conflict where the physical might be of little consequence.",event,[],[],Node
"Jordan Hayes remarked, approaching Mercer.",event,[],[],Node
"Their voice was low, a blend of confidence and hidden apprehension.",event,[],[],Node
Dulce,entity,[],[],Node
"Alex hesitated, weighing his words carefully. 'Our tech is top-tier, but the silence from Dulce... It's not just technology that will see us through, it's intuition and... trust.'",event,[],[],Node
facility inhabitants,entity,[],[],Node
"Shadows played against the walls of the cramped underground meeting room, where Alex Mercer stood gazing at the concealed elevator that would deliver them into the bowels of Dulce base.",event,[],[],Node
Dulce base,entity,[],[],Node
"I know what you're thinking,' Jordan Hayes remarked, approaching Mercer. Their voice was low, a blend of confidence and hidden apprehension.",event,[],[],Node
Alex,entity,[],[],Node
rescue,entity,[],[],Node
game,entity,[],[],Node
pawns,entity,[],[],Node
Jordan,entity,[],[],Node
feeling,entity,[],[],Node
layer,entity,[],[],Node
briefing,entity,[],[],Node
Taylor,entity,[],[],Node
exchange,entity,[],[],Node
Sam,entity,[],[],Node
luck,entity,[],[],Node
blind spot,entity,[],[],Node
"Alex turned, his features a mask of uneasy resolve.",event,[],[],Node
"This feels like more than a rescue or reconnaissance mission, doesn't it?",event,[],[],Node
"Jordan gave a short nod, their analytical mind colliding with the uncertain dynamics of this operation.",event,[],[],Node
"I've felt that way since the briefing. Like there's a layer we’re not seeing. And yet, we have no choice but to play along.",event,[],[],Node
"Their eyes locked with Alex's, silently exchanging a vow to remain vigilant.",event,[],[],Node
"Taylor Cruz interjected sharply, stepping into their exchange.",event,[],[],Node
"Alex's response was measured, more assertive than moments ago.",event,[],[],Node
He gripped his rifle with a newfound firmness.,event,[],[],Node
Sam Rivera piped in with a tone of balanced levity.,event,[],[],Node
Their laughter served as a brief respite from the gravity of their mission.,event,[],[],Node
"Then, as one, they stepped into the elevator.",event,[],[],Node
"The doors closed with a silent hiss, and they descended into the darkness together.",event,[],[],Node
Dr. Jordan Hayes couldn't help but muse over the layers of data that could wait below.,event,[],[],Node
Alex caught Jordan's reflective gaze and leaned in.,event,[],[],Node
The compliment was unexpected and weighed differently than praise from others.,event,[],[],Node
"The team was descending into the earth, carrying with them not only the weight of their equipment but also the silent pressure of the invisible war they were about to fight.",event,[],[],Node
"Sam Rivera piped in with a tone of balanced levity, 'Hope everyone’s brought their good luck charms.'",event,[],[],Node
The team stepped into the elevator.,event,[],[],Node
Dr. Jordan Hayes,entity,[],[],Node
"The team descended into the earth, carrying with them not only the weight of their equipment but also the silent pressure of the invisible war they were about to fight.",event,[],[],Node
walls,entity,[],[],Node
Cruz,entity,[],[],Node
expression,entity,[],[],Node
command,entity,[],[],Node
agents,entity,[],[],Node
gear,entity,[],[],Node
confirmation signals,entity,[],[],Node
voice,entity,[],[],Node
Martians,entity,[],[],Node
team,entity,[],[],Node
chuckles,entity,[],[],Node
halting,entity,[],[],Node
group,entity,[],[],Node
threshold,entity,[],[],Node
depths,entity,[],[],Node
door,entity,[],[],Node
hallway,entity,[],[],Node
Agents,entity,[],[],Node
altar,entity,[],[],Node
pace,entity,[],[],Node
comms check,entity,[],[],Node
copy,entity,[],[],Node
The elevator was cut short by a shudder that ran through it.,event,[],[],Node
It wasn't the mechanical stutter of old gears but a vibration that seemed to emanate from the very walls of the shaft—a whisper of something that defied natural explanation.,event,[],[],Node
"Cruz was the first to react, all business despite the shadow that crossed their expression.",event,[],[],Node
"Every agent checked their gear, sending confirmation signals through their comms, creating a chorus of electronic beeps that promised readiness.",event,[],[],Node
"Sam's voice crackled through, only half-jest.",event,[],[],Node
"This elicited a round of chuckles, an audible release of tension that ran counterpoint to the undercurrent of anxiety coursing through the team.",event,[],[],Node
"The group stepped off the elevator, finding themselves at the threshold of Dulce's mysterious halls.",event,[],[],Node
"The elevator came to a halting, eerie calm at the sub-level.",event,[],[],Node
"They stood in a tight pack, sharing a cautious glance before fanning out into the unknown.",event,[],[],Node
"Into the depths of Dulce, the team advanced, their silence now a shared testament to the camaraderie born of facing the abyss together.",event,[],[],Node
The weight of the thick metal door closing behind them reverberated through the concrete hallway.,event,[],[],Node
"Taylor Cruz, stepping firmly into the role of de facto leader, set a brisk pace.",event,[],[],Node
"Sam, fiddling with a handheld device aimed at detecting electronic anomalies, offered a murmured 'Copy that'.",event,[],[],Node
exchange was cut short by a shudder that ran through the elevator,event,[],[],Node
the elevator,entity,[],[],Node
they,entity,[],[],Node
"Cruz was the first to react, all business despite the shadow that crossed their expression",event,[],[],Node
"Every agent checked their gear, sending confirmation signals through their comms, creating a chorus of electronic beeps that promised readiness",event,[],[],Node
every agent,entity,[],[],Node
"Sam's voice crackled through, only half-jest",event,[],[],Node
"this elicited a round of chuckles, an audible release of tension that ran counterpoint to the undercurrent of anxiety coursing through the team",event,[],[],Node
the team,entity,[],[],Node
"the group stepped off, finding themselves at the threshold of Dulce's mysterious halls",event,[],[],Node
the group,entity,[],[],Node
"the team advanced, their silence now a shared testament to the camaraderie born of facing the abyss together",event,[],[],Node
the weight of the thick metal door closing behind them reverberated through the concrete hallway,event,[],[],Node
them,entity,[],[],Node
"Agents Alex Mercer, Jordan Hayes, Taylor Cruz, and Sam Rivera proceed, their movements measured, their senses heightened",event,[],[],Node
Agents Alex Mercer,entity,[],[],Node
"Taylor Cruz, stepping firmly into the role of de facto leader, set a brisk pace",event,[],[],Node
"Sam, fiddling with a handheld device aimed at detecting electronic anomalies, offered a murmured 'Copy that'",event,[],[],Node
panel,entity,[],[],Node
drone,entity,[],[],Node
shoulders,entity,[],[],Node
onward,entity,[],[],Node
resolve,entity,[],[],Node
doors,entity,[],[],Node
ajar,entity,[],[],Node
deeper,entity,[],[],Node
heart,entity,[],[],Node
unknown,entity,[],[],Node
Jordan Hayes paused at an innocuous looking panel.,event,[],[],Node
the panel seemed just another part of the base's infrastructure,event,[],[],Node
Jordan Hayes explained their reasoning.,event,[],[],Node
"Sam approached, instinctively understanding the significance of what lay beneath",event,[],[],Node
Alex joined Jordan's side.,event,[],[],Node
"examining the panel which, at a mere glance, seemed just another part of the base's infrastructure",event,[],[],Node
The soft whir of an approaching drone cut through their muffled exchange.,event,[],[],Node
Before Alex could respond,event,[],[],Node
Taylor had looped back upon hearing the commotion.,event,[],[],Node
The soft whir of an approaching drone cut through their muffled exchange,event,[],[],Node
Cruz’s voice trailed off as the small airborne device came into view.,event,[],[],Node
"The drone lingered, its scan seeming more curious than hostile",event,[],[],Node
Sam was the first to react.,event,[],[],Node
"Sam declared, fingers flying over the controls of their own gadgetry to ward off the impending threat.",event,[],[],Node
Sam was the first to react,event,[],[],Node
The drone retreated into the shadows as if accepting a silent truce.,event,[],[],Node
"Sam declared, fingers flying over the controls of their own gadgetry to ward off the impending threat",event,[],[],Node
"The crew exhaled, a moment of collective relief palpable in the air.",event,[],[],Node
The drone retreated into the shadows as if accepting a silent truce,event,[],[],Node
"Cruz directed, a hint more forceful than before.",event,[],[],Node
"The crew exhaled, a moment of collective relief palpable in the air",event,[],[],Node
The team pressed onward.,event,[],[],Node
"Cruz directed, a hint more forceful than before",event,[],[],Node
The imposing doors to the mainframe room stood ajar.,event,[],[],Node
The team pressed onward,event,[],[],Node
"Without a word, they fortified their resolve and stepped through the threshold.",event,[],[],Node
The imposing doors to the mainframe room stood ajar,event,[],[],Node
They moved deeper into the heart of the enigma.,event,[],[],Node
"Without a word, they fortified their resolve and stepped through the threshold",event,[],[],Node
Jordan called out to Mercer and Rivera to see the panel.,event,[],[],Node
Rivera,entity,[],[],Node
Alex joined Jordan's side to examine the panel.,event,[],[],Node
Jordan explained their reasoning to Sam.,event,[],[],Node
Sam approached and instinctively understood the significance of the panel.,event,[],[],Node
Taylor looped back upon hearing the commotion.,event,[],[],Node
A drone approached the group.,event,[],[],Node
Cruz's voice trailed off as the drone came into view.,event,[],[],Node
Sam reacted to the drone and declared they had it under control.,event,[],[],Node
Sam used their gadgetry to ward off the drone.,event,[],[],Node
The drone retreated into the shadows after being interfered with by Sam.,event,[],[],Node
The crew exhaled in relief after the drone left.,event,[],[],Node
crew,entity,[],[],Node
Cruz directed the team to move out.,event,[],[],Node
Cruz told Rivera to keep their trick handy.,event,[],[],Node
The team pressed onward despite the confrontation.,event,[],[],Node
The team converged upon a central hub.,event,[],[],Node
The team fortified their resolve and stepped through the threshold into the mainframe room.,event,[],[],Node
The team moved deeper into the heart of the enigma.,event,[],[],Node
alien technology,entity,[],[],Node
a translucent component,entity,[],[],Node
Agent Alex Mercer's eyes,entity,[],[],Node
Dr. Jordan Hayes' eyes,entity,[],[],Node
Agent Alex Mercer and Dr. Jordan Hayes,entity,[],[],Node
the device,entity,[],[],Node
"The cooling vents hummed in a monotonous drone, but it was the crackle of the comms system coming to life that cut through the lab’s tension.",event,[],[],Node
"Dr. Jordan Hayes hovered over a table arrayed with alien technology, their fingers delicately probing the enigmatic circuitry retrieved from the crash site.",event,[],[],Node
"Agent Alex Mercer watched, admiration blooming in silent solidarity for Jordan's deft touch and unspoken drive.",event,[],[],Node
"Jordan, always composed, only allowed the faintest furrow of concentration to mar their brow.",event,[],[],Node
"'What we understand about physics...' they muttered, trailing off as they realigned a translucent component.",event,[],[],Node
"The device emitted a low pulse, causing Jordan to still.",event,[],[],Node
A calculated risk—that's what this was.,event,[],[],Node
"And for a person of science, a gamble was worth the potential paradigm shift.",event,[],[],Node
"I’ve been thinking,' Alex started, his eyes still fixed on the immediately tangible mystery before them.",event,[],[],Node
"'About what’s at stake here. Not the mission parameters, but what this means for us—humanity.'",event,[],[],Node
"Jordan glanced up, meeting his eyes just long enough to convey the shared enormity of their situation, the career-defining glory and existential dread entwined.",event,[],[],Node
'The quest for understanding always comes at a price. We're standing on the precipice of knowledge that could either elevate us or condemn us.',event,[],[],Node
The charged air between them spiked as Taylor Cruz’s brusque tones sliced through their reverie.,event,[],[],Node
"'Hayes, Mercer, this isn't philosophy hour. Focus on the task. We need actionable intel, not daydreams.'",event,[],[],Node
"With a sound of restrained acknowledgment, Jordan returned their gaze to the device, while Alex clenched his jaw, the buzz of frustration dull against the backdrop of Taylor's authoritarian certainty.",event,[],[],Node
"It was this competitive undercurrent that kept him alert, the sense that his and Jordan's shared commitment to discovery was an unspoken rebellion against Cruz's narrowing vision of control and order.",event,[],[],Node
Then Taylor did something unexpected.,event,[],[],Node
"They paused beside Jordan and, for a moment, observed the device with something akin to reverence.",event,[],[],Node
"'If this tech can be understood...' Taylor said, their voice quieter, 'It could change the game for us. For all of us.'",event,[],[],Node
"The underlying dismissal earlier seemed to falter, replaced by a glimpse of reluctant respect for the gravity of what lay in their hands.",event,[],[],Node
"Jordan looked up, and for a fleeting heartbeat, their eyes locked with Taylor's, a wordless clash of wills softening into an uneasy truce.",event,[],[],Node
the briefing room,entity,[],[],Node
Paranormal Military Squad's elite,entity,[],[],Node
the cooling vents,entity,[],[],Node
the comms system,entity,[],[],Node
the lab,entity,[],[],Node
the crash site,entity,[],[],Node
'Could be fundamentally changed by this.',event,[],[],Node
"'I’ve been thinking,' Alex started, his eyes still fixed on the immediately tangible mystery before them.",event,[],[],Node
inward nod,entity,[],[],Node
paths,entity,[],[],Node
here,entity,[],[],Node
reasons,entity,[],[],Node
each other,entity,[],[],Node
desires,entity,[],[],Node
anticipation,entity,[],[],Node
lights,entity,[],[],Node
efforts,entity,[],[],Node
machinery,entity,[],[],Node
movement,entity,[],[],Node
artifacts,entity,[],[],Node
future,entity,[],[],Node
briefing room,entity,[],[],Node
facts,entity,[],[],Node
hidden truths,entity,[],[],Node
files,entity,[],[],Node
curiosity,entity,[],[],Node
signal inconsistencies,entity,[],[],Node
past,entity,[],[],Node
patterns,entity,[],[],Node
anomaly,entity,[],[],Node
no one,entity,[],[],Node
hierarchy,entity,[],[],Node
understanding,entity,[],[],Node
mission,entity,[],[],Node
nexus point,entity,[],[],Node
They had all been brought here by different paths and for different reasons.,event,[],[],Node
"beneath the veneer of duty, the enticement of the vast unknown pulled them inexorably together, coalescing their distinct desires into a shared pulse of anticipation.",event,[],[],Node
"They refocused their efforts, each movement sharpened by the knowledge that beyond understanding the unearthly artifacts, they might be piecing together the future of their species.",event,[],[],Node
Marshaled back to the moment by the blink of lights and whir of machinery,event,[],[],Node
"Sam Rivera sat in the briefing room, his demeanor an artful balance of focus and a casual disguise of his razor-sharp talent with technology.",event,[],[],Node
"Amidst the sterility of the briefing room, the liminal space between the facts laid out and the hidden truths",event,[],[],Node
"Alex Mercer lingered in thought, the mental cogs turning as each file on Dulce stirred more than curiosity—it beckoned to a past both honored and burdensome.",event,[],[],Node
"Alex noted, catching the younger man's contemplative gaze.",event,[],[],Node
"'You've been quiet, Sam,' Alex noted, catching the younger man's contemplative gaze.",event,[],[],Node
"Sam nodded, recognizing the space afforded to him, and he couldn't help but feel the weight of expectation pressing upon his shoulders.",event,[],[],Node
"Sam admitted, hesitant but driven.",event,[],[],Node
"'The patterns are... off,' Sam admitted, hesitant but driven.",event,[],[],Node
Alex's eyes brightened with a subtle approval that crossed the distance like a silent nod.,event,[],[],Node
Taylor Cruz's abrupt arrival cut short their exchange.,event,[],[],Node
Their exchange was cut short by Taylor Cruz's abrupt arrival,event,[],[],Node
"They filed out of the briefing room, their footsteps synchronized, a rhythm that spoke volumes of the unknown cadence they would soon march to within the base's veins.",event,[],[],Node
Taylor Cruz's abrupt arrival cut short their exchange,event,[],[],Node
They,entity,[],[],Node
"Yet, beneath the veneer of duty, the enticement of the vast unknown pulled them inexorably together, coalescing their distinct desires into a shared pulse of anticipation.",event,[],[],Node
"Marshaled back to the moment by the blink of lights and whir of machinery, they refocused their efforts, each movement sharpened by the knowledge that beyond understanding the unearthly artifacts, they might be piecing together the future of their species.",event,[],[],Node
"Amidst the sterility of the briefing room, the liminal space between the facts laid out and the hidden truths, sat Sam Rivera, his demeanor an artful balance of focus and a casual disguise of his razor-sharp talent with technology.",event,[],[],Node
"Across from him, Alex Mercer lingered in thought, the mental cogs turning as each file on Dulce stirred more than curiosity—it beckoned to a past both honored and burdensome.",event,[],[],Node
'Your take on these signal inconsistencies?',event,[],[],Node
"There was a respect in Alex's tone, though a respectful distance remained—a gulf of experience and a hint of protective mentorship that stood between them.",event,[],[],Node
"'If I'm right, what we're looking at isn't random—it's a structured anomaly. We need to be ready for anything.'",event,[],[],Node
"'Good. Keen eyes will keep us ahead—or at least not blindsided,' he said, affirming the belief that inscribed Sam's role as more than the tech personnel—he was to be a guiding intellect in the heart of uncertainty.",event,[],[],Node
"Their exchange was cut short by Taylor Cruz's abrupt arrival, his gait brimming with a robust confidence that veiled the sharp undercurrents of his striving nature.",event,[],[],Node
"'Time to gear up. Dulce waits for no one,' Taylor announced, his voice carrying an iron resolve that knew the costs of hesitation—though whether the cost was calculated in human or career terms was an ambiguity he wore like a badge of honor.",event,[],[],Node
"As Sam and Alex nodded in unison, the icy chasm of hierarchy and cryptic protocols seemed momentarily to bridge over with an understanding—this mission was convergence, a nexus point that would challenge each of their motives and strength.",event,[],[],Node
"For Alex Mercer, the link with Sam Rivera, though distant, was now poised with a mutuality ready to face the challenges ahead.",event,[],[],Node
initiative,entity,[],[],Node
mask,entity,[],[],Node
alone,entity,[],[],Node
joined,entity,[],[],Node
towards,entity,[],[],Node
embrace,entity,[],[],Node
