node,conceptualized_node,node_type
The compliment was unexpected and weighed differently than praise from others.,"self-esteem, appreciation, recognition, validation, praise",event
"The compliance in his tone was unsettling, even to himself.","unease, hypocrisy, dishonesty, deception, insincerity",event
The charged air between them spiked as Taylor Cruz’s brusque tones sliced through their reverie.,"tension, conflict, drama, silence, shock",event
Agent Alex Mercer seemed dwarfed by the enormity of the sterile briefing room where Paranormal Military Squad's elite convened.,"elite gathering, briefing, squad, meeting, authority",event
"Alex joined Jordan's side, examining the panel which, at a mere glance, seemed just another part of the base's infrastructure.","allyship, inspection, surveillance, investigation",event
"Sam Rivera piped in with a tone of balanced levity, 'Hope everyone’s brought their good luck charms.'","good luck, humor, levity, charm, speech",event
"As they congregated at the elevator, a tension palpable, Sam Rivera piped in with a tone of balanced levity, 'Hope everyone’s brought their good luck charms. Something tells me we’re going to need all the help we can get.'","joke, tension, levity, luck, humor",event
"Sam Rivera sat in the briefing room, his demeanor an artful balance of focus and a casual disguise of his razor-sharp talent with technology.","briefing, meeting, strategy, tech, talent",event
"Sam's voice crackled through, only half-jest, 'I'd laugh if we run into Martians playing poker down there—just to lighten the mood, you know?'","joking, teasing, humor, space, poker",event
They knew well enough the struggle of aligning personal convictions with overarching missions.,"conflict, dilemma, struggle, alignment, compromise",event
"Alex hesitated, weighing his words carefully.","hesitation, deliberation, pause, consideration, thought",event
"Their torch beams sliced through the darkness, uncovering steel doors with warnings that spoke of top secrets and mortal dangers.","exploration, danger, discovery, secrets, darkness",event
"Jordan Hayes remarked, approaching Mercer.","approach, greeting, interaction",event
"Outside the office, the persistent buzz of activity in the facility belied the unease that gripped its inhabitants.","unease, tension, stress, anxiety, chaos",event
Jordan Hayes showed understanding of Alex's struggle with compliance.,"empathy, support, understanding, struggle, compliance",event
"Sam, it was a dance — a give and take with the mysteries of the universe.","dance, movement, rhythm, cosmos, universe",event
"But there was an unspoken question among them: was their technology, their weaponry, their protocols sufficient for what awaited them or merely a fragile comfort?","doubt, uncertainty, readiness, preparedness, vulnerability",event
"Into the depths of Dulce, the team advanced, their silence now a shared testament to the camaraderie born of facing the abyss together—and the steel resolve to uncover whatever horrors lay hidden in its shadows.","exploration, teamwork, camaraderie, resolution, discovery",event
A calculated risk—that's what this was.,"risk, gamble, decision, calculation, uncertainty",event
"Mercer, Rivera, come see this,' Jordan’s voice was marked with a rare hint of urgency.","urgency, invitation, surprise, alert, announcement",event
"'I’ve combed through the last transmission logs. If anyone can make sense of the anomalies, it’s going to be the two of you.'","analysis, investigation, anomalies, discovery, collaboration",event
"Eyes sharp, people. Comms check, every thirty seconds,' Taylor ordered, their voice echoing slightly before being swallowed by the surrounding silence.","mission, communication, stealth, vigilance, secrecy",event
"Jordan gave a short nod, their analytical mind colliding with the uncertain dynamics of this operation.","agreement, analysis, conflict, decision, uncertainty",event
Then Taylor did something unexpected.,"surprise, twist, unexpected, surprise, turn",event
They filed out of the briefing room,"exit, briefing, departure, protocol, dismissal",event
"exchange was cut short by a shudder that ran through the elevator, subtle, but enough to make them instinctively hold their breaths.","unease, alarm, shock, halt, pause",event
"Cruz squared their shoulders, clearly ruffled but not conceding any ground.","standing, confrontation, bravery, defiance, strength",event
"Taylor Cruz, stepping firmly into the role of de facto leader, set a brisk pace. 'Eyes sharp, people. Comms check, every thirty seconds,' Taylor ordered, their voice echoing slightly before being swallowed by the surrounding silence.","assumption, briefing, leadership, order, directive",event
Jordan Hayes paused at an innocuous looking panel,"discovery, pause, investigation, curiosity, revelation",event
"Sam nodded, recognizing the space afforded to him, and he couldn't help but feel the weight of expectation pressing upon his shoulders.","recognition, weight, expectation, pressure, awareness",event
"They converged upon a central hub, the imposing doors to the mainframe room stood ajar","convergence, invasion, breach, access, infiltration",event
"The imposing doors to the mainframe room stood ajar — an invitation or a trap, neither option comforting.","access, invitation, uncertainty, threat, vulnerability",event
"Taylor Cruz interjected sharply, stepping into their exchange.","interrupt, intervene, dispute, confrontation, entering",event
"The stillness of the room broke with the unexpected arrival of Alex Mercer, whose encroaching shadow loomed over Sam's workspace.","arrival, interruption, invasion, shadow, surprise",event
"Dulce base, a name that had been whispered in the wind-blown deserts above and in the shadowed corners of conspiracy forums, now a tangible cold reality that they could touch — and that touched them back with a chill.","whisper, secrecy, conspiracy, desert, chill",event
It was a small transformation.,"change, evolution, growth, metamorphosis, shift",event
Alex flickered a strained smile and replied that he was not having second thoughts.,"reassurance, denial, confidence, sincerity, calmness",event
"They paused beside Jordan and, for a moment, observed the device with something akin to reverence.","adoration, reverence, worship, reverence, observation",event
They were each alone yet irrevocably joined.,"union, bond, connection, tie, unity",event
"They barked out, 'Systems check. Now,' masking the moment of disquiet with swift command.","orders, command, urgency",event
"Their fingers paused over the keyboard as they leaned back in the chair, whispering to thin air, 'What secrets are you hiding from us?'","inquiry, suspense, revelation, questioning, mystery",event
"the liminal space between the facts laid out and the hidden truths, sat Sam Rivera, his demeanor an artful balance of focus and a casual disguise of his razor-sharp talent with technology.","investigation, deception, inquiry, concealment, analysis",event
"Taylor Cruz's abrupt arrival, his gait brimming with a robust confidence that veiled the sharp undercurrents of his striving nature.","arrival, confidence, swagger, presence, dominance",event
"'I know what you're thinking,' Jordan Hayes remarked, approaching Mercer. Their voice was low, a blend of confidence and hidden apprehension.","confrontation, approach, tension, warning, inquiry",event
gait,"stride, walk, pace, movement, gait, step",entity
The lab,"lab, space, room, area",entity
The device,"device, object, gadget, tool",entity
the drone,"drone, aircraft, robot, machine, device",entity
altar,"place, structure",entity
base's infrastructure,"infrastructure, system, framework",entity
joined,"verb, action, event, occurrence, joining",entity
hallway,"space, corridor",entity
alone,"state, condition, status",entity
paths,"ways, routes",entity
pace,"pace, speed, tempo",entity
digital haze,"digital fog, mist, effect, phenomenon",entity
transmission logs,"records, logs, data",entity
space,"void, emptiness, vacuum",entity
Dr. Jordan Hayes,"scientist, doctor, character, person, researcher",entity
determination,"trait, characteristic, quality, attribute",entity
imposing doors,"doors, entrance, gateway",entity
motives,"reasons, goals, purposes",entity
Sam,"person, character, human, individual",entity
link,"connection, bond, tie",entity
servers,"equipment, hardware, machines",entity
office,"space, room, place, location",entity
panel,"panel, surface, board",entity
information,"data, knowledge, content, facts",entity
Operation: Dulce,"conspiracy, operation, event, project",entity
Dulce base,"legend, facility, base, location, site",entity
dwarfed,"adjective, word, term",entity
Jordan Hayes,"person, actor, celebrity, performer",entity
rhythm,"music, beat, cadence",entity
mission,"trust, goal, task, objective",entity
patterns,"patterns, design, style, form",entity
Agents Alex Mercer,"agents, character, protagonist, player",entity
elevator,"elevator, lift, device, mechanism",entity
initiative,"initiative, project, plan, effort",entity
projectors,"projectors, devices, technology",entity
intuition,"instinct, feeling, insight",entity
group,"team, group, people, organization",entity
doors,"openings, entrance, exit, passage",entity
The comms system,"system, communication, network, device, tool",entity
alien technology,"technology, gadget, device, innovation, sci-fi, equipment, machinery",entity
the team,"team, group, squad",entity
Paranormal Military Squad,"team, squad, unit, organization, military, force",entity
curiosity,"curiosity, interest, emotion, feeling, sensation, intrigue",entity
pawns,"pieces, game, chess",entity
drone,"device, aircraft, robot, vehicle",entity
Cruz,"person, name, character, figure",entity
embrace,"action, gesture, movement",entity
door,"entry, barrier, access, passage, opening, threshold",entity
their gear,"equipment, gear, tools",entity
duty,"obligation, responsibility",entity
gear,"machine, device, tool, component",entity
Alex Mercer,"person, character, hero, protagonist",entity
Mercer,"person, character, actor, name",entity
compliance,"obligation, duty, adherence",entity
facts,"truths, data, information",entity
anticipation,"emotion, feeling, expectation",entity
mainframe room,"room, space, area",entity
central hub,"hub, center, location",entity
rifle,"weapon, firearm, gun",entity
translucent component,"component, part, element",entity
compliment,"praise, acknowledgment",entity
sensors,"sensors, detectors, equipment",entity
command,"order, instruction",entity
voice,"sound, tone",entity
mutuality,"relation, connection, bond",entity
off,"patterns, concept, idea, notion",entity
Agents,"agents, group, team, organization",entity
Paranormal Military Squad's elite,"team, squad, unit, military, elite",entity
team,"group, crew, unit",entity
protocol,"rules, guideline",entity
here,"place, location, spot, area, site",entity
uncertainty,"doubt, concept, feeling, idea, notion, ambiguity",entity
threshold,"limit, boundary",entity
Alien technology,"technology, device, equipment, gadget, machinery, innovation",entity
facility inhabitants,"people, residents, occupants, dwellers",entity
Alex,"person, character, individual, human",entity
significance,"meaning, importance, concept, value",entity
the steel doors,"doors, barrier, metal, gates",entity
confidence,"feeling, emotion",entity
efforts,"efforts, endeavors, attempts",entity
physics,"science, subject, field",entity
the group,"people, group, team, crew",entity
Martians,"beings, aliens, creatures",entity
Anticipation,"emotions, feelings, concept",entity
nothing,"absence, void, emptiness, concept, idea",entity
data,"information, knowledge, content",entity
Agent Mercer,"character, actor, person",entity
Rivera,"artist, painter, artist",entity
resolve,"resolve, problem, issue, solution, answer",entity
attention,"attention, focus, concentration",entity
expectation,"pressure, stress, weight, burden",entity
Dr. Jordan Hayes and Agent Alex Mercer,"characters, actors, people",entity
workspace,"area, space, room",entity
the concrete hallway,"hallway, space, passage, corridor, room",entity
Jordan,"person, athlete, player, champion, icon",entity
mask,"face, disguise, cover",entity
briefing room,"meeting, room, space, area, chamber",entity
screens,"displays, monitors",entity
agents,"people, workers, employees",entity
protocols,"communication, rules, standards",entity
Alex Mercer's struggle,"struggle, conflict, fight",entity
neck,"neck, part, body, anatomy",entity
struggle,"challenge, conflict, ordeal",entity
files,"documents, records, papers",entity
expression,"emotion, feeling, sentiment",entity
thought,"idea, concept, notion",entity
truths,"facts, reality, truths",entity
Agent Cruz,"character, agent, person",entity
footsteps,"rhythm, beat",entity
Dulce's mysterious halls,"halls, corridors, rooms, space, area, place, interior",entity
understanding,"knowledge, insight",entity
help,"luck, assistance",entity
Dulce,"dulce, base, facility, location, site",entity
approval,"approval, consent, permission, agreement",entity
Taylor Cruz,"person, character, actor",entity
mind,"mind, brain, consciousness, awareness",entity
support,"help, aid",entity
trust,"institution, bond, relationship, faith, confidence",entity
Agent Alex Mercer,"character, person, protagonist, hero, individual",entity
the agents,"agents, operatives, team, group, personnel",entity
anomaly,"abnormality, irregularity, peculiarity",entity
shudder,"thrill, fear, anxiety",entity
ajar,"doors, position, state",entity
spark,"spark, flame, fire",entity
luck,"good fortune, chance, luck",entity
the elevator,"elevator, lift, mechanism",entity
intellect,"mind, brain, thought, reasoning, wisdom, knowledge",entity
something,"panel, object",entity
Taylor,"person, name, character, individual",entity
Sam Rivera,"person, character, actor, individual",entity
inward nod,"gaze, nod, signal",entity
device,"device, gadget, object, tool",entity
They,"pronoun, group, entity, people",entity
unknown,"mystery, enigma, secret, puzzle",entity
Agent Alex Mercer's eyes,"eyes, organs, vision",entity
desires,"longing, wants, needs, cravings",entity
arrival,"event, moment, time, occurrence",entity
their comms,"communications, system, network, device",entity
monitors,"electronic, display, screens, devices, equipment, appliances, gadgets",entity
tone,"music, sound, pitch",entity
they,"people, group, entity",entity
The crash site,"site, wreckage, crash, location, debris, remains",entity
eyes,"eyes, organs, vision",entity
dynamics,"physics, force, movement, energy, science",entity
the thick metal door,"door, barrier, threshold, entrance, metal, object",entity
comm signals,"signals, communication, data",entity
shoulders,"pressure, weight, burden",entity
below,"data, storage, location",entity
supportive nod,"greeting, gesture, sign, signal",entity
words,"language, text, words, speech, vocabulary",entity
features,"features, traits, characteristics, attributes",entity
exchange,"exchange, market, trade",entity
brow,"brow, face, feature, area",entity
as a result,"consequence, outcome, result, effect, aftermath",relation
laughed,"smile, guffaw, chuckle, snicker, burst out laughing",relation
challenged,"opposed, confronted, disputed, resisted",relation
proceeded,"followed, occurred, ensued, happened, led to",relation
coalescing,"merge, unite, combine, fuse, integrate",relation
admitted,"admitted, let in, grant access, allow in",relation
reprimanded,"scolded, criticized, punished, rebuked",relation
advanced,"progressed, improved, developed, enhanced",relation
pierced,"poked, stuck, breached, penetrated, broken through",relation
nodded,"agreed, signaled, acknowledged, consented, confirmed",relation
hungered,"craved, yearned, desired, longed, pined",relation
craned,"lift, hoist, pull up",relation
drifted,"wandered, floated, drifted away, moved, changed direction, shifted, separated, lost course",relation
stepping,"move, shift, progress, advance, proceed",relation
barked,"make noise, sound off, vocalize, give warning",relation
because,"as a result of, due to, owing to, thanks to, on account of",relation
added,"added, append, attached, incorporate, supplement",relation
appeared,"showed up, popped up, emerged, appeared, came into view",relation
regarded,"viewed as, considered to be, perceived as, seen as, taken to be",relation
glanced,"caught a glimpse of, saw briefly, looked at, peeked at",relation
formed,"created, developed, established, brought into existence",relation
and,"connect, combine, link",relation
observed,"seen, noticed, witnessed, perceived, observed",relation
pulsed,"vibrated, oscillated, fluctuated, beat, pulsated",relation
noted,"marked, recorded, noticed, highlighted, remembered",relation
after,"follow, succeed, come next, ensue, follow up",relation
directed,"led, guided, pointed, steered, commanded",relation
spoke,"communicate, utter, express, talk, say",relation
paused,"stopped, halted, suspended, interrupted, ceased",relation
brightened,"lit up, shine, made brighter, increased brightness",relation
is participated by,"involves, is included in, acted by, is part of, is represented by",relation
brimming,"overflowing, full, packed, teeming, overflowing",relation
responded,"react, answer, reply, respond, react to, reply to",relation
fortified,"strengthened, made stronger, reinforced, hardened",relation
lingered,"remained, stayed, persisted, lasted, endured",relation
intercepted,"interrupt, cut off, block, seize, stop",relation
mused,"pontified, ruminated, reflected",relation
moved,"changed location, relocated, shifted, moved to, changed place",relation
hesitated,"wavered, vacillated, hesitated, dithered, faltered",relation
stirred,"agitated, excited, disturbed, shaken",relation
knew,"recognized, familiar with, acquainted with, knew about, had knowledge of",relation
demanded,"demanded, required, necessitated, requested, commanded",relation
pressing,"forceful, intense, urgent",relation
felt,"experienced, sensed, perceived, felt, understood",relation
sat,"occupied, filled, settled, rested",relation
understood,"grasp, comprehend, realize, know, perceive",relation
probed,"examined, investigated, inquired, looked into, delved into",relation
stepped,"walked, moved, proceeded, advanced, stepped",relation
pulled,"tugged, drawn, pulled, yanked, hauled",relation
said,"uttered, spoke, mentioned, expressed, stated",relation
ran,"run, sprint, dash, speed, accelerate",relation
realigned,"realign, adjust, reset, revise, correct",relation
crackled,"made a sound, emitted a noise, produced a crackle",relation
arrived,"reached, got to, show up, come in, land",relation
locked eyes,"gazed, met, stared, locked, looked",relation
cut,"separate, divide, split, fragment, disjoint",relation
poised,"ready, balanced, steady, calm, composed",relation
saw,"observed, noticed, perceived, witnessed",relation
checked,"verified, inspected, examined, tested, reviewed",relation
at the same time,"concurrently, simultaneously, together, in tandem, at once",relation
gripped,"held, seized, clutched, grasped",relation
locked,"secured, fastened, closed, sealed, locked",relation
closed,"sealed, shut, locked, finished, ended",relation
acknowledged,"recognized, accepted, admitted, confessed, acknowledged",relation
waited,"delay, pause, hold back, tarry, linger",relation
converged,"merge, unite, come together",relation
was,"existed, happened, occurred",relation
before,"precede, lead, come first, precede, antecedent, prior to",relation
bridged,"connected, linked, spanned",relation
turned,"changed, transformed, converted, altered, changed",relation
interrupted,"broken, cut off, halted, stopped, paused",relation
remarked,"commented, noted, observed, mentioned",relation
scanned,"examined, inspected, looked at, viewed, observed",relation
approached,"neared, drew near, came close, got close to, reached out to",relation
became,"became, turned into, evolved into, changed into, transformed into",relation
met,"encountered, bumped into, collided with, ran into, crossed paths with",relation
reacted,"responded, acted, reacted to, reply, answer back, counteract, retaliate, respond to",relation
were,"existed, happened, occurred, took place, was the case",relation
offered,"provided, given, presented, supplied, donated",relation
laid,"placed, put, set, deposited, laid down",relation
watched,"observed, viewed, gazed, stared, saw",relation
guiding,"lead, direct, steer, navigate, counsel",relation
weighed,"weighed, measured, evaluated, considered, assessed",relation
placed,"located, situated, positioned, put, placed, set",relation
set,"define, establish, create, form, constitute",relation
synchronized,"coordinated, timed, harmonized, aligned, matched",relation
afforded,"provided, offered, granted, given",relation
seemed,"appeared, looked, seemed, gave impression, presented itself, showed itself",relation
structured,"organized, arranged, ordered, formatted, categorized",relation
worked,"collaborate, cooperate, labor",relation
towards,"in, direction, approach, orientation, alignment",relation
covering,"encompass, enclose, surround, cover, shield",relation
had,"possessed, owned, held, contained, had
experienced, undergone, suffered, endured, tolerated
possessed in the past, held in the past, had in the past",relation
mirrored,"reflect, duplicate, replicate, copy, echo",relation
explained,"clarified, described, made clear, elaborated, illuminated",relation
whispered,"whisper, speak softly, murmur, mumble, speak quietly",relation
asked,"queried, inquired, questioned, sought, requested",relation
brought,"brought, carried, introduced, presented, delivered",relation
muttered,"whisper, speak, say, utter, voice",relation
loomed,"cast a shadow, darken, overshadow, loom large",relation
sharpened,"improved, enhanced, refined, honed, polished",relation
hovered,"loiter, linger, hang around, drift, hover",relation
aligned,"sync, match, adjust, harmonize, synchronize",relation
collided,"crash, bump, impact, collide, smash",relation
interfered,"interrupt, intervene, meddle, obstruct, disturb",relation
stood,"stood, remained, endured, persisted, continued",relation
