node,conceptualized_node,node_type
"They stood in a tight pack, sharing a cautious glance before fanning out into the unknown, each one acutely aware that the truth was inevitably intertwined with danger.","caution, danger, uncertainty, vigilance, survival",event
"They refocused their efforts, each movement sharpened by the knowledge that beyond understanding the unearthly artifacts, they might be piecing together the future of their species.","discovery, unraveling, future, understanding, evolution",event
"Alex's response was measured, more assertive than moments ago.","assertion, change, response, shift, calmness",event
Jordan Hayes offered a supportive nod to Alex.,"encouragement, support, empathy, kindness",event
"And for a person of science, a gamble was worth the potential paradigm shift.","risk, gamble, discovery, shift, innovation",event
"To think that this reluctance to accept other possibilities may have been my biggest blind spot, Jordan contemplated, feeling the hard shell of skepticism begin to crack.","contemplation, self, discovery, introspection, epiphany",event
"Taylor announced, his voice carrying an iron resolve, 'Time to gear up. Dulce waits for no one.'","declaration, resolve, preparation, determination, warning",event
'The quest for understanding always comes at a price. We're standing on the precipice of knowledge that could either elevate us or condemn us.',"discovery, warning, elevation, knowledge, danger",event
"As Alex turned to leave, Sam's eyes drifted back to the screens, now seeing them not as barriers to isolate behind, but as windows into the vast and enigmatic challenge that awaited their team.","teamwork, distraction, isolation, challenge, focus",event
Taylor snorted dismissively.,"disdain, dismissal, rejection",event
"Sam was the first to react, their tech-savvy mind already steps ahead.","reaction, thinking, anticipation, awareness, preparedness",event
"A restlessness that nibbled on the edges of reality, as though forewarning of the threshold they were soon to cross — from the known into the realm of cosmic secrets and silent threats.","threshold, cosmic, secrets, warning, approach",event
Taylor Cruz reprimanded the team for speculation.,"reprimand, discipline, scolding, reprimand, warning",event
"'Acknowledged, Agent Cruz,' he replied, his voice steadier, mirroring the transformation brewing within.","acknowledgment, transformation, confirmation, change, acceptance",event
"Alex's submission, though seemingly complete, didn't escape Jordan, who tilted their head ever so slightly, their eyes revealing a spark of understanding.","submission, review, discovery, understanding",event
"The drone lingered, its scan seeming more curious than hostile","exploration, surveillance, scanning, hovering",event
Taylor Cruz was to be tested.,"exam, challenge, test, assessment, evaluation",event
"‘Move out,’ they directed, a hint more forceful than before.","eviction, warning, eviction notice",event
"The elevator came to a halting, eerie calm at the sub-level.","halt, calm, descent, pause, silence",event
"Sam regarded Alex for a moment, the sincerity in his voice resonating with their own unspoken desire to prove their worth.","regard, introspection, sincerity, validation, selfworth",event
"Surrounded by the glow of multiple screens, their eyes danced across lines of code and intercepted comm signals from Dulce — a kaleidoscope of data that their curious and isolated mind hungered to decrypt.","hacking, coding, surveillance, intercept, decryption",event
"Their laughter served as a brief respite from the gravity of their mission, a shared moment that reinforced their common humanity amidst the unknowable.","shared moment, humanity, connection, relief, camaraderie",event
Sam and Alex nodded in unison.,"agreement, consensus, nodding, synchrony, unity",event
"Without a word, they fortified their resolve and stepped through the threshold, where the dim glow of operational LED lights and the distant hum of machinery hinted at Dulce’s still-beating heart.","entry, resolution, determination, progress, initiation",event
Alex agreed with Taylor Cruz that protocol was paramount.,"agreement, consent, approval, protocol, cooperation",event
"It was Jordan Hayes who paused at an innocuous looking panel, nondescript amongst the gauntlet of secured doorways.","access, security, pause, discovery",event
They fortified their resolve and stepped through the threshold,"determination, resolve, transition, passage, courage",event
"Sam was the first to react, their tech-savvy mind already steps ahead","react, initiative, progress, innovation, anticipation",event
"Sam nodded, recognizing the space afforded to him","recognition, space, freedom, acceptance",event
"It was Taylor Cruz’s voice, laced with an edge that demanded attention.","command, dominance, voice, authority",event
"'Our tech is top-tier, but the silence from Dulce... It's not just technology that will see us through, it's intuition and... trust.'","silence, trust, intuition, technology, secrecy, dulce, mystery",event
"Every agent checked their gear, sending confirmation signals through their comms, creating a chorus of electronic beeps that promised readiness.","preparation, readiness, check, confirmation, signals",event
"Sam Rivera piped in with a tone of balanced levity, 'Hope everyone’s brought their good luck charms. Something tells me we’re going to need all the help we can get.'","drama, humor, warning, fortune, luck",event
"The weight of the thick metal door closing behind them reverberated through the concrete hallway, marking the final threshold between the familiar world above and the strangeness that lay beneath.","separation, isolation, confinement, transition, descent",event
"Sam's voice crackled through, only half-jest. 'I'd laugh if we run into Martians playing poker down there—just to lighten the mood, you know?'","space, aliens, poker, humor, laughter",event
"Sam, fiddling with a handheld device aimed at detecting electronic anomalies, offered a murmured 'Copy that,'","investigation, scanning, detection, surveillance, monitoring",event
"The cybersecurity expert craned their neck upwards, met by the ever-so-slight furrow in Alex's brow.","gaze, tension, suspicion, interaction, scrutiny",event
"Once we're down there, keep that analytical edge sharp. You see through the mazes of the unexplained better than anyone.","investigation, analysis, mystery, puzzle, insight",event
"Feeling the weight of his compliance conflicting with his natural inclination to leave no stone unturned, Alex straightened in his seat.","defiance, tension, conflict, duty, resolve",event
"Sam Rivera, never one to submit to quiet, added, 'I’ve combed through the last transmission logs. If anyone can make sense of the anomalies, it’s going to be the two of you.'","investigation, analysis, anomaly, mission, discovery",event
"Sam Rivera sat alone in a cramped office, the hum of a dozen servers murmuring a digital lullaby in the background.","isolation, monotony, solitude, boredom, technology",event
They were stepping closer towards the volatile embrace of Operation: Dulce.,"stepping, approach, invasion, secrecy, conspiracy",event
"Yet, to the trained eye, it appeared out of place—a facade","deception, facade, disguise, illusion, concealment",event
"The group stepped off, finding themselves at the threshold of Dulce's mysterious halls.","exploration, discovery, entrance, threshold, mystery",event
"'What we understand about physics...' they muttered, trailing off as they realigned a translucent component.","experiment, tinkering, engineering, research, adjustment",event
"The team was descending into the earth, carrying with them not only the weight of their equipment but also the silent pressure of the invisible war they were about to fight—a war that seemed to edge away from physicality and into the unnervingly psychological.","descent, pressure, war, conflict, exploration",event
"Like lambs led to an altar of alien deities, so did Agents Alex Mercer, Jordan Hayes, Taylor Cruz, and Sam Rivera proceed, their movements measured, their senses heightened.","ritual, sacrifice, abduction, possession, invasion",event
"As Sam and Alex nodded in unison, the icy chasm of hierarchy and cryptic protocols seemed momentarily to bridge over with an understanding—this mission was convergence, a nexus point that would challenge each of their motives and strength.","unison, convergence, understanding, challenge, cooperation",event
"Alex turned, his features a mask of uneasy resolve.","turn, decision, resolve, tension, conflict",event
"The team pressed onward, the quiet now filled with the soft beeps of regular comms checks, their pace undeterred by the confrontation.","confrontation, advancement, perseverance, communication, mission",event
"'I’ve been thinking,' Alex started, his eyes still fixed on the immediately tangible mystery before them.","contemplation, introspection, discovery, mystery, investigation",event
"A comfortable silence, the kind that threaded between veterans of shared secrets, lingered briefly.","silence, secrets, bond, trust, nostalgia",event
"The air was still, almost respectful of the gravity of their presence.","serenity, calmness, stillness, reverence, solemnity",event
"Jordan glanced up, meeting his eyes just long enough to convey the shared enormity of their situation, the career-defining glory and existential dread entwined.","confrontation, rivalry, meeting, stare, tension",event
"Cruz’s voice trailed off as the small airborne device came into view, its sensors locked onto the group.","surveillance, detection, pursuit, capture, confrontation",event
"For Alex Mercer, the link with Sam Rivera, though distant, was now poised with a mutuality ready to face the unknown","reunion, connection, bond, unity, mutualism",event
"Jordan explained their reasoning as Sam approached, instinctively understanding the significance of what lay beneath, 'This panel is a recent addition — covering something they didn't want found.'","revelation, discovery, uncovering, secrecy, mystery",event
Alex Mercer stood gazing at the concealed elevator that would deliver them into the bowels of Dulce base.,"infiltration, stealth, espionage, surveillance, infiltration",event
They were each alone yet irrevocably joined,"union, connection, togetherness, bond, marriage",event
"'Good. Keen eyes will keep us ahead—or at least not blindsided,' he said","caution, warning, vigilance, preparedness, foresight",event
"Shadows played against the walls of the cramped underground meeting room, where Alex Mercer stood gazing at the concealed elevator that would deliver them into the bowels of Dulce base.","conceal, espionage, infiltration, surveillance, secrecy",event
"The drone lingered, its scan seeming more curious than hostile.","exploration, hovering, surveillance",event
he couldn't help but feel the weight of expectation pressing upon his shoulders,"pressure, burden, stress, expectation, weight",event
"The team pressed onward, the quiet now filled with the soft beeps of regular comms checks","navigation, progression, communication, coordination",event
"Alex Mercer lingered in thought, the mental cogs turning as each file on Dulce stirred more than curiosity—it beckoned to a past both honored and burdensome.","reflection, introspection, contemplation, remembrance, nostalgia",event
The sincerity in his voice resonating with their own unspoken desire to prove their worth.,"emotional, sincerity, resonance, worth, desire, connection",event
"'Details are imperative. We’ll need your clear-headedness down there, Mercer.'","mission, briefing, assignment, operation",event
"Sam nodded, recognizing the space afforded to him.","recognition, acceptance, awareness, understanding, realization",event
The thrumming of monitors cast a stark contrast to the rigid silence enveloping the group.,"contrast, silence, tension, monitoring, surveillance",event
"Jordan, always composed, only allowed the faintest furrow of concentration to mar their brow.","composure, calmness, focus, poise, control",event
They had all been brought here by different paths and for different reasons.,"asylum, refuge, sanctuary, reunion, unity",event
"'Hayes, Mercer, this isn't philosophy hour. Focus on the task. We need actionable intel, not daydreams.'","reprimand, focus, productivity, task, urgency",event
"With dulled eyes, he scanned the projectors outlining their impending odyssey into Operation: Dulce.","scanning, odyssey, operation, exploration, invasion",event
It wasn't the mechanical stutter of old gears but a vibration that seemed to emanate from the very walls of the shaft—a whisper of something that defied natural explanation.,"paranormal, anomaly, mystery, phenomenon, vibration",event
"They moved deeper into the heart of the enigma, ready to unmask the lifeforce of Dulce base","investigation, discovery, unmasking, infiltration, uncovering",event
"Solemnly, yet unmistakably together, they moved deeper into the heart of the enigma, ready to unmask the lifeforce of Dulce base or confront whatever existential threat lay in wait.","exploration, discovery, investigation, confrontation, threat",event
"A comfortable silence, the kind that threaded between veterans of shared secrets, lingered briefly before Sam Rivera, never one to submit to quiet, added, 'I’ve combed through the last transmission logs. If anyone can make sense of the anomalies, it’s going to be the two of you.'","confrontation, revelation, discussion, analysis, investigation",event
"Despite—or perhaps because of—the oddity of the moment, this elicited a round of chuckles, an audible release of tension that ran counterpoint to the undercurrent of anxiety coursing through the team.","laughter, relief, tension, release, anxiety",event
"Cruz was the first to react, all business despite the shadow that crossed their expression.","reaction, alert, surprise, reaction, tension",event
"Jordan looked up, and for a fleeting heartbeat, their eyes locked with Taylor's, a wordless clash of wills softening into an uneasy truce.","gaze, encounter, standoff, truce, confrontation",event
"Alex flickered a strained smile, still thumbing his folder's corner.","anxiety, stress, frustration, fidgeting, tension",event
Their laughter served as a brief respite from the gravity of their mission.,"relief, respite, distraction, momentary, break",event
"Taylor snorted dismissively. 'Focus, people. We have protocols for a reason. Speculation is counter-productive.'","criticism, warning, protocol, discipline",event
Jordan explained their reasoning as Sam approached,"explaining, approaching, conversation, clarification, explanation",event
The crackle of the comms system coming to life that cut through the lab’s tension.,"communication, alert, relief, distraction, activation",event
"As they descended, Dr. Jordan Hayes couldn't help but muse over the layers of data that could wait below, now almost longing for the comfort of empirical evidence.","descent, curiosity, longing, evidence, discovery",event
"As the elevator came to a halting, eerie calm at the sub-level, the group stepped off, finding themselves at the threshold of Dulce's mysterious halls.","arrival, discovery, exploration, threshold, mystery",event
"'You've been quiet, Sam,' Alex noted, catching the younger man's contemplative gaze.","quiet, contemplation, observation, notice, reflection",event
"Agent Alex Mercer watched, admiration blooming in silent solidarity for Jordan's deft touch and unspoken drive.","admiration, solidarity, admiration, respect, recognition, approval, appreciation",event
"With a sound of restrained acknowledgment, Jordan returned their gaze to the device, while Alex clenched his jaw, the buzz of frustration dull against the backdrop of Taylor's authoritarian certainty.","tension, conflict, authority, frustration, disagreement",event
'Could be fundamentally changed by this.',"revolution, transformation, change, impact, shift",event
"'I've felt that way since the briefing. Like there's a layer we’re not seeing. And yet, we have no choice but to play along.'","conspiracy, deception, secrecy, intrigue, manipulation",event
"Cruz squared their shoulders, clearly ruffled but not conceding any ground","standing, defiance, bravery, challenge, confrontation",event
"Before Alex could respond, the soft whir of an approaching drone cut through their muffled exchange.","surprise, interruption, invasion, distraction, encounter",event
They were stepping closer towards the volatile embrace of Operation: Dulce,"confrontation, invasion, occupation, battle, assault",event
"They filed out of the briefing room, their footsteps synchronized, a rhythm that spoke volumes of the unknown cadence they would soon march to within the base's veins.","march, briefing, cadence, synchronized, deployment",event
"The words 'counter-productive' seemed to hang in the air, a tacit reprimand directed at Alex.","reprimand, criticism, warning, caution, confrontation",event
"Jordan Hayes, perched on the opposite side of the table, narrowed their eyes but offered a supportive nod.","conflict, tension, support, nod, interaction",event
"Cruz was the first to react, all business despite the shadow that crossed their expression. 'Systems check. Now,' they barked out, masking the moment of disquiet with swift command.","command, control, reaction, urgency, mask, alert",event
"'Of course not, Agent Cruz. Just trying to soak in all the details.'","conversation, dialogue, investigation",event
"Alex Mercer, whose encroaching shadow loomed over Sam's workspace.","menace, shadow, invasion, threat, darkness",event
Anticipation was thinly veiled behind a mask of duty,"deception, duty, tension, restraint, anticipation",event
"Their eyes locked with Alex's, silently exchanging a vow to remain vigilant.","gaze, vow, vigilance, commitment, promise",event
"The underlying dismissal earlier seemed to falter, replaced by a glimpse of reluctant respect for the gravity of what lay in their hands.","change, respect, shift, gravity, realization",event
"A comfortable silence, the kind that threaded between veterans of shared secrets, lingered briefly before Sam Rivera, never one to submit to quiet, added,","silence, pause, reflection, conversation, revelation",event
"Alex hesitated, weighing his words carefully. 'Our tech is top-tier, but the silence from Dulce... It's not just technology that will see us through, it's intuition and... trust.'","reflection, consideration, trust, intuition, negotiation",event
"Without a word, they fortified their resolve and stepped through the threshold,","resolve, determination, courage, step, threshold",event
"Agent Alex Mercer, unfailingly determined on paper, seemed dwarfed by the enormity of the sterile briefing room where Paranormal Military Squad's elite convened.","briefing, mission, deployment, briefing room, elite meeting",event
"As everyone began to collect their binders and prepare for departure, a quiet resolve took form within Alex, galvanized by the groundwork laid by their interactions.","resolve, departure, bond, growth, transformation",event
"The initiative pulsed like a heartbeat, anticipation thinly veiled behind a mask of duty.","initiative, pulse, duty, anticipation, heartbeat",event
"Taylor Cruz, stepping firmly into the role of de facto leader, set a brisk pace.","leadership, authority, momentum, pace, command",event
"Alex joined Jordan's side, examining the panel","teamwork, collaboration, investigation, analysis, assistance",event
"He may have spoken in compliance, but his determination had merely taken a subtler form — one that wouldn't surrender so easily to the forthcoming shadows.","determination, defiance, resistance, subtlety, surrender",event
"About what’s at stake here. Not the mission parameters, but what this means for us—humanity.","existential, survival, humanity, consequence, fate",event
"The device emitted a low pulse, causing Jordan to still.","static, pause, shock, silence, freeze",event
Taylor Cruz asked Agent Mercer if he was having second thoughts.,"inquiry, questioning, doubt, uncertainty",event
Their usual buoyancy dimmed by the oppressive atmosphere.,"mood, depression, gloom, darkness, despair",event
Dr. Jordan Hayes couldn't help but muse over the layers of data that could wait below.,"musing, discovery, exploration, investigation, research",event
The soft whir of an approaching drone cut through their muffled exchange,"surveillance, invasion, interruption, disturbance, eavesdropping",event
Alex's eyes brightened with a subtle approval that crossed the distance like a silent nod.,"connection, approval, nod, recognition, understanding",event
"Sam admitted, hesitant but driven, 'The patterns are... off.'","admission, concern, discovery",event
Sam Rivera added that Alex and Jordan were going to make sense of the anomalies.,"analysis, investigation, anomalies, sense, discovery",event
the blink of lights and whir of machinery,"industrial, machinery, noise, chaos, commotion",event
"beneath the veneer of duty, the enticement of the vast unknown pulled them inexorably together","attraction, seduction, allure, temptation, longing",event
"It was an affirmation, but beneath it lay layers of unspoken complexities that would undoubtedly unwind with time.","affirmation, complexity, unfolding, nuance, revelation",event
"'Focus, people. We have protocols for a reason. Speculation is counter-productive.'","briefing, warning, caution, protocol, order",event
"A shudder ran through the elevator, subtle, but enough to make them instinctively hold their breaths.","scare, tension, shock, fear, panic",event
Taylor had looped back upon hearing the commotion.,"turn, reversal, loop, change",event
"'Time to gear up. Dulce waits for no one,' Taylor announced","preparation, urgency, announcement, waiting, warning",event
"Yet, every agent held a renewed sense of wariness, their trust in one another deepening with the knowledge that the base—its technology, its secrets—was alive in a way they hadn't fully anticipated.","unease, mistrust, uncertainty, awakening, discovery",event
Taylor Cruz felt the initiative like a heartbeat,"initiative, heartbeat, momentum, drive, passion",event
"The cooling vents hummed in a monotonous drone, but it was the crackle of the comms system coming to life that cut through the lab’s tension.","reboot, alert, tension, communication, alarm",event
The team began to collect their binders and prepare for departure.,"packing, preparation, departure, farewell",event
Taylor Cruz's abrupt arrival cut short their exchange.,"arrival, interruption, cut, interruption, sudden, entry",event
"Alex noted, catching the younger man's contemplative gaze, 'You've been quiet, Sam.'","confrontation, warning, silence, observation, tension",event
"Jordan Hayes who paused at an innocuous looking panel, nondescript amongst the gauntlet of secured doorways.","security, pause, inspection, access, control",event
"Their shared silence held a newfound understanding, a recognition that between the ones and zeros, it was their combined human insights that might prevail against the impossible.","realization, connection, insight, understanding, triumph",event
"Jordan said, the words carrying a trace of newfound assertiveness.","assertiveness, confidence, speech, tone, statement",event
"'About what’s at stake here. Not the mission parameters, but what this means for us—humanity.'","reflection, humanity, mission, stakes, existence",event
Amidst the sterility of the briefing room,"sterility, isolation, confinement, boredom, monotony",event
"The crew exhaled, a moment of collective relief palpable in the air.","relief, exhalation, release, calm, respite",event
"To an outsider, it might have looked like obsession, this fervent quest for answers.","search, inquiry, pursuit, obsession, discovery",event
"They filed out of the briefing room, their footsteps synchronized.","marching, procession, exit, synchrony, discipline",event
"His gaze pierced through the digital haze, trying to instill something more profound than advice.","reflection, insight, wisdom, advice, contemplation",event
"'I agree, Agent Cruz. Protocol is paramount,' he said, meeting Taylor's steely gaze.","agreement, protocol, meeting, confirmation, approval",event
"'If this tech can be understood...' Taylor said, their voice quieter, 'It could change the game for us. For all of us.'","understanding, breakthrough, revelation, discovery, impact",event
"'It's like we're being pulled into someone else’s game. Not just observers or participants, but... pawns.'","game, manipulation, control, pawn, conspiracy",event
"The air was thick, every breath laced with the weight of impending confrontation, the kind one feels when stepping into a legend.","legend, confrontation, tension, suspense, ominousness",event
"Dr. Jordan Hayes hovered over a table arrayed with alien technology, their fingers delicately probing the enigmatic circuitry retrieved from the crash site.","investigation, discovery, analysis, probing, retrieval",event
"Alex caught Jordan's reflective gaze and leaned in, his voice barely a murmur over the hum of the elevator.","romance, intimacy, attraction, whisper, closeness",event
"'You two need to cut the philosophical chatter. We have positions to secure,' Taylor Cruz interjected sharply, stepping into their exchange.","interruption, warning, assert, dominance, command",event
"It was this competitive undercurrent that kept him alert, the sense that his and Jordan's shared commitment to discovery was an unspoken rebellion against Cruz's narrowing vision of control and order.","rebellion, defiance, control, power, resistance",event
