source,target,relation,description,source_chunk
California Breed,English-American,cultural_identity,California Breed was an English-American band,unknown_0
California Breed,Supergroup,type,California Breed was a supergroup,unknown_0
California Breed,Album,release,California Breed released an album,unknown_0
California Breed,Breakup,event,California Breed was formed after the breakup of Black Country Communion,unknown_0
California Breed,Formation,event,California Breed was formed in 2013,unknown_0
California Breed,Recording,event,California Breed recorded an album with Dave Cobb,unknown_0
California Breed,Release,event,California Breed released an album through Frontiers Records,unknown_0
Trapeze,John Jones,member,John Jones was a member of Trapeze,unknown_0
Trapeze,Terry Rowley,member,Terry Rowley was a member of Trapeze,unknown_0
Trapeze,Mel Galley,member,Mel Galley was a member of Trapeze,unknown_0
Trapeze,Glenn Hughes,member,Glenn Hughes was a member of Trapeze,unknown_0
Trapeze,Dave Holland,member,Dave Holland was a member of Trapeze,unknown_0
Trapeze,The Montanas,previous_band,John Jones and Terry Rowley were previously members of The Montanas,unknown_0
Trapeze,Finders Keepers,previous_band,Mel Galley and Dave Holland were previously members of Finders Keepers,unknown_0
Glenn Hughes,Deep Purple,joined,Glenn Hughes joined Deep Purple in 1973,unknown_0
Trapeze,Cannock,location,"Trapeze was formed in Cannock, Staffordshire",unknown_0
Glenn Hughes,Different Stages – The Best of Glenn Hughes,vocalist/bassist,Glenn Hughes is the vocalist/bassist of the album,unknown_0
Different Stages – The Best of Glenn Hughes,Deep Purple,associated_with,Glenn Hughes was a member of Deep Purple,unknown_0
Different Stages – The Best of Glenn Hughes,Black Sabbath,associated_with,Glenn Hughes was a member of Black Sabbath,unknown_0
Different Stages – The Best of Glenn Hughes,Trapeze,associated_with,Glenn Hughes was a member of Trapeze,unknown_0
Different Stages – The Best of Glenn Hughes,SPV records,released_by,The album was released by SPV records,unknown_0
Release,2002,occurred_in,The album was released in 2002,unknown_0
Mark Simpson,BBC Young Musician of the Year,winner,won the title in 2006,unknown_0
Mark Simpson,BBC Young Composer of the Year,winner,won the title in 2006,unknown_0
Mark Simpson,Royal Northern College of Music,student,studied clarinet with Nicholas Cox,unknown_0
Mark Simpson,King David High School,alumni,attended the school,unknown_0
Mark Simpson,National Youth Orchestra of Great Britain,member,played Principal Clarinet,unknown_0
Mark Simpson,Peter Eaton clarinet,used,played a Peter Eaton clarinet,unknown_0
Mark Simpson,Royal College of Music,student,attended the college,unknown_0
Mark Simpson,St. Catherine's College,student,read for a BA in Music,unknown_0
Mark Simpson,Oxford University,alumni,graduated from the university,unknown_0
Mark Simpson,BA in Music,recipient,read for a BA in Music,unknown_0
Doctor Who: The Music,BBC Radiophonic Workshop,produced_by,Compilation album produced by the BBC Radiophonic Workshop,unknown_0
BBC Radiophonic Workshop,Dick Mills,member,Dick Mills was a member of the BBC Radiophonic Workshop,unknown_0
BBC Radiophonic Workshop,Doctor Who,created_music_for,The BBC Radiophonic Workshop created music for the Doctor Who television program,unknown_0
Dick Mills,Doctor Who,sound_effects_creator,Dick Mills was a sound effects creator for the Doctor Who television program,unknown_0
Ron Grainer,Doctor Who,composer,Ron Grainer composed the theme tune for the Doctor Who television program,unknown_0
Delia Derbyshire,Doctor Who,composer,Delia Derbyshire composed music for the Doctor Who television program,unknown_0
Malcolm Clarke,The Sea Devils,composer,Malcolm Clarke composed music for the 1972 serial of the Doctor Who television program,unknown_0
The Mind of Evil,Dudley Simpson,composer,Dudley Simpson composed music for the 1971 serial of the Doctor Who television program,unknown_0
Planet of the Daleks,Dudley Simpson,composer,Dudley Simpson composed music for the 1973 serial of the Doctor Who television program,unknown_0
Earthshock,Silva Screen records,released_by,The 1983 serial of the Doctor Who television program was released by Silva Screen records,unknown_0
The Best Of Doctor Who Volume 1 - The Five Doctors,Silva Screen records,released_by,The 1994 compilation album of music from the Doctor Who television program was released by Silva Screen records,unknown_0
Alf Heiberg Clausen,The Simpsons,composer,Alf Heiberg Clausen composed music for The Simpsons,unknown_0
Alf Heiberg Clausen,Moonlighting,composer,Alf Heiberg Clausen composed music for Moonlighting,unknown_0
Alf Heiberg Clausen,The Naked Gun,composer,Alf Heiberg Clausen composed music for The Naked Gun,unknown_0
Alf Heiberg Clausen,ALF,composer,Alf Heiberg Clausen composed music for ALF,unknown_0
Alf Heiberg Clausen,Ferris Bueller's Day Off,composer,Alf Heiberg Clausen composed music for Ferris Bueller's Day Off,unknown_0
Hail to the Hills of Westwood,"University of California, Los Angeles",associated_with,school song of UCLA,unknown_0
Hail to the Hills of Westwood,Jeane Emerso,written_by,songwriter of Hail to the Hills of Westwood,unknown_0
Hail to the Hills of Westwood,UCLA Marching Band,performed_by,current arrangement performed by UCLA Marching Band,unknown_0
"University of California, Los Angeles",Hail to the Hills of Westwood,has,school song of UCLA,unknown_0
UCLA Marching Band,Dwayne S. Milburn,member,band member of UCLA Marching Band,unknown_0
UCLA Marching Band,"University of California, Los Angeles",associated_with,marching band of UCLA,unknown_0
Dwayne S. Milburn,UCLA Marching Band,created_arrangement_for,created arrangement for 1985 football season,unknown_0
Sarp Bridge,Sarpsborg,located_in,"The Sarp Bridge is located in Sarpsborg, Norway",unknown_0
Sarp Bridge,Norway,located_in,The Sarp Bridge is located in Norway,unknown_0
Sarp Bridge,Glomma,crosses,The Sarp Bridge crosses the river Glomma,unknown_0
Sarp Bridge,Sarpefossen,over,The Sarp Bridge is over the Sarpefossen waterfall,unknown_0
Østfold Line,Sarp Bridge,carries,The Østfold Line carries a single track over the Sarp Bridge,unknown_0
National Road 118,Sarp Bridge,carries,National Road 118 carries two lanes over the Sarp Bridge,unknown_0
Celebrity Mastermind,Mastermind,version_of,Celebrity Mastermind is a version of the quiz show Mastermind,unknown_0
Celebrity Mastermind,John Humphrys,hosted_by,John Humphrys hosts Celebrity Mastermind,unknown_0
Celebrity Mastermind,BBC television,broadcast_on,Celebrity Mastermind is broadcast on BBC television,unknown_0
Mastermind,John Humphrys,hosted_by,John Humphrys hosts the main show Mastermind,unknown_0
Mastermind,BBC television,broadcast_on,Mastermind is broadcast on BBC television,unknown_0
Donnie Simpson,The Donnie Simpson Morning Show,host,Donnie Simpson hosted the show,unknown_0
Donnie Simpson,The Donnie Simpson Show,host,Donnie Simpson hosts the show,unknown_0
Donnie Simpson,WPGC-FM,employed,Donnie Simpson worked at WPGC-FM,unknown_0
Donnie Simpson,WMMJ-FM,employed,Donnie Simpson works at WMMJ-FM,unknown_0
Donnie Simpson,George Parker,agent,George Parker is Donnie Simpson's agent,unknown_0
Donnie Simpson,Billboard,awarded,Donnie Simpson was awarded by Billboard,unknown_0
Donnie Simpson,Love Bug,nickname,Donnie Simpson is known as Love Bug,unknown_0
Donnie Simpson,The Green-eyed Bandit,nickname,Donnie Simpson is known as The Green-eyed Bandit,unknown_0
Donnie Simpson,Dr. Green Eyes,nickname,Donnie Simpson is known as Dr. Green Eyes,unknown_0
Royal Train,United Kingdom,located_in,The Royal Train is used in the United Kingdom,unknown_0
Royal Train,British Royal Family,used_by,The Royal Train is used by the British Royal Family,unknown_0
Royal Train,Railway network,part_of,The Royal Train is part of the railway network in the United Kingdom,unknown_0
Luxury,Critics,criticized_by,Critics criticize the Royal Train as a luxury,unknown_0
Utility,Supporters,supported_by,Supporters argue that the Royal Train emphasizes utility,unknown_0
Steam locomotives,Royal Train,used_on,Steam locomotives have been used on the Royal Train,unknown_0
National Railway Museum,Royal Train,exhibited,The National Railway Museum has exhibited the Royal Train,unknown_0
Heritage railways,Royal Train,preserved_on,The Royal Train has been preserved on heritage railways,unknown_0
Pre-nationalisation era,Royal Train,originated_in,The Royal Train originated in the pre-nationalisation era,unknown_0
Mid-19th Century,Royal Train,first_used_in,The Royal Train was first used in the mid-19th century,unknown_0
The Simpsons Theme,The Simpsons,theme music of,The Simpsons Theme is the theme music of The Simpsons,unknown_0
The Simpsons Theme,Danny Elfman,composed by,Danny Elfman composed The Simpsons Theme,unknown_0
The Simpsons Theme,Matt Groening,requested by,Matt Groening requested a retro-style theme from Danny Elfman,unknown_0
The Simpsons Theme,Retro-style theme,characterized as,The Simpsons Theme is a retro-style theme,unknown_0
The Simpsons Theme,Opening sequence,plays during,The Simpsons Theme plays during the opening sequence,unknown_0
The Simpsons Theme,Alf Clausen,re-arranged by,Alf Clausen re-arranged The Simpsons Theme,unknown_0
Las Lomitas Elementary School District,Las Lomitas Elementary School,attends,Students in the district attend Las Lomitas Elementary School,unknown_0
Las Lomitas Elementary School,La Entrada Middle School,attends,Students attend La Entrada Middle School after 3rd grade,unknown_0
La Entrada Middle School,Sequoia Union High School District,matriculates,Students from La Entrada Middle School matriculate to the Sequoia Union High School District,unknown_0
Sequoia Union High School District,Menlo-Atherton High School,attends,Most students attend Menlo-Atherton High School,unknown_0
Sequoia Union High School District,Woodside High School,attends,Some students attend Woodside High School,unknown_0
Las Lomitas Elementary School District,Blue Ribbon Award,has_won,Several LLESD schools have won the Blue Ribbon Award,unknown_0
Semmering railway,Austria,located_in,The Semmering railway is located in Austria,unknown_0
Semmering railway,Gloggnitz,starts_at,The Semmering railway starts at Gloggnitz,unknown_0
Semmering railway,Mürzzuschlag,leads_to,The Semmering railway leads to Mürzzuschlag,unknown_0
Semmering railway,Southern Railway,part_of,The Semmering railway is part of the Southern Railway,unknown_0
Semmering railway,Austrian Federal Railways,operated_by,The Semmering railway is operated by the Austrian Federal Railways,unknown_0
Semmering railway,Mountain railway,instance_of,The Semmering railway is an instance of a mountain railway,unknown_0
Semmering railway,standard gauge track,uses,The Semmering railway uses a standard gauge track,unknown_0
construction,Semmering railway,resulted_in,The construction of the Semmering railway resulted in the first mountain railway in Europe,unknown_0
difficult terrain,Semmering railway,operates_in,The Semmering railway operates in difficult terrain,unknown_0
altitude difference,Semmering railway,characterized_by,The Semmering railway is characterized by a significant altitude difference,unknown_0
Most–Moldava railway,Czech Republic,located_in,The railway is located in Czech Republic,unknown_0
Most–Moldava railway,Prague-Dux Railway,operated_by,The railway was originally built and operated by Prague-Dux Railway,unknown_0
Most–Moldava railway,Teplitz Semmering Railway,former_name,The railway was formerly known as Teplitz Semmering Railway,unknown_0
Most–Moldava railway,Ore Mountains,passes_through,The railway passes through the Ore Mountains,unknown_0
Most–Moldava railway,Moldava,ends_at,The railway ends at Moldava,unknown_0
Most–Moldava railway,Nossen-Moldau railway,had_junction_with,The railway had a junction with Nossen-Moldau railway until 1945,unknown_0
Most–Moldava railway,Moldavská horská dráha,also_known_as,The railway is also known as Moldavská horská dráha,unknown_0
Most–Moldava railway,Krušnohorská železnice,also_known_as,The railway is also known as Krušnohorská železnice,unknown_0
Southern Railway,Austria,located_in,The Southern Railway is located in Austria,unknown_0
Southern Railway,Vienna,starts_at,The Southern Railway starts at Vienna,unknown_0
Southern Railway,Graz,ends_at,The Southern Railway ends at Graz,unknown_0
Southern Railway,Slovenia,crosses_border,The Southern Railway crosses the border with Slovenia,unknown_0
Southern Railway,Semmering,passes_through,The Southern Railway passes through Semmering,unknown_0
Southern Railway,Bruck an der Mur,passes_through,The Southern Railway passes through Bruck an der Mur,unknown_0
Austrian Southern Railway,Southern Railway,built,The Austrian Southern Railway built the Southern Railway,unknown_0
Austrian Federal Railways (ÖBB),Southern Railway,operates,The Austrian Federal Railways (ÖBB) operates the Southern Railway,unknown_0
Rudyard Lake Steam Railway,Rudyard Lake,located_on,The railway is located on the lake,unknown_0
Rudyard Lake Steam Railway,Staffordshire,located_in,The railway is located in Staffordshire,unknown_0
Rudyard Lake Steam Railway,North Staffordshire Railway,predecessor,The railway was built on the site of the old North Staffordshire Railway line,unknown_0
Rudyard Lake Steam Railway,Peter Hanton,built_by,Peter Hanton built the railway,unknown_0
Rudyard Lake Steam Railway,Congleton,associated_with,Peter Hanton is from Congleton,unknown_0
Rudyard Lake Steam Railway,Trago Mills,previously_operated_from,The railway previously operated from Trago Mills in Devon,unknown_0
Rudyard Lake Steam Railway,Suffolk,originally_operated_from,The railway originally operated from Suffolk,unknown_0
Rudyard Lake Steam Railway,Devon,currently_operates_in,The railway currently operates in Devon,unknown_0
Rudyard Lake Steam Railway,Ridable miniature railway,instance_of,The railway is an example of a ridable miniature railway,unknown_0
Rudyard Lake Steam Railway,Standard gauge,previously_used,The railway previously used standard gauge,unknown_0
Rudyard Lake Steam Railway,Narrow gauge,currently_uses,The railway currently uses narrow gauge,unknown_0
Rudyard Lake Steam Railway,Timetable,operates_to,The railway operates to a timetable,unknown_0
Rudyard Lake Steam Railway,Construction,involved_in,The railway was involved in the construction process,unknown_0
Rudyard Lake Steam Railway,Operation,currently_involved_in,The railway is currently involved in the operation process,unknown_0
Rudyard Lake Steam Railway,Sale,involved_in,The railway was involved in the sale process,unknown_0
Carolina & Northwestern Railway,Southern Railway,controlled_by,Operated as a separate railroad,unknown_0
Carolina & Northwestern Railway,Norfolk Southern Railway,renamed,Name changed in 1974,unknown_0
Southern Railway,Norfolk Southern Railway,merged_with,Formed Norfolk Southern Railway in 1982,unknown_0
Norfolk and Western Railroad,Norfolk Southern Railway,merged_with,Formed Norfolk Southern Railway in 1982,unknown_0
Carolina & Northwestern Railway,South Carolina,served,Provided rail service,unknown_0
Carolina & Northwestern Railway,North Carolina,served,Provided rail service,unknown_0
Southern Railway,Carolina & Northwestern Railway,leased,Shortline subsidiaries leased to Ca&NW,unknown_0
D. William Brosnan,Southern Railway,president,D. William Brosnan was the president of Southern Railway,unknown_0
Southern Railway,Norfolk and Western Railroad,merged with,Southern Railway merged with Norfolk and Western Railroad to form Norfolk Southern Railway,unknown_0
D. William Brosnan,Georgia Department of Highways,worked for,D. William Brosnan worked for the Georgia Department of Highways,unknown_0
D. William Brosnan,"Albany, Georgia",born in,"D. William Brosnan was born in Albany, Georgia",unknown_0
Hakone Tozan Railway,Japan,located_in,Hakone Tozan Railway is located in Japan,unknown_0
Hakone Tozan Railway,Odakyu Group,part_of,Hakone Tozan Railway is part of Odakyu Group,unknown_0
Hakone Tozan Railway,Hakone Tozan Line,operates,Hakone Tozan Railway operates Hakone Tozan Line,unknown_0
Hakone Tozan Railway,Hakone Tozan Bus,operates,Hakone Tozan Railway operates Hakone Tozan Bus,unknown_0
Hakone Tozan Railway,Hakone Tozan Cable Car,operates,Hakone Tozan Railway operates Hakone Tozan Cable Car,unknown_0
Green Mountain Cog Railway,Green Mountain,located_on,the railway is built on the mountain,unknown_0
Green Mountain Cog Railway,Mount Desert Island,located_on,the railway is located on the island,unknown_0
Green Mountain Cog Railway,Maine,located_in,the railway is located in the state of Maine,unknown_0
Green Mountain Cog Railway,track,has,the railway has a track,unknown_0
Green Mountain Cog Railway,tourists,serves,the railway serves tourists,unknown_0
Green Mountain Cog Railway,gauge,uses,the railway uses a narrow gauge,unknown_0
gauge,narrow gauge,is_a,a gauge is a type of narrow gauge,unknown_0
East Siberian Railway,Russia,part_of,The East Siberian Railway is a part of Russia,unknown_0
East Siberian Railway,Russian Railways,owned_by,The East Siberian Railway is owned by Russian Railways,unknown_0
East Siberian Railway,Trans-Siberian Railway,part_of,The East Siberian Railway is a part of the Trans-Siberian Railway,unknown_0
East Siberian Railway,Irkutsk Oblast,passes_through,The East Siberian Railway passes through Irkutsk Oblast,unknown_0
East Siberian Railway,Chita Oblast,passes_through,The East Siberian Railway passes through Chita Oblast,unknown_0
East Siberian Railway,Buryatia,passes_through,The East Siberian Railway passes through Buryatia,unknown_0
East Siberian Railway,Yakutia,passes_through,The East Siberian Railway passes through Yakutia,unknown_0
East Siberian Railway,Krasnoyarsk Railway,borders_with,The East Siberian Railway borders with the Krasnoyarsk Railway,unknown_0
East Siberian Railway,Trans-Baikal Railway,borders_with,The East Siberian Railway borders with the Trans-Baikal Railway,unknown_0
East Siberian Railway,Baikal Amur Mainline,borders_with,The East Siberian Railway borders with the Baikal Amur Mainline,unknown_0
East Siberian Railway,Russo-Mongolian border,runs_close_to,The East Siberian Railway runs close to the Russo-Mongolian border,unknown_0
2008,East Siberian Railway,related_to,The East Siberian Railway was related to the year 2008,unknown_0
2005,East Siberian Railway,related_to,The East Siberian Railway was related to the year 2005,unknown_0
Reisseck Railway,Carinthia,located_in,The Reisseck Railway runs from Carinthia's Möll valley,unknown_0
Reisseck Railway,Reißeck Group,passes_through,The Reisseck Railway runs into the Reißeck Group,unknown_0
Reisseck Railway,Reisseck Funicular,comprises,The Reisseck Railway comprises the Reisseck Funicular,unknown_0
Reisseck Railway,Reisseck Mountain Railway,comprises,The Reisseck Railway comprises the Reisseck Mountain Railway,unknown_0
Lost,ABC,aired on,Lost aired on ABC from 2004 to 2010,unknown_0
Lost,Primetime Emmy Awards,nominated for,Lost was nominated for 54 Primetime Emmy Awards,unknown_0
Lost,Outstanding Drama Series,won,Lost won the Primetime Emmy Award for Outstanding Drama Series,unknown_0
Lost,Best Television Series – Drama,won,Lost won the Golden Globe Award for Best Television Series – Drama,unknown_0
Lost,Peabody Award,won,Lost won the Peabody Award,unknown_0
Frances Hardman Conroy,Ruth Fisher,played,Frances Hardman Conroy played the character Ruth Fisher on Six Feet Under,unknown_0
Frances Hardman Conroy,Moira O'Hara,played,Frances Hardman Conroy played the character Moira O'Hara on American Horror Story,unknown_0
Frances Hardman Conroy,American Horror Story,appeared_in,Frances Hardman Conroy appeared in American Horror Story,unknown_0
Frances Hardman Conroy,Six Feet Under,appeared_in,Frances Hardman Conroy appeared in Six Feet Under,unknown_0
Frances Hardman Conroy,Golden Globe,won,Frances Hardman Conroy won a Golden Globe,unknown_0
Frances Hardman Conroy,Screen Actors Guild Awards,won,Frances Hardman Conroy won a Screen Actors Guild Award,unknown_0
Frances Hardman Conroy,Saturn Award,nominated,Frances Hardman Conroy was nominated for a Saturn Award,unknown_0
Frances Hardman Conroy,Emmy Award,nominated,Frances Hardman Conroy was nominated for an Emmy Award,unknown_0
Frances Hardman Conroy,Primetime Emmy Award,nominated,Frances Hardman Conroy was nominated for a Primetime Emmy Award,unknown_0
Megan Mullally,Karen Walker,portrayed,Megan Mullally played the role of Karen Walker on Will & Grace,unknown_0
Megan Mullally,Will & Grace,appeared in,Megan Mullally was a cast member on Will & Grace,unknown_0
Megan Mullally,Primetime Emmy Award,nominated for,Megan Mullally received 7 consecutive Primetime Emmy Award nominations,unknown_0
Megan Mullally,Screen Actors Guild Award,nominated for,Megan Mullally received 7 consecutive Screen Actors Guild Awards nominations,unknown_0
Megan Mullally,Golden Globe Award,nominated for,Megan Mullally received 4 Golden Globe Award nominations,unknown_0
Karen Walker,Will & Grace,character on,Karen Walker was a character on Will & Grace,unknown_0
Will & Grace,Primetime Emmy Award,won,Will & Grace won numerous Primetime Emmy Awards,unknown_0
Will & Grace,Screen Actors Guild Award,won,Will & Grace won numerous Screen Actors Guild Awards,unknown_0
Will & Grace,Golden Globe Award,won,Will & Grace won numerous Golden Globe Awards,unknown_0
Lucy Liu,Ally McBeal,played,played the role of Ling Woo,unknown_0
Lucy Liu,Charlie's Angels,starred,played the role of Alex Munday,unknown_0
Lucy Liu,Kill Bill,portrayed,played the role of O-Ren Ishii,unknown_0
Lucy Liu,Kung Fu Panda,voiced,voiced the character Master Viper,unknown_0
Ally McBeal,Primetime Emmy Award,nominated,nominated for outstanding supporting actress in a comedy series,unknown_0
Ally McBeal,Screen Actors Guild Award,nominated,nominated for outstanding performance by a female actor in a comedy series,unknown_0
Geoffrey Roy Rush,Academy Award,won,Geoffrey Roy Rush won the Academy Award for his performance in 'Shine',unknown_0
Geoffrey Roy Rush,Primetime Emmy Award,won,Geoffrey Roy Rush won the Primetime Emmy Award for his performance in a television show,unknown_0
Geoffrey Roy Rush,Tony Award,won,Geoffrey Roy Rush won the Tony Award for his performance in a play,unknown_0
Geoffrey Roy Rush,Triple Crown of Acting,achieved,"Geoffrey Roy Rush achieved the Triple Crown of Acting by winning the Academy Award, Primetime Emmy Award, and Tony Award",unknown_0
Geoffrey Roy Rush,Australian Academy of Cinema and Television Arts,founding President,Geoffrey Roy Rush is the founding President of the Australian Academy of Cinema and Television Arts,unknown_0
Geoffrey Roy Rush,Australian of the Year,named,Geoffrey Roy Rush was named the 2012 Australian of the Year,unknown_0
Geoffrey Roy Rush,Shine,starred in,Geoffrey Roy Rush starred in the film 'Shine',unknown_0
Geoffrey Roy Rush,BAFTA Award,won,Geoffrey Roy Rush won the BAFTA Award for his performance in 'Shine',unknown_0
Geoffrey Roy Rush,Critics' Choice Movie Award,won,Geoffrey Roy Rush won the Critics' Choice Movie Award for his performance in 'Shine',unknown_0
Geoffrey Roy Rush,Golden Globe Award,won,Geoffrey Roy Rush won the Golden Globe Award for his performance in 'Shine',unknown_0
Geoffrey Roy Rush,Screen Actors Guild Award,won,Geoffrey Roy Rush won the Screen Actors Guild Award for his performance in 'Shine',unknown_0
Uzoamaka Nwanneka Aduba,Orange Is the New Black,acted_in,played the role of Suzanne Warren,unknown_0
Uzoamaka Nwanneka Aduba,Emmy Award,won,won an Emmy Award for Outstanding Guest Actress in a Comedy Series,unknown_0
Uzoamaka Nwanneka Aduba,Screen Actors Guild Award,won,won two Screen Actors Guild Awards for Outstanding Performance by a Female Actor in a Comedy Series,unknown_0
Ed Asner,Lou Grant,played,played the role of Lou Grant,unknown_0
Uzoamaka Nwanneka Aduba,Ed Asner,similar_to,one of only two actors to win an Emmy Award recognition in both the comedy and drama categories for the same role,unknown_0
Miranda Hobbes,Sex and the City,part_of,Miranda Hobbes is a character on Sex and the City,unknown_0
Miranda Hobbes,Cynthia Nixon,portrayed_by,Cynthia Nixon portrays Miranda Hobbes,unknown_0
Cynthia Nixon,Emmy Award,recipient,Cynthia Nixon received an Emmy Award,unknown_0
Cynthia Nixon,Screen Actors Guild Award,recipient,Cynthia Nixon received a Screen Actors Guild Award,unknown_0
Anna Gunn,Skyler White,portrayed,Anna Gunn portrayed the character Skyler White in Breaking Bad,unknown_0
Anna Gunn,Primetime Emmy Awards,won,Anna Gunn won two consecutive Primetime Emmy Awards for Outstanding Supporting Actress in a Drama Series,unknown_0
Anna Gunn,Screen Actors Guild Award,won,Anna Gunn won the Screen Actors Guild Award for Outstanding Performance by an Ensemble in a Drama Series,unknown_0
Skyler White,Breaking Bad,character_in,Skyler White is a fictional character in Breaking Bad,unknown_0
Breaking Bad,Anna Gunn,featured,Anna Gunn was featured in the TV series Breaking Bad,unknown_0
Suzanne Warren,Uzo Aduba,played_by,Uzo Aduba plays the role of Suzanne Warren,unknown_0
Suzanne Warren,Orange Is the New Black,part_of,Suzanne Warren is a character on Orange Is the New Black,unknown_0
Uzo Aduba,Emmy Award,won,Uzo Aduba won an Emmy Award for her performance as Suzanne Warren,unknown_0
Uzo Aduba,Critics' Choice Television Award,won,Uzo Aduba won a Critics' Choice Television Award for her performance as Suzanne Warren,unknown_0
Uzo Aduba,Screen Actors Guild Award,won,Uzo Aduba won a Screen Actors Guild Award for her performance as Suzanne Warren,unknown_0
Suzanne Warren,Emotional outburst,characterized_by,Suzanne Warren is prone to emotional outbursts,unknown_0
Suzanne Warren,Social skills,lacking_in,Suzanne Warren lacks social skills,unknown_0
Season one,Suzanne Warren,features,Suzanne Warren is a recurring character in season one,unknown_0
