source,target,relation,description,source_chunk
Phthinosuchia,Phthinosuchus,instance_of,Phthinosuchus is a member of the infraorder Phthinosuchia,unknown_0
Phthinosauridae,Phthinosaurus,instance_of,Phthinosaurus is a member of the family Phthinosauridae,unknown_0
Everett C. Olson,Phthinosuchia,classified,Everett C. Olson classified Phthinosuchia,unknown_0
Leonid Tatarinov,Phthinosauridae,named,Leonid Tatarinov named Phthinosauridae,unknown_0
Kate Dillon Levin,Washington D.C.,born in,Kate Dillon Levin was born in Washington D.C.,unknown_0
Kate Dillon Levin,University of St. Thomas,attended,Kate Dillon Levin attended the University of St. Thomas,unknown_0
Kate Dillon Levin,Harvard University's John F. Kennedy School of Government,attended,Kate Dillon Levin attended Harvard University's John F. Kennedy School of Government,unknown_0
Kate Dillon Levin,Gabe Levin,married to,Kate Dillon Levin was married to Gabe Levin,unknown_0
Kate Dillon Levin,Gabe Levin,had a son with,Kate Dillon Levin had a son with Gabe Levin,unknown_0
Kate Dillon Levin,Plus-size model,is a,Kate Dillon Levin is a plus-size model,unknown_0
Kate Dillon Levin,Activist,is an,Kate Dillon Levin is an activist,unknown_0
Kate Dillon Levin,Actress,is an,Kate Dillon Levin is an actress,unknown_0
Kate Dillon Levin,Non-profit organization,involved with,Kate Dillon Levin is involved with non-profit organizations,unknown_0
Kate Dillon Levin,Eating disorder awareness and treatment,advocates for,Kate Dillon Levin advocates for eating disorder awareness and treatment,unknown_0
Kate Dillon Levin,Sustainability,advocates for,Kate Dillon Levin advocates for sustainability,unknown_0
Kate Dillon Levin,Global poverty reduction,advocates for,Kate Dillon Levin advocates for global poverty reduction,unknown_0
Kate Dillon Levin,Social justice,advocates for,Kate Dillon Levin advocates for social justice,unknown_0
Anthony Frederick Levin,King Crimson,member,played with the band,unknown_0
Anthony Frederick Levin,Peter Gabriel,collaborator,worked together on music projects,unknown_0
Anthony Frederick Levin,Liquid Tension Experiment,member,played with the band,unknown_0
Anthony Frederick Levin,Bruford Levin Upper Extremities,member,played with the band,unknown_0
Anthony Frederick Levin,ProjeKct One,member,played with the band,unknown_0
Anthony Frederick Levin,ProjeKct Four,member,played with the band,unknown_0
Anthony Frederick Levin,Stick Men,leader,led the band,unknown_0
Gabriel Levin,Ibis Editions,founding editor,Levin is one of the founding editors of Ibis Editions,unknown_0
Gabriel Levin,Levant,associated with,Levin's work focuses on the literature of the Levant,unknown_0
Gabriel Levin,operation Cast Lead,inspired by,Levin wrote 'To these Dark Steps' in response to the operation,unknown_0
Gabriel Levin,To these Dark Steps,author,Levin wrote the volume,unknown_0
Alexander Goehr,To these Dark Steps,composer,Goehr set the volume to music,unknown_0
To these Dark Steps,CBSO Centre,premiered at,The volume premiered at the CBSO Centre in 2012,unknown_0
Meyer Levin,Compulsion,author,Levin wrote the novel,unknown_0
Tereska Torres,Meyer Levin,parent,Torres is the mother of Meyer Levin,unknown_0
Leonid Anatolievich Levin,computer scientist,instance_of,Leonid is an instance of a computer scientist,unknown_0
Leonid Anatolievich Levin,Soviet-American,instance_of,Leonid is an instance of a Soviet-American,unknown_0
Leonid Anatolievich Levin,"November 2, 1948",birth_date,"Leonid was born on November 2, 1948",unknown_0
Pavel Samuilovich Urysohn,dimension theory,contributed to,made significant contributions to the field,unknown_0
Pavel Samuilovich Urysohn,Urysohn's Metrization Theorem,developed,formulated the theorem,unknown_0
Pavel Samuilovich Urysohn,Urysohn's Lemma,developed,formulated the lemma,unknown_0
Pavel Samuilovich Urysohn,Urysohn universal space,named,had a concept named after him,unknown_0
Pavel Samuilovich Urysohn,Fréchet–Urysohn space,named,had a concept named after him,unknown_0
Pavel Samuilovich Urysohn,Menger–Urysohn dimension,named,had a concept named after him,unknown_0
Pavel Samuilovich Urysohn,Urysohn integral equation,named,had a concept named after him,unknown_0
Pavel Samuilovich Urysohn,Pavel Alexandrov,collaborated with,worked together on a project,unknown_0
Pavel Samuilovich Urysohn,compactness,contributed to,made significant contributions to the field,unknown_0
Meyer Levin,novelist,instance_of,Meyer Levin was a novelist,unknown_0
Meyer Levin,journalist,instance_of,Meyer Levin was a journalist,unknown_0
Meyer Levin,Leopold and Loeb case,involved_in,Meyer Levin worked on the Leopold and Loeb case,unknown_0
Meyer Levin,Chicago Daily News,worked_for,Meyer Levin worked for the Chicago Daily News,unknown_0
Meyer Levin,Esquire,worked_for,Meyer Levin worked for Esquire,unknown_0
Leonid Bunimovich,dynamical systems,specializes_in,Leonid Bunimovich specializes in dynamical systems,unknown_0
Leonid Bunimovich,chaos,discovered,Leonid Bunimovich discovered a fundamental mechanism of chaos in dynamical systems,unknown_0
Leonid Bunimovich,Bunimovich stadium,created,Leonid Bunimovich created the Bunimovich stadium,unknown_0
Leonid Bunimovich,Bunimovich mushrooms,introduced,Leonid Bunimovich introduced the Bunimovich mushrooms,unknown_0
Yakov G. Sinai,Leonid Bunimovich,thesis_adviser,Yakov G. Sinai was the thesis adviser of Leonid Bunimovich,unknown_0
University of Moscow,Leonid Bunimovich,educated,Leonid Bunimovich received his degree from the University of Moscow,unknown_0
Whiteout Conditions,The New Pornographers,release_by,The album was released by The New Pornographers,unknown_0
Whiteout Conditions,Album,instance_of,Whiteout Conditions is an instance of an album,unknown_0
Kurt Dahle,The New Pornographers,member_of,Kurt Dahle is a member of The New Pornographers,unknown_0
Dan Bejar,The New Pornographers,member_of,Dan Bejar is a member of The New Pornographers,unknown_0
Allan Carl Newman,Superconductor,member,was a member of the band,unknown_0
Allan Carl Newman,Zumpano,member,was a member of the band,unknown_0
Allan Carl Newman,New Pornographers,leader,led the band,unknown_0
Superconductor,Zumpano,similar,both were indie rock bands,unknown_0
Zumpano,New Pornographers,similar,both were indie rock bands,unknown_0
Allan Carl Newman,New Pornographers,reemergence,reemerged as the leader of the band,unknown_0
New Pornographers,commercial success,achieved,enjoyed commercial success,unknown_0
New Pornographers,critical success,achieved,enjoyed critical success,unknown_0
Kings of Leon,Caleb Followill,member,lead vocalist and rhythm guitarist,unknown_0
Kings of Leon,Nathan Followill,member,drummer and percussionist,unknown_0
Kings of Leon,Jared Followill,member,bassist and backing vocalist,unknown_0
Kings of Leon,Matthew Followill,member,lead guitarist and backing vocalist,unknown_0
Kings of Leon,Nashville,formed in,city where the band was formed,unknown_0
Kings of Leon,Tennessee,formed in state,state where the band was formed,unknown_0
Little Scout,Brisbane,location,Little Scout is based in Brisbane,unknown_0
Little Scout,Australia,location,Little Scout is from Australia,unknown_0
Little Scout,Band,type,Little Scout is a band,unknown_0
Little Scout,EP,release,Little Scout has released EPs,unknown_0
Little Scout,Album,release,Little Scout has released an album,unknown_0
Little Scout,Tour,event,Little Scout has toured with other bands,unknown_0
Little Scout,Triple J,feature,Little Scout was featured on Triple J,unknown_0
Little Scout,Vimeo,feature,Little Scout was featured on Vimeo,unknown_0
Little Scout,Debut Album,event,Little Scout released their debut album,unknown_0
Neko Richelle Case,The New Pornographers,member,Neko Richelle Case is a member of The New Pornographers,unknown_0
Neko Richelle Case,singer-songwriter,instance_of,Neko Richelle Case is a singer-songwriter,unknown_0
The New Pornographers,indie rock,genre,The New Pornographers is an indie rock group,unknown_0
Neko Richelle Case,American,nationality,Neko Richelle Case is American,unknown_0
GOOD PEOPLE ROCK,Yellow Bird Project,part_of,GOOD PEOPLE ROCK is a part of the Yellow Bird Project,unknown_0
GOOD PEOPLE ROCK,Album,instance_of,GOOD PEOPLE ROCK is an instance of an album,unknown_0
GOOD PEOPLE ROCK,Compilation,instance_of,GOOD PEOPLE ROCK is an instance of a compilation,unknown_0
Madic Records,Arts & Crafts Productions,owned_by,Madic Records is owned by Arts & Crafts Productions,unknown_0
Dan Mangan,Arts & Crafts Productions,owns,Dan Mangan owns Arts & Crafts Productions,unknown_0
PledgeMusic,GOOD PEOPLE ROCK,funded_via,GOOD PEOPLE ROCK was funded via PledgeMusic,unknown_0
Andrew Bird,The New Pornographers,member_of,Andrew Bird is a member of The New Pornographers,unknown_0
The New Pornographers,The Fake Headlines,created,The New Pornographers created The Fake Headlines,unknown_0
Andrew Bird,The Fake Headlines,covered,Andrew Bird covered The Fake Headlines,unknown_0
Pitchfork Media,GOOD PEOPLE ROCK,published_on,Pitchfork Media published information about GOOD PEOPLE ROCK,unknown_0
GOOD PEOPLE ROCK,Music Video,has,GOOD PEOPLE ROCK has a music video,unknown_0
"April 7, 2015",GOOD PEOPLE ROCK,date_of,"GOOD PEOPLE ROCK was released on April 7, 2015",unknown_0
Kathryn Jane Calder,The New Pornographers,member,Kathryn Jane Calder is a member of The New Pornographers,unknown_0
Kathryn Jane Calder,Immaculate Machine,former member,Kathryn Jane Calder was a former member of Immaculate Machine,unknown_0
Kathryn Jane Calder,Neko Case,replaced,Kathryn Jane Calder replaced Neko Case for live performances,unknown_0
Kathryn Jane Calder,The New Pornographers,permanent member,Kathryn Jane Calder became a permanent member of The New Pornographers in 2006,unknown_0
Kurt Colin Dahle,Age of Electric,member,played drums and sang for the band,unknown_0
Kurt Colin Dahle,Limblifter,member,played drums and sang for the band,unknown_0
Kurt Colin Dahle,The New Pornographers,member,played drums and sang for the band,unknown_0
Kurt Colin Dahle,drummer,instance_of,played drums,unknown_0
Kurt Colin Dahle,vocalist,instance_of,sang,unknown_0
Kurt Colin Dahle,musician,instance_of,played music,unknown_0
Phantom Buffalo,The Ponys,predecessor,Phantom Buffalo was previously known as The Ponys,unknown_0
Phantom Buffalo,South by Southwest,performance,Phantom Buffalo performed at South by Southwest,unknown_0
Phantom Buffalo,Jonathan Balzano-Brookes,member,Jonathan Balzano-Brookes is a member of Phantom Buffalo,unknown_0
Phantom Buffalo,Tim Burns,member,Tim Burns is a member of Phantom Buffalo,unknown_0
Phantom Buffalo,Joe Domrad,member,Joe Domrad is a member of Phantom Buffalo,unknown_0
Phantom Buffalo,Jacob Chamberlain,member,Jacob Chamberlain is a member of Phantom Buffalo,unknown_0
Phantom Buffalo,Sean Newton,member,Sean Newton is a member of Phantom Buffalo,unknown_0
Phantom Buffalo,Philip Willey,member,Philip Willey is a member of Phantom Buffalo,unknown_0
Phantom Buffalo,Time-Lag Records,record label,Phantom Buffalo released music on Time-Lag Records,unknown_0
Phantom Buffalo,Rough Trade Records,record label,Phantom Buffalo released music on Rough Trade Records,unknown_0
Phantom Buffalo,indie-rock,genre,Phantom Buffalo is an indie-rock band,unknown_0
Phantom Buffalo,Portland,location,"Phantom Buffalo is from Portland, Maine",unknown_0
Phantom Buffalo,The Byrds,influence,Phantom Buffalo's music is compared to The Byrds,unknown_0
Phantom Buffalo,The Chills,influence,Phantom Buffalo's music is compared to The Chills,unknown_0
Phantom Buffalo,The Shins,influence,Phantom Buffalo's music is compared to The Shins,unknown_0
Phantom Buffalo,The New Pornographers,influence,Phantom Buffalo's music is compared to The New Pornographers,unknown_0
The New Pornographers,Canadian indie rock,genre,The New Pornographers is a Canadian indie rock band,unknown_0
The New Pornographers,Vancouver,location,"The New Pornographers was formed in Vancouver, British Columbia",unknown_0
The New Pornographers,British Columbia,location,"The New Pornographers was formed in Vancouver, British Columbia",unknown_0
The New Pornographers,musical collective,type,The New Pornographers is a musical collective,unknown_0
The New Pornographers,singer-songwriters,member,The New Pornographers features singer-songwriters,unknown_0
The New Pornographers,musicians,member,The New Pornographers features musicians,unknown_0
The New Pornographers,power pop,influence,The New Pornographers incorporates elements of power pop into their music,unknown_0
The New Pornographers,studio albums,release,The New Pornographers has released seven studio albums,unknown_0
655 Park Avenue,Park Avenue,located_on,655 Park Avenue is located on Park Avenue,unknown_0
655 Park Avenue,Manhattan,located_in,655 Park Avenue is located in Manhattan,unknown_0
655 Park Avenue,Upper East Side,located_in,655 Park Avenue is located in the Upper East Side,unknown_0
655 Park Avenue,Dwight P. Robinson & Company,developed_by,655 Park Avenue was developed by Dwight P. Robinson & Company,unknown_0
655 Park Avenue,James Edwin Ruthven Carpenter,designed_by,655 Park Avenue was designed by James Edwin Ruthven Carpenter,unknown_0
655 Park Avenue,Mott B. Schmidt,designed_by,655 Park Avenue was designed by Mott B. Schmidt,unknown_0
James Edwin Ruthven Carpenter,Georgian-style,associated_with,James Edwin Ruthven Carpenter is associated with the Georgian-style,unknown_0
Mott B. Schmidt,American Georgian Classical style,associated_with,Mott B. Schmidt is associated with the American Georgian Classical style,unknown_0
Mott B. Schmidt,Sutton Place,designed,Mott B. Schmidt designed Sutton Place,unknown_0
101 Park Avenue,New York City,located_in,101 Park Avenue is located in New York City,unknown_0
101 Park Avenue,Eli Attia Architects,designed_by,Eli Attia Architects designed 101 Park Avenue,unknown_0
101 Park Avenue,skyscraper,instance_of,101 Park Avenue is an example of a skyscraper,unknown_0
101 Park Avenue,completion,involved_in,101 Park Avenue was involved in the completion process,unknown_0
101 Park Avenue,height,has,101 Park Avenue has a height of 629 ft,unknown_0
101 Park Avenue,floors,has,101 Park Avenue has 49 floors,unknown_0
South Phoenix,Gila River Indian Community,boundary,shares a boundary,unknown_0
South Phoenix,Phoenix,part_of,region of Phoenix,unknown_0
South Phoenix,South Mountain Village,contains,includes as an urban village,unknown_0
South Phoenix,Laveen Village,contains,includes as an urban village,unknown_0
South Phoenix,Ahwatukee Village,contains,includes as an urban village,unknown_0
South Mountain Village,Central Phoenix,adjacent_to,located next to,unknown_0
Laveen Village,West Phoenix,adjacent_to,located next to,unknown_0
Ahwatukee Village,East Phoenix,adjacent_to,located next to,unknown_0
South Phoenix,Tempe,adjacent_to,located next to,unknown_0
South Phoenix,Chandler,adjacent_to,located next to,unknown_0
750 Seventh Avenue,New York City,located_in,building is located in the city,unknown_0
750 Seventh Avenue,Kevin Roche John Dinkeloo & Associates,designed_by,building was designed by the architecture firm,unknown_0
750 Seventh Avenue,Hines,owned_by,building is owned by the real estate investment company,unknown_0
750 Seventh Avenue,New York City Building Code,regulated_by,building code regulates the building's design,unknown_0
750 Seventh Avenue,LEED certification,certified_with,building is certified with the environmental certification,unknown_0
completion,750 Seventh Avenue,resulted_in,completion of the project resulted in the building,unknown_0
ownership,Hines,resulted_in,ownership of the building resulted in Hines,unknown_0
Berkeley,Denver,located_in,"Berkeley is a neighborhood in Denver, Colorado",unknown_0
Berkeley,Northwest Denver,part_of,Berkeley is part of Northwest Denver,unknown_0
Federal Boulevard,Berkeley,borders,Federal Boulevard borders Berkeley,unknown_0
I-70,Berkeley,borders,I-70 borders Berkeley,unknown_0
Sheridan Boulevard,Berkeley,borders,Sheridan Boulevard borders Berkeley,unknown_0
Tennyson Street,Berkeley,contains,Tennyson Street contains shops and businesses in Berkeley,unknown_0
Highland Square,Tennyson Street,rivals,Highland Square and Tennyson Street are rival commercial centers,unknown_0
Rick Garcia,Tennyson Street,promotes,Rick Garcia promoted the development of Tennyson Street,unknown_0
Art Walk,Tennyson Street,held_on,Art Walk is held on Tennyson Street,unknown_0
Growth,Berkeley,affects,Growth has affected Berkeley,unknown_0
Property Values,Berkeley,increases,Property Values have increased in Berkeley,unknown_0
Development,Tennyson Street,promotes,Development has promoted Tennyson Street,unknown_0
Commercial Center,Tennyson Street,is,Tennyson Street is a commercial center,unknown_0
Cultural Center,Tennyson Street,is,Tennyson Street is a cultural center,unknown_0
Church of St. Ignatius of Loyola,Society of Jesus,administered_by,The church is administered by the Society of Jesus,unknown_0
Church of St. Ignatius of Loyola,Archdiocese of New York,under_authority_of,The parish is under the authority of the Archdiocese of New York,unknown_0
Church of St. Ignatius of Loyola,St. Ignatius of Loyola,named_after,The church is named after St. Ignatius of Loyola,unknown_0
Church of St. Ignatius of Loyola,Park Avenue,located_on,The church is located on Park Avenue,unknown_0
Church of St. Ignatius of Loyola,Wallace Hall,part_of,The church is part of a Jesuit complex that includes Wallace Hall,unknown_0
Church of St. Ignatius of Loyola,Rectory,adjacent_to,The church is adjacent to the rectory,unknown_0
Church of St. Ignatius of Loyola,St. Ignatius's School,adjacent_to,The church is adjacent to St. Ignatius's School,unknown_0
Church of St. Ignatius of Loyola,Loyola School,adjacent_to,The church is adjacent to Loyola School,unknown_0
Church of St. Ignatius of Loyola,Regis High School,adjacent_to,The church is adjacent to Regis High School,unknown_0
Church of St. Ignatius of Loyola,National Register of Historic Places,listed_in,The church is listed in the National Register of Historic Places,unknown_0
"July 24, 1980",Church of St. Ignatius of Loyola,added_to,"The church was added to the National Register of Historic Places on July 24, 1980",unknown_0
Squire Park,Seattle,located_in,Squire Park is a district in Seattle,unknown_0
Squire Park,Washington,located_in,Squire Park is located in the state of Washington,unknown_0
Squire Park Community Council,Squire Park,governs,The Squire Park Community Council governs Squire Park,unknown_0
First Hill,Squire Park,part_of,Squire Park is part of the First Hill neighborhood,unknown_0
Central District,Squire Park,part_of,Squire Park is part of the Central District neighborhood,unknown_0
Swedish Medical Center,Cherry Hill campus,has,Swedish Medical Center has a campus in Cherry Hill,unknown_0
Seattle University,Squire Park,located_in,Seattle University has part of its campus in Squire Park,unknown_0
Admissions,Seattle University,part_of,Admissions is part of Seattle University,unknown_0
Dormitories,Seattle University,part_of,Dormitories are part of Seattle University,unknown_0
Athletics,Seattle University,part_of,Athletics is part of Seattle University,unknown_0
Hounsfield Heights/Briar Hill,Calgary,located_in,Hounsfield Heights/Briar Hill is a neighbourhood in Calgary,unknown_0
Hounsfield Heights/Briar Hill,Alberta,located_in,Hounsfield Heights/Briar Hill is located in Alberta,unknown_0
Hounsfield Heights/Briar Hill,Canada,located_in,Hounsfield Heights/Briar Hill is located in Canada,unknown_0
Hounsfield Heights/Briar Hill,Hillhurst,adjacent_to,Hounsfield Heights/Briar Hill is adjacent to Hillhurst,unknown_0
Hounsfield Heights/Briar Hill,West Hillhurst,adjacent_to,Hounsfield Heights/Briar Hill is adjacent to West Hillhurst,unknown_0
Hounsfield Heights/Briar Hill,Lions Park C-Train station,contains,Lions Park C-Train station is located within Hounsfield Heights/Briar Hill,unknown_0
Hounsfield Heights/Briar Hill,Escarpment,built_on,Hounsfield Heights/Briar Hill is built on an escarpment,unknown_0
Hounsfield Heights/Briar Hill,Downtown Calgary,views,Hounsfield Heights/Briar Hill offers views of downtown Calgary,unknown_0
Hounsfield Heights/Briar Hill,Rocky Mountains,views,Hounsfield Heights/Briar Hill offers views of the Rocky Mountains,unknown_0
Greenwich Avenue,Greenwich Village,location,Greenwich Avenue is located in Greenwich Village,unknown_0
Greenwich Avenue,Manhattan,location,Greenwich Avenue is located in Manhattan,unknown_0
Greenwich Avenue,New York City,location,Greenwich Avenue is located in New York City,unknown_0
Greenwich Avenue,West Village Park,boundary,Greenwich Avenue is a boundary of West Village Park,unknown_0
West Village Park,7th Avenue,boundary,West Village Park is bounded by 7th Avenue,unknown_0
West Village Park,12th Street,boundary,West Village Park is bounded by 12th Street,unknown_0
Greenwich Avenue,6th Avenue,intersection,Greenwich Avenue intersects with 6th Avenue,unknown_0
Greenwich Avenue,8th Street,intersection,Greenwich Avenue intersects with 8th Street,unknown_0
Greenwich Avenue,8th Avenue,intersection,Greenwich Avenue intersects with 8th Avenue,unknown_0
West Village Park,Construction,event,Construction of West Village Park began in 2016,unknown_0
Tinley Park Station,Tinley Park,located_in,The station is located in Tinley Park,unknown_0
Tinley Park Station,Metra,part_of,The station is part of the Metra commuter rail system,unknown_0
Tinley Park Station,Rock Island District,served_by,The station is served by the Rock Island District line,unknown_0
Tinley Park Station,Illinois,located_in,The station is located in the state of Illinois,unknown_0
LaSalle Street,Tinley Park Station,terminus_of,LaSalle Street is the northern terminus of the line,unknown_0
Parking,Tinley Park Station,available_at,Parking is available at the station,unknown_0
Kyōryū Sentai Zyuranger,Super Sentai,part_of,Kyōryū Sentai Zyuranger is part of the Super Sentai franchise,unknown_0
Kyōryū Sentai Zyuranger,Toei,produced_by,Toei produced Kyōryū Sentai Zyuranger,unknown_0
Kyōryū Sentai Zyuranger,Bandai,produced_by,Bandai produced Kyōryū Sentai Zyuranger,unknown_0
Kyōryū Sentai Zyuranger,TV Asahi,aired_on,Kyōryū Sentai Zyuranger aired on TV Asahi,unknown_0
Kyōryū Sentai Zyuranger,Sixth Ranger,features,Kyōryū Sentai Zyuranger features a regular Sixth Ranger,unknown_0
Kyōryū Sentai Zyuranger,Power Rangers,adapted_into,Kyōryū Sentai Zyuranger was adapted into an installment of Power Rangers,unknown_0
Kyōryū Sentai Zyuranger,Mighty Morphin Power Rangers,footage_used_in,Footage from Kyōryū Sentai Zyuranger was used in Mighty Morphin Power Rangers,unknown_0
Kyōryū Sentai Zyuranger,Galaxy Rangers,title_for_international_distribution,Toei gives Kyōryū Sentai Zyuranger the title Galaxy Rangers for international distribution,unknown_0
GoGo Sentai Boukenger,Toei,production company,Toei produced GoGo Sentai Boukenger,unknown_0
GoGo Sentai Boukenger,Super Sentai series,part of,GoGo Sentai Boukenger is part of the Super Sentai series,unknown_0
GoGo Sentai Boukenger,TV Asahi,broadcast on,GoGo Sentai Boukenger premiered on TV Asahi,unknown_0
GoGo Sentai Boukenger,Power Rangers Operation Overdrive,footage used in,GoGo Sentai Boukenger footage was used in Power Rangers Operation Overdrive,unknown_0
GoGo Sentai Boukenger,Power Rangers Treasure Force,dubbed into,GoGo Sentai Boukenger was dubbed into Korean for Power Rangers Treasure Force,unknown_0
Gosei Sentai Dairanger,Super Sentai franchise,part_of,Gosei Sentai Dairanger is part of the Super Sentai franchise,unknown_0
Gosei Sentai Dairanger,Toei Company,produced_by,Toei Company produced Gosei Sentai Dairanger,unknown_0
Gosei Sentai Dairanger,Kyōryū Sentai Zyuranger,follows,Gosei Sentai Dairanger follows Kyōryū Sentai Zyuranger,unknown_0
Gosei Sentai Dairanger,Tokusatsu,style,Gosei Sentai Dairanger is a tokusatsu series,unknown_0
Gosei Sentai Dairanger,"February 19, 1993",starts_on,"Gosei Sentai Dairanger started broadcasting on February 19, 1993",unknown_0
Gosei Sentai Dairanger,"February 11, 1994",ends_on,"Gosei Sentai Dairanger ended broadcasting on February 11, 1994",unknown_0
Gosei Sentai Dairanger,Star Rangers,also_known_as,Gosei Sentai Dairanger is also known as Star Rangers,unknown_0
Engine Sentai Go-onger,Toei Company,produced_by,Engine Sentai Go-onger was produced by Toei Company,unknown_0
Engine Sentai Go-onger,Super Sentai series,part_of,Engine Sentai Go-onger is part of the Super Sentai series,unknown_0
Engine Sentai Go-onger,Japanese tokusatsu television series,instance_of,Engine Sentai Go-onger is an instance of Japanese tokusatsu television series,unknown_0
"February 17, 2008",Engine Sentai Go-onger,premiered,"Engine Sentai Go-onger premiered on February 17, 2008",unknown_0
"February 8, 2009",Engine Sentai Go-onger,ended,"Engine Sentai Go-onger ended on February 8, 2009",unknown_0
Kamen Rider Kiva,TV Asahi's 2008 Super Hero Time block,aired_with,Kamen Rider Kiva aired with Engine Sentai Go-onger in TV Asahi's 2008 Super Hero Time block,unknown_0
Power Rangers RPM,Engine Sentai Go-onger,based_on,Power Rangers RPM was based on Engine Sentai Go-onger,unknown_0
Power Rangers Engine Force,Power Rangers RPM,dubbed_version,Power Rangers Engine Force is the Korean dubbed version of Power Rangers RPM,unknown_0
"Rushing by at full-throttle mach speed, our slogan is 'go on!'",Engine Sentai Go-onger,catchphrase,"Rushing by at full-throttle mach speed, our slogan is 'go on!' is the catchphrase of Engine Sentai Go-onger",unknown_0
Power Rangers,Saban Entertainment,produced by,Saban Entertainment produced the first Power Rangers series,unknown_0
Power Rangers,BVS Entertainment,produced by,BVS Entertainment produced the Power Rangers series after Saban Entertainment,unknown_0
Power Rangers,SCG Power Rangers,produced by,SCG Power Rangers produces the Power Rangers series today,unknown_0
Power Rangers,Super Sentai,based on,Power Rangers is based on the Japanese tokusatsu series Super Sentai,unknown_0
